{"ts":"2026-07-20T08:34:22.448Z","commit":"eaefda9","issue":99,"route":"lab->xyz","tier":"cpu","input_size":50000000,"metric":"throughput_mpx_s","value":172.32,"ms":290.152,"iters":3,"warmup":1,"host":"vipavani","gpu_present":false,"decision":"kept","baseline_ref":"eaefda9","notes":"wide::f32x8 SIMD batch (inv lab transfer mask-blend + wp scale), N=50,000,000, speedup=1.70x, tol=1e-3"}
{"ts":"2026-07-20T08:35:15.000Z","commit":"eaefda9","issue":99,"route":"lab->xyz","tier":"js","input_size":10000000,"metric":"throughput_mpx_s","value":7.6,"ms":1313.564,"host":"vipavani","gpu_present":false,"decision":"baseline","notes":"JS color-convert@3.1.3 baseline, N=10M (mulberry32 seed=42)"}
{"ts":"2026-07-14T12:30:00.000Z","commit":"eeced0c","issue":100,"route":"oklab->rgb","tier":"js","input_size":10000000,"metric":"throughput_mpx_s","value":8.04,"ms":1243.790,"iters":3,"warmup":1,"host":"vipavani","gpu_present":false,"decision":"baseline","notes":"JS color-convert@3.1.3 oklab->rgb baseline. Measured standalone (bench.mjs is rgb-input-centric; oklab->rgb needs oklab inputs generated via rgb.oklab first, untimed). N=10M."}
{"ts":"2026-07-14T12:30:00.000Z","commit":"eeced0c","issue":100,"route":"oklab->rgb","tier":"cpu","input_size":50000000,"metric":"throughput_mpx_s","value":19.98,"ms":2501.972,"iters":3,"warmup":1,"host":"vipavani","gpu_present":false,"decision":"baseline","notes":"Rust scalar batch baseline (f64 oklab::rgb, materialized Vec to prevent elision), N=50,000,000"}
{"ts":"2026-07-14T12:30:00.000Z","commit":"eeced0c","issue":100,"route":"oklab->rgb","tier":"cpu","input_size":50000000,"metric":"throughput_mpx_s","value":49.53,"ms":1009.479,"iters":3,"warmup":1,"host":"vipavani","gpu_present":false,"baseline_ref":"eeced0c","decision":"kept","notes":"wide::f32x8 SIMD batch (inverse Oklab matrix + cube + inverse LMS + forward gamma), N=50,000,000, speedup=2.48x vs scalar, 6.16x vs JS, tol=1e-2"}
{"ts":"2026-07-20T09:13:07.242Z","commit":"08d48aa","issue":104,"route":"rgb->hsl","tier":"js","input_size":10000000,"metric":"throughput_mpx_s","value":18.51,"ms":540.294,"iters":3,"warmup":1,"host":"vipavani","gpu_present":false,"decision":"baseline","notes":"JS color-convert@3.1.3 baseline, N=10,000,000"}
{"ts":"2026-07-20T09:13:12.822Z","commit":"08d48aa","issue":104,"route":"rgb->lab","tier":"js","input_size":10000000,"metric":"throughput_mpx_s","value":7.2,"ms":1388.975,"iters":3,"warmup":1,"host":"vipavani","gpu_present":false,"decision":"baseline","notes":"JS color-convert@3.1.3 baseline, N=10,000,000"}
{"ts":"2026-07-20T09:13:17.813Z","commit":"08d48aa","issue":104,"route":"rgb->xyz","tier":"js","input_size":10000000,"metric":"throughput_mpx_s","value":8.26,"ms":1210.778,"iters":3,"warmup":1,"host":"vipavani","gpu_present":false,"decision":"baseline","notes":"JS color-convert@3.1.3 baseline, N=10,000,000"}
{"ts":"2026-07-20T09:13:20.357Z","commit":"08d48aa","issue":104,"route":"rgb->hsv","tier":"js","input_size":10000000,"metric":"throughput_mpx_s","value":17.39,"ms":574.98,"iters":3,"warmup":1,"host":"vipavani","gpu_present":false,"decision":"baseline","notes":"JS color-convert@3.1.3 baseline, N=10,000,000"}
{"ts":"2026-07-20T09:13:22.417Z","commit":"08d48aa","issue":104,"route":"rgb->cmyk","tier":"js","input_size":10000000,"metric":"throughput_mpx_s","value":19.93,"ms":501.882,"iters":3,"warmup":1,"host":"vipavani","gpu_present":false,"decision":"baseline","notes":"JS color-convert@3.1.3 baseline, N=10,000,000"}
{"ts":"2026-07-20T09:13:24.802Z","commit":"08d48aa","issue":104,"route":"rgb->hwb","tier":"js","input_size":10000000,"metric":"throughput_mpx_s","value":17.54,"ms":570.149,"iters":3,"warmup":1,"host":"vipavani","gpu_present":false,"decision":"baseline","notes":"JS color-convert@3.1.3 baseline, N=10,000,000"}
{"ts":"2026-07-20T09:13:27.662Z","commit":"08d48aa","issue":104,"route":"rgb->hcg","tier":"js","input_size":10000000,"metric":"throughput_mpx_s","value":14.54,"ms":687.984,"iters":3,"warmup":1,"host":"vipavani","gpu_present":false,"decision":"baseline","notes":"JS color-convert@3.1.3 baseline, N=10,000,000"}
{"ts":"2026-07-20T09:13:32.947Z","commit":"08d48aa","issue":104,"route":"rgb->oklab","tier":"js","input_size":10000000,"metric":"throughput_mpx_s","value":7.99,"ms":1251.174,"iters":3,"warmup":1,"host":"vipavani","gpu_present":false,"decision":"baseline","notes":"JS color-convert@3.1.3 baseline, N=10,000,000"}
{"ts":"2026-07-20T09:13:33.508Z","commit":"08d48aa","issue":104,"route":"rgb->apple","tier":"js","input_size":10000000,"metric":"throughput_mpx_s","value":83.18,"ms":120.225,"iters":3,"warmup":1,"host":"vipavani","gpu_present":false,"decision":"baseline","notes":"JS color-convert@3.1.3 baseline, N=10,000,000"}
{"ts":"2026-07-20T09:13:37.870Z","commit":"08d48aa","issue":104,"route":"rgb->hsl->rgb","tier":"js","input_size":10000000,"metric":"throughput_mpx_s","value":9.82,"ms":1018.364,"iters":3,"warmup":1,"host":"vipavani","gpu_present":false,"decision":"baseline","notes":"JS color-convert@3.1.3 baseline, N=10,000,000"}
{"ts":"2026-07-20T09:13:41.850Z","commit":"08d48aa","issue":104,"route":"hsv->rgb","tier":"js","input_size":10000000,"metric":"throughput_mpx_s","value":17.68,"ms":565.64,"iters":3,"warmup":1,"host":"vipavani","gpu_present":false,"decision":"baseline","notes":"JS color-convert@3.1.3 baseline, N=10,000,000"}
{"ts":"2026-07-20T09:13:55.276Z","commit":"08d48aa","issue":104,"route":"rgb->xyz","tier":"cpu","input_size":50000000,"metric":"throughput_mpx_s","value":46.32,"ms":1079.351,"iters":3,"warmup":1,"host":"vipavani","gpu_present":false,"decision":"baseline","notes":"wide::f64x4 SIMD batch, N=50,000,000"}
{"ts":"2026-07-20T09:14:02.418Z","commit":"08d48aa","issue":104,"route":"rgb->lab","tier":"cpu","input_size":50000000,"metric":"throughput_mpx_s","value":28.05,"ms":1782.648,"iters":3,"warmup":1,"host":"vipavani","gpu_present":false,"decision":"baseline","notes":"wide::f32x8 SIMD two-step chain (xyz→lab), #61 baseline, N=50,000,000"}
{"ts":"2026-07-20T09:14:08.702Z","commit":"08d48aa","issue":104,"route":"rgb->lab","tier":"cpu","input_size":50000000,"metric":"throughput_mpx_s","value":31.88,"ms":1568.573,"iters":3,"warmup":1,"host":"vipavani","gpu_present":false,"decision":"kept","baseline_ref":"08d48aa","notes":"wide::f32x8 SIMD fused single-pass (rgb→lab), N=50,000,000"}
{"ts":"2026-07-20T09:14:14.125Z","commit":"08d48aa","issue":104,"route":"rgb->hsl","tier":"cpu","input_size":50000000,"metric":"throughput_mpx_s","value":36.96,"ms":1352.787,"iters":3,"warmup":1,"host":"vipavani","gpu_present":false,"decision":"baseline","notes":"Rust scalar batch baseline (pre-SIMD), N=50,000,000"}
{"ts":"2026-07-20T09:14:15.549Z","commit":"08d48aa","issue":104,"route":"rgb->hsl","tier":"cpu","input_size":50000000,"metric":"throughput_mpx_s","value":141.13,"ms":354.278,"iters":3,"warmup":1,"host":"vipavani","gpu_present":false,"decision":"kept","notes":"wide::f32x8 SIMD batch (mask-blend hue), N=50,000,000"}
{"ts":"2026-07-20T09:14:25.111Z","commit":"08d48aa","issue":104,"route":"rgb->hsl->rgb","tier":"cpu","input_size":50000000,"metric":"throughput_mpx_s","value":20.96,"ms":2385.416,"iters":3,"warmup":1,"host":"vipavani","gpu_present":false,"decision":"baseline","notes":"Rust scalar batch baseline (pre-SIMD roundtrip), N=50,000,000"}
{"ts":"2026-07-20T09:14:28.252Z","commit":"08d48aa","issue":104,"route":"rgb->hsl->rgb","tier":"cpu","input_size":50000000,"metric":"throughput_mpx_s","value":64.21,"ms":778.645,"iters":3,"warmup":1,"host":"vipavani","gpu_present":false,"decision":"kept","baseline_ref":"08d48aa","notes":"wide::f32x8 SIMD batch round-trip (rgb→hsl→rgb), N=50,000,000"}
{"ts":"2026-07-20T09:14:31.452Z","commit":"08d48aa","issue":104,"route":"rgb->cmyk","tier":"cpu","input_size":50000000,"metric":"throughput_mpx_s","value":64.15,"ms":779.436,"iters":3,"warmup":1,"host":"vipavani","gpu_present":false,"decision":"baseline","notes":"Rust scalar batch baseline (pre-SIMD), N=50,000,000"}
{"ts":"2026-07-20T09:14:32.998Z","commit":"08d48aa","issue":104,"route":"rgb->cmyk","tier":"cpu","input_size":50000000,"metric":"throughput_mpx_s","value":130.57,"ms":382.945,"iters":3,"warmup":1,"host":"vipavani","gpu_present":false,"decision":"kept","baseline_ref":"08d48aa","notes":"wide::f32x8 SIMD batch (mask-blend black guard), N=50,000,000"}
{"ts":"2026-07-20T09:14:38.073Z","commit":"08d48aa","issue":104,"route":"rgb->hsv","tier":"cpu","input_size":50000000,"metric":"throughput_mpx_s","value":39.47,"ms":1266.945,"iters":3,"warmup":1,"host":"vipavani","gpu_present":false,"decision":"baseline","notes":"Rust scalar batch baseline (pre-SIMD), N=50,000,000"}
{"ts":"2026-07-20T09:14:39.498Z","commit":"08d48aa","issue":104,"route":"rgb->hsv","tier":"cpu","input_size":50000000,"metric":"throughput_mpx_s","value":141.75,"ms":352.722,"iters":3,"warmup":1,"host":"vipavani","gpu_present":false,"decision":"kept","baseline_ref":"08d48aa","notes":"wide::f32x8 SIMD batch (mask-blend hue), N=50,000,000"}
{"ts":"2026-07-20T09:15:01.529Z","commit":"08d48aa","issue":104,"route":"rgb->oklab","tier":"cpu","input_size":50000000,"metric":"throughput_mpx_s","value":9.10,"ms":5497.136,"iters":3,"warmup":1,"host":"vipavani","gpu_present":false,"decision":"baseline","notes":"Rust scalar batch baseline (pre-SIMD), N=50,000,000"}
{"ts":"2026-07-20T09:15:07.836Z","commit":"08d48aa","issue":104,"route":"rgb->oklab","tier":"cpu","input_size":50000000,"metric":"throughput_mpx_s","value":31.75,"ms":1575.014,"iters":3,"warmup":1,"host":"vipavani","gpu_present":false,"decision":"kept","baseline_ref":"08d48aa","notes":"wide::f32x8 SIMD batch (powf/cbrt + dual matrix), N=50,000,000, speedup=3.49x, tol=1e-3"}
{"ts":"2026-07-20T09:15:12.270Z","commit":"08d48aa","issue":104,"route":"rgb->hwb","tier":"cpu","input_size":50000000,"metric":"throughput_mpx_s","value":45.54,"ms":1097.881,"iters":3,"warmup":1,"host":"vipavani","gpu_present":false,"decision":"baseline","notes":"Rust scalar batch baseline (pre-SIMD), N=50,000,000"}
{"ts":"2026-07-20T09:15:13.647Z","commit":"08d48aa","issue":104,"route":"rgb->hwb","tier":"cpu","input_size":50000000,"metric":"throughput_mpx_s","value":146.58,"ms":341.112,"iters":3,"warmup":1,"host":"vipavani","gpu_present":false,"decision":"kept","baseline_ref":"08d48aa","notes":"wide::f32x8 SIMD batch (mask-blend hue, from hsl hue), N=50,000,000"}
{"ts":"2026-07-20T09:15:18.739Z","commit":"08d48aa","issue":104,"route":"rgb->hcg","tier":"cpu","input_size":50000000,"metric":"throughput_mpx_s","value":39.48,"ms":1266.414,"iters":3,"warmup":1,"host":"vipavani","gpu_present":false,"decision":"baseline","notes":"Rust scalar batch baseline (pre-SIMD), N=50,000,000"}
{"ts":"2026-07-20T09:15:20.292Z","commit":"08d48aa","issue":104,"route":"rgb->hcg","tier":"cpu","input_size":50000000,"metric":"throughput_mpx_s","value":131.53,"ms":380.145,"iters":3,"warmup":1,"host":"vipavani","gpu_present":false,"decision":"kept","baseline_ref":"08d48aa","notes":"wide::f32x8 SIMD batch (mask-blend hue + chroma-guard grayscale), N=50,000,000, speedup=3.33x, tol=1e-3"}
{"ts":"2026-07-20T09:15:22.246Z","commit":"08d48aa","issue":104,"route":"rgb->apple","tier":"cpu","input_size":50000000,"metric":"throughput_mpx_s","value":103.69,"ms":482.226,"iters":3,"warmup":1,"host":"vipavani","gpu_present":false,"decision":"baseline","notes":"Rust scalar batch baseline (pre-SIMD), N=50,000,000"}
{"ts":"2026-07-20T09:15:23.433Z","commit":"08d48aa","issue":104,"route":"rgb->apple","tier":"cpu","input_size":50000000,"metric":"throughput_mpx_s","value":170.83,"ms":292.684,"iters":3,"warmup":1,"host":"vipavani","gpu_present":false,"decision":"kept","baseline_ref":"08d48aa","notes":"wide::f32x8 SIMD batch (linear scale x257.0), N=50,000,000, speedup=1.65x, tol=1e-6"}
{"ts":"2026-07-20T09:15:33.678Z","commit":"08d48aa","issue":104,"route":"xyz->rgb","tier":"cpu","input_size":50000000,"metric":"throughput_mpx_s","value":21.74,"ms":2299.716,"iters":3,"warmup":1,"host":"vipavani","gpu_present":false,"decision":"baseline","notes":"Rust scalar batch baseline (pre-SIMD, f64 xyz::rgb), N=50,000,000"}
{"ts":"2026-07-20T09:15:37.621Z","commit":"08d48aa","issue":104,"route":"xyz->rgb","tier":"cpu","input_size":50000000,"metric":"throughput_mpx_s","value":50.93,"ms":981.657,"iters":3,"warmup":1,"host":"vipavani","gpu_present":false,"decision":"kept","baseline_ref":"08d48aa","notes":"wide::f32x8 SIMD batch (matrix + forward sRGB gamma), N=50,000,000, speedup=2.34x, tol=0.1"}
{"ts":"2026-07-20T09:15:44.984Z","commit":"08d48aa","issue":104,"route":"lab->xyz","tier":"cpu","input_size":50000000,"metric":"throughput_mpx_s","value":89.35,"ms":559.609,"iters":3,"warmup":1,"host":"vipavani","gpu_present":false,"decision":"baseline","notes":"Rust scalar batch baseline (pre-SIMD, f64 lab::xyz), N=50,000,000"}
{"ts":"2026-07-20T09:15:46.227Z","commit":"08d48aa","issue":104,"route":"lab->xyz","tier":"cpu","input_size":50000000,"metric":"throughput_mpx_s","value":161.58,"ms":309.439,"iters":3,"warmup":1,"host":"vipavani","gpu_present":false,"decision":"kept","baseline_ref":"08d48aa","notes":"wide::f32x8 SIMD batch (inv lab transfer mask-blend + wp scale), N=50,000,000, speedup=1.81x, tol=1e-3"}
{"ts":"2026-07-20T09:15:57.814Z","commit":"08d48aa","issue":104,"route":"oklab->rgb","tier":"cpu","input_size":50000000,"metric":"throughput_mpx_s","value":19.95,"ms":2505.914,"iters":3,"warmup":1,"host":"vipavani","gpu_present":false,"decision":"baseline","notes":"Rust scalar batch baseline (pre-SIMD, f64 oklab::rgb), N=50,000,000"}
{"ts":"2026-07-20T09:16:01.886Z","commit":"08d48aa","issue":104,"route":"oklab->rgb","tier":"cpu","input_size":50000000,"metric":"throughput_mpx_s","value":49.33,"ms":1013.513,"iters":3,"warmup":1,"host":"vipavani","gpu_present":false,"decision":"kept","baseline_ref":"08d48aa","notes":"wide::f32x8 SIMD batch (inverse Oklab + cube + inverse LMS + gamma), N=50,000,000, speedup=2.47x, tol=1e-2"}
{"ts":"2026-07-20T09:16:07.321Z","commit":"08d48aa","issue":104,"route":"hsv->rgb","tier":"cpu","input_size":50000000,"metric":"throughput_mpx_s","value":39.05,"ms":1280.319,"iters":3,"warmup":1,"host":"vipavani","gpu_present":false,"decision":"baseline","notes":"Rust scalar batch baseline (pre-SIMD, f64 hsv::rgb), N=50,000,000"}
{"ts":"2026-07-20T09:16:09.744Z","commit":"08d48aa","issue":104,"route":"hsv->rgb","tier":"cpu","input_size":50000000,"metric":"throughput_mpx_s","value":83.09,"ms":601.737,"iters":3,"warmup":1,"host":"vipavani","gpu_present":false,"decision":"kept","baseline_ref":"08d48aa","notes":"wide::f32x8 SIMD batch (6-way hue-sector mask-blend), N=50,000,000, speedup=2.13x, tol=1e-3"}
{"ts":"2026-07-20T09:14:04.978Z","commit":"67ecbf8","issue":105,"route":"rgb->xyz","tier":"cpu","input_size":50000000,"metric":"throughput_mpx_s","value":45.78,"ms":1092.088,"iters":3,"warmup":1,"host":"vipavani","gpu_present":false,"decision":"baseline","notes":"wide::f64x4 SIMD batch, N=50,000,000"}
{"ts":"2026-07-20T09:14:12.124Z","commit":"67ecbf8","issue":105,"route":"rgb->lab","tier":"cpu","input_size":50000000,"metric":"throughput_mpx_s","value":28.12,"ms":1777.927,"iters":3,"warmup":1,"host":"vipavani","gpu_present":false,"decision":"baseline","notes":"wide::f32x8 SIMD two-step chain (xyz→lab), #61 baseline, N=50,000,000"}
{"ts":"2026-07-20T09:14:18.401Z","commit":"67ecbf8","issue":105,"route":"rgb->lab","tier":"cpu","input_size":50000000,"metric":"throughput_mpx_s","value":31.87,"ms":1568.858,"iters":3,"warmup":1,"host":"vipavani","gpu_present":false,"decision":"kept","baseline_ref":"67ecbf8","notes":"wide::f32x8 SIMD fused single-pass (rgb→lab), N=50,000,000"}
{"ts":"2026-07-20T09:14:23.834Z","commit":"67ecbf8","issue":105,"route":"rgb->hsl","tier":"cpu","input_size":50000000,"metric":"throughput_mpx_s","value":36.99,"ms":1351.622,"iters":3,"warmup":1,"host":"vipavani","gpu_present":false,"decision":"baseline","notes":"Rust scalar batch baseline (pre-SIMD), N=50,000,000"}
{"ts":"2026-07-20T09:14:25.264Z","commit":"67ecbf8","issue":105,"route":"rgb->hsl","tier":"cpu","input_size":50000000,"metric":"throughput_mpx_s","value":140.22,"ms":356.572,"iters":3,"warmup":1,"host":"vipavani","gpu_present":false,"decision":"kept","notes":"wide::f32x8 SIMD batch (mask-blend hue), N=50,000,000"}
{"ts":"2026-07-20T09:14:34.865Z","commit":"67ecbf8","issue":105,"route":"rgb->hsl->rgb","tier":"cpu","input_size":50000000,"metric":"throughput_mpx_s","value":20.86,"ms":2397.132,"iters":3,"warmup":1,"host":"vipavani","gpu_present":false,"decision":"baseline","notes":"Rust scalar batch baseline (pre-SIMD roundtrip), N=50,000,000"}
{"ts":"2026-07-20T09:14:38.019Z","commit":"67ecbf8","issue":105,"route":"rgb->hsl->rgb","tier":"cpu","input_size":50000000,"metric":"throughput_mpx_s","value":63.83,"ms":783.302,"iters":3,"warmup":1,"host":"vipavani","gpu_present":false,"decision":"kept","baseline_ref":"67ecbf8","notes":"wide::f32x8 SIMD batch round-trip (rgb→hsl→rgb), N=50,000,000"}
{"ts":"2026-07-20T09:14:41.253Z","commit":"67ecbf8","issue":105,"route":"rgb->cmyk","tier":"cpu","input_size":50000000,"metric":"throughput_mpx_s","value":63.34,"ms":789.403,"iters":3,"warmup":1,"host":"vipavani","gpu_present":false,"decision":"baseline","notes":"Rust scalar batch baseline (pre-SIMD), N=50,000,000"}
{"ts":"2026-07-20T09:14:42.814Z","commit":"67ecbf8","issue":105,"route":"rgb->cmyk","tier":"cpu","input_size":50000000,"metric":"throughput_mpx_s","value":129.41,"ms":386.381,"iters":3,"warmup":1,"host":"vipavani","gpu_present":false,"decision":"kept","baseline_ref":"67ecbf8","notes":"wide::f32x8 SIMD batch (mask-blend black guard), N=50,000,000"}
{"ts":"2026-07-20T09:14:47.888Z","commit":"67ecbf8","issue":105,"route":"rgb->hsv","tier":"cpu","input_size":50000000,"metric":"throughput_mpx_s","value":39.47,"ms":1266.735,"iters":3,"warmup":1,"host":"vipavani","gpu_present":false,"decision":"baseline","notes":"Rust scalar batch baseline (pre-SIMD), N=50,000,000"}
{"ts":"2026-07-20T09:14:49.285Z","commit":"67ecbf8","issue":105,"route":"rgb->hsv","tier":"cpu","input_size":50000000,"metric":"throughput_mpx_s","value":144.10,"ms":346.974,"iters":3,"warmup":1,"host":"vipavani","gpu_present":false,"decision":"kept","baseline_ref":"67ecbf8","notes":"wide::f32x8 SIMD batch (mask-blend hue), N=50,000,000"}
{"ts":"2026-07-20T09:15:11.336Z","commit":"67ecbf8","issue":105,"route":"rgb->oklab","tier":"cpu","input_size":50000000,"metric":"throughput_mpx_s","value":9.07,"ms":5510.251,"iters":3,"warmup":1,"host":"vipavani","gpu_present":false,"decision":"baseline","notes":"Rust scalar batch baseline (pre-SIMD), N=50,000,000"}
{"ts":"2026-07-20T09:15:17.628Z","commit":"67ecbf8","issue":105,"route":"rgb->oklab","tier":"cpu","input_size":50000000,"metric":"throughput_mpx_s","value":31.85,"ms":1569.699,"iters":3,"warmup":1,"host":"vipavani","gpu_present":false,"decision":"kept","baseline_ref":"67ecbf8","notes":"wide::f32x8 SIMD batch (powf/cbrt + dual matrix), N=50,000,000, speedup=3.51x, tol=1e-3"}
{"ts":"2026-07-20T09:15:22.077Z","commit":"67ecbf8","issue":105,"route":"rgb->hwb","tier":"cpu","input_size":50000000,"metric":"throughput_mpx_s","value":45.04,"ms":1110.246,"iters":3,"warmup":1,"host":"vipavani","gpu_present":false,"decision":"baseline","notes":"Rust scalar batch baseline (pre-SIMD), N=50,000,000"}
{"ts":"2026-07-20T09:15:23.466Z","commit":"67ecbf8","issue":105,"route":"rgb->hwb","tier":"cpu","input_size":50000000,"metric":"throughput_mpx_s","value":144.36,"ms":346.346,"iters":3,"warmup":1,"host":"vipavani","gpu_present":false,"decision":"kept","baseline_ref":"67ecbf8","notes":"wide::f32x8 SIMD batch (mask-blend hue, from hsl hue), N=50,000,000"}
{"ts":"2026-07-20T09:15:28.480Z","commit":"67ecbf8","issue":105,"route":"rgb->hcg","tier":"cpu","input_size":50000000,"metric":"throughput_mpx_s","value":40.02,"ms":1249.470,"iters":3,"warmup":1,"host":"vipavani","gpu_present":false,"decision":"baseline","notes":"Rust scalar batch baseline (pre-SIMD), N=50,000,000"}
{"ts":"2026-07-20T09:15:30.009Z","commit":"67ecbf8","issue":105,"route":"rgb->hcg","tier":"cpu","input_size":50000000,"metric":"throughput_mpx_s","value":131.28,"ms":380.851,"iters":3,"warmup":1,"host":"vipavani","gpu_present":false,"decision":"kept","baseline_ref":"67ecbf8","notes":"wide::f32x8 SIMD batch (mask-blend hue + chroma-guard grayscale), N=50,000,000, speedup=3.28x, tol=1e-3"}
{"ts":"2026-07-20T09:15:31.915Z","commit":"67ecbf8","issue":105,"route":"rgb->apple","tier":"cpu","input_size":50000000,"metric":"throughput_mpx_s","value":106.33,"ms":470.234,"iters":3,"warmup":1,"host":"vipavani","gpu_present":false,"decision":"baseline","notes":"Rust scalar batch baseline (pre-SIMD), N=50,000,000"}
{"ts":"2026-07-20T09:15:33.076Z","commit":"67ecbf8","issue":105,"route":"rgb->apple","tier":"cpu","input_size":50000000,"metric":"throughput_mpx_s","value":173.45,"ms":288.271,"iters":3,"warmup":1,"host":"vipavani","gpu_present":false,"decision":"kept","baseline_ref":"67ecbf8","notes":"wide::f32x8 SIMD batch (linear scale x257.0), N=50,000,000, speedup=1.63x, tol=1e-6"}
{"ts":"2026-07-20T09:15:43.250Z","commit":"67ecbf8","issue":105,"route":"xyz->rgb","tier":"cpu","input_size":50000000,"metric":"throughput_mpx_s","value":21.93,"ms":2279.691,"iters":3,"warmup":1,"host":"vipavani","gpu_present":false,"decision":"baseline","notes":"Rust scalar batch baseline (pre-SIMD, f64 xyz::rgb), N=50,000,000"}
{"ts":"2026-07-20T09:15:47.213Z","commit":"67ecbf8","issue":105,"route":"xyz->rgb","tier":"cpu","input_size":50000000,"metric":"throughput_mpx_s","value":50.68,"ms":986.664,"iters":3,"warmup":1,"host":"vipavani","gpu_present":false,"decision":"kept","baseline_ref":"67ecbf8","notes":"wide::f32x8 SIMD batch (matrix + forward sRGB gamma), N=50,000,000, speedup=2.31x, tol=0.1"}
