{"ts":"2026-07-20T13:43:13.806Z","commit":"c01544c","issue":110,"route":"xyz->lab","tier":"cpu","input_size":50000000,"metric":"throughput_mpx_s","value":145.17,"ms":344.413,"iters":3,"warmup":1,"host":"vipavani","gpu_present":false,"decision":"baseline","notes":"serial SIMD (1 core), N=50,000,000"}
{"ts":"2026-07-20T13:43:15.319Z","commit":"c01544c","issue":110,"route":"xyz->lab","tier":"cpu","input_size":50000000,"metric":"throughput_mpx_s","value":136.87,"ms":365.303,"iters":3,"warmup":1,"host":"vipavani","gpu_present":false,"decision":"reverted","baseline_ref":"c01544c","notes":"parallel SIMD (rayon 28 cores), N=50,000,000, speedup=0.94x"}
{"ts":"2026-07-20T13:43:17.044Z","commit":"c01544c","issue":110,"route":"hsl->rgb","tier":"cpu","input_size":50000000,"metric":"throughput_mpx_s","value":145.40,"ms":343.873,"iters":3,"warmup":1,"host":"vipavani","gpu_present":false,"decision":"baseline","notes":"serial SIMD (1 core), N=50,000,000"}
{"ts":"2026-07-20T13:43:18.631Z","commit":"c01544c","issue":110,"route":"hsl->rgb","tier":"cpu","input_size":50000000,"metric":"throughput_mpx_s","value":141.10,"ms":354.368,"iters":3,"warmup":1,"host":"vipavani","gpu_present":false,"decision":"reverted","baseline_ref":"c01544c","notes":"parallel SIMD (rayon 28 cores), N=50,000,000, speedup=0.97x"}
{"ts":"2026-07-20T13:43:20.320Z","commit":"c01544c","issue":110,"route":"hsv->rgb","tier":"cpu","input_size":50000000,"metric":"throughput_mpx_s","value":147.91,"ms":338.050,"iters":3,"warmup":1,"host":"vipavani","gpu_present":false,"decision":"baseline","notes":"serial SIMD (1 core), N=50,000,000"}
{"ts":"2026-07-20T13:43:21.817Z","commit":"c01544c","issue":110,"route":"hsv->rgb","tier":"cpu","input_size":50000000,"metric":"throughput_mpx_s","value":139.85,"ms":357.534,"iters":3,"warmup":1,"host":"vipavani","gpu_present":false,"decision":"reverted","baseline_ref":"c01544c","notes":"parallel SIMD (rayon 28 cores), N=50,000,000, speedup=0.95x"}
{"ts":"2026-07-20T13:43:23.684Z","commit":"c01544c","issue":110,"route":"oklab->rgb","tier":"cpu","input_size":50000000,"metric":"throughput_mpx_s","value":136.42,"ms":366.522,"iters":3,"warmup":1,"host":"vipavani","gpu_present":false,"decision":"baseline","notes":"serial SIMD (1 core), N=50,000,000"}
{"ts":"2026-07-20T13:43:25.351Z","commit":"c01544c","issue":110,"route":"oklab->rgb","tier":"cpu","input_size":50000000,"metric":"throughput_mpx_s","value":126.64,"ms":394.830,"iters":3,"warmup":1,"host":"vipavani","gpu_present":false,"decision":"reverted","baseline_ref":"c01544c","notes":"parallel SIMD (rayon 28 cores), N=50,000,000, speedup=0.93x"}
{"ts":"2026-07-20T13:43:27.011Z","commit":"c01544c","issue":110,"route":"hcg->rgb","tier":"cpu","input_size":50000000,"metric":"throughput_mpx_s","value":152.52,"ms":327.822,"iters":3,"warmup":1,"host":"vipavani","gpu_present":false,"decision":"baseline","notes":"serial SIMD (1 core), N=50,000,000"}
{"ts":"2026-07-20T13:43:28.462Z","commit":"c01544c","issue":110,"route":"hcg->rgb","tier":"cpu","input_size":50000000,"metric":"throughput_mpx_s","value":145.83,"ms":342.855,"iters":3,"warmup":1,"host":"vipavani","gpu_present":false,"decision":"reverted","baseline_ref":"c01544c","notes":"parallel SIMD (rayon 28 cores), N=50,000,000, speedup=0.96x"}
{"ts":"2026-07-20T13:43:29.918Z","commit":"c01544c","issue":110,"route":"xyz->rgb","tier":"cpu","input_size":50000000,"metric":"throughput_mpx_s","value":141.77,"ms":352.682,"iters":3,"warmup":1,"host":"vipavani","gpu_present":false,"decision":"baseline","notes":"serial SIMD (1 core), N=50,000,000"}
{"ts":"2026-07-20T13:43:31.601Z","commit":"c01544c","issue":110,"route":"xyz->rgb","tier":"cpu","input_size":50000000,"metric":"throughput_mpx_s","value":128.95,"ms":387.761,"iters":3,"warmup":1,"host":"vipavani","gpu_present":false,"decision":"reverted","baseline_ref":"c01544c","notes":"parallel SIMD (rayon 28 cores), N=50,000,000, speedup=0.91x"}
{"ts":"2026-07-20T13:43:33.529Z","commit":"c01544c","issue":110,"route":"lab->xyz","tier":"cpu","input_size":50000000,"metric":"throughput_mpx_s","value":157.53,"ms":317.394,"iters":3,"warmup":1,"host":"vipavani","gpu_present":false,"decision":"baseline","notes":"serial SIMD (1 core), N=50,000,000"}
{"ts":"2026-07-20T13:43:34.874Z","commit":"c01544c","issue":110,"route":"lab->xyz","tier":"cpu","input_size":50000000,"metric":"throughput_mpx_s","value":150.03,"ms":333.266,"iters":3,"warmup":1,"host":"vipavani","gpu_present":false,"decision":"reverted","baseline_ref":"c01544c","notes":"parallel SIMD (rayon 28 cores), N=50,000,000, speedup=0.95x"}
{"ts":"2026-07-20T13:44:51.564Z","commit":"c01544c","issue":23,"route":"rgb->xyz","tier":"cpu","input_size":50000000,"metric":"throughput_mpx_s","value":119.63,"ms":417.972,"iters":3,"warmup":1,"host":"vipavani","gpu_present":false,"decision":"baseline","notes":"wide::f64x4 SIMD batch, N=50,000,000"}
{"ts":"2026-07-20T13:44:55.098Z","commit":"c01544c","issue":23,"route":"rgb->lab","tier":"cpu","input_size":50000000,"metric":"throughput_mpx_s","value":59.79,"ms":836.322,"iters":3,"warmup":1,"host":"vipavani","gpu_present":false,"decision":"baseline","notes":"wide::f32x8 SIMD two-step chain (xyz→lab), #61 baseline, N=50,000,000"}
{"ts":"2026-07-20T13:44:56.883Z","commit":"c01544c","issue":23,"route":"rgb->lab","tier":"cpu","input_size":50000000,"metric":"throughput_mpx_s","value":115.07,"ms":434.501,"iters":3,"warmup":1,"host":"vipavani","gpu_present":false,"decision":"kept","baseline_ref":"c01544c","notes":"wide::f32x8 SIMD fused single-pass (rgb→lab), N=50,000,000"}
{"ts":"2026-07-20T13:45:05.236Z","commit":"c01544c","issue":23,"route":"rgb->hsl","tier":"cpu","input_size":50000000,"metric":"throughput_mpx_s","value":30.24,"ms":1653.578,"iters":3,"warmup":1,"host":"vipavani","gpu_present":false,"decision":"baseline","notes":"Rust scalar batch baseline (pre-SIMD), N=50,000,000"}
{"ts":"2026-07-20T13:45:08.118Z","commit":"c01544c","issue":23,"route":"rgb->hsl","tier":"cpu","input_size":50000000,"metric":"throughput_mpx_s","value":72.64,"ms":688.321,"iters":3,"warmup":1,"host":"vipavani","gpu_present":false,"decision":"kept","notes":"wide::f32x8 SIMD batch (mask-blend hue), N=50,000,000"}
{"ts":"2026-07-20T13:45:31.552Z","commit":"c01544c","issue":23,"route":"rgb->hsl->rgb","tier":"cpu","input_size":50000000,"metric":"throughput_mpx_s","value":8.72,"ms":5734.424,"iters":3,"warmup":1,"host":"vipavani","gpu_present":false,"decision":"baseline","notes":"Rust scalar batch baseline (pre-SIMD roundtrip), N=50,000,000"}
{"ts":"2026-07-20T13:45:37.102Z","commit":"c01544c","issue":23,"route":"rgb->hsl->rgb","tier":"cpu","input_size":50000000,"metric":"throughput_mpx_s","value":50.26,"ms":994.765,"iters":3,"warmup":1,"host":"vipavani","gpu_present":false,"decision":"kept","baseline_ref":"c01544c","notes":"wide::f32x8 SIMD batch round-trip (rgb→hsl→rgb), N=50,000,000"}
{"ts":"2026-07-20T13:45:41.994Z","commit":"c01544c","issue":23,"route":"rgb->cmyk","tier":"cpu","input_size":50000000,"metric":"throughput_mpx_s","value":55.89,"ms":894.561,"iters":3,"warmup":1,"host":"vipavani","gpu_present":false,"decision":"baseline","notes":"Rust scalar batch baseline (pre-SIMD), N=50,000,000"}
{"ts":"2026-07-20T13:45:44.087Z","commit":"c01544c","issue":23,"route":"rgb->cmyk","tier":"cpu","input_size":50000000,"metric":"throughput_mpx_s","value":106.12,"ms":471.174,"iters":3,"warmup":1,"host":"vipavani","gpu_present":false,"decision":"kept","baseline_ref":"c01544c","notes":"wide::f32x8 SIMD batch (mask-blend black guard), N=50,000,000"}
{"ts":"2026-07-20T13:45:49.899Z","commit":"c01544c","issue":23,"route":"rgb->hsv","tier":"cpu","input_size":50000000,"metric":"throughput_mpx_s","value":35.83,"ms":1395.648,"iters":3,"warmup":1,"host":"vipavani","gpu_present":false,"decision":"baseline","notes":"Rust scalar batch baseline (pre-SIMD), N=50,000,000"}
{"ts":"2026-07-20T13:45:51.520Z","commit":"c01544c","issue":23,"route":"rgb->hsv","tier":"cpu","input_size":50000000,"metric":"throughput_mpx_s","value":126.22,"ms":396.144,"iters":3,"warmup":1,"host":"vipavani","gpu_present":false,"decision":"kept","baseline_ref":"c01544c","notes":"wide::f32x8 SIMD batch (mask-blend hue), N=50,000,000"}
{"ts":"2026-07-20T13:46:14.942Z","commit":"c01544c","issue":23,"route":"rgb->oklab","tier":"cpu","input_size":50000000,"metric":"throughput_mpx_s","value":8.81,"ms":5672.400,"iters":3,"warmup":1,"host":"vipavani","gpu_present":false,"decision":"baseline","notes":"Rust scalar batch baseline (pre-SIMD), N=50,000,000"}
{"ts":"2026-07-20T13:46:17.770Z","commit":"c01544c","issue":23,"route":"rgb->oklab","tier":"cpu","input_size":50000000,"metric":"throughput_mpx_s","value":64.09,"ms":780.167,"iters":3,"warmup":1,"host":"vipavani","gpu_present":false,"decision":"kept","baseline_ref":"c01544c","notes":"wide::f32x8 SIMD batch (powf/cbrt + dual matrix), N=50,000,000, speedup=7.27x, tol=1e-3"}
{"ts":"2026-07-20T13:46:26.520Z","commit":"c01544c","issue":23,"route":"rgb->hwb","tier":"cpu","input_size":50000000,"metric":"throughput_mpx_s","value":24.13,"ms":2071.747,"iters":3,"warmup":1,"host":"vipavani","gpu_present":false,"decision":"baseline","notes":"Rust scalar batch baseline (pre-SIMD), N=50,000,000"}
{"ts":"2026-07-20T13:46:29.051Z","commit":"c01544c","issue":23,"route":"rgb->hwb","tier":"cpu","input_size":50000000,"metric":"throughput_mpx_s","value":87.54,"ms":571.157,"iters":3,"warmup":1,"host":"vipavani","gpu_present":false,"decision":"kept","baseline_ref":"c01544c","notes":"wide::f32x8 SIMD batch (mask-blend hue, from hsl hue), N=50,000,000"}
{"ts":"2026-07-20T13:46:39.446Z","commit":"c01544c","issue":23,"route":"rgb->hcg","tier":"cpu","input_size":50000000,"metric":"throughput_mpx_s","value":19.62,"ms":2548.451,"iters":3,"warmup":1,"host":"vipavani","gpu_present":false,"decision":"baseline","notes":"Rust scalar batch baseline (pre-SIMD), N=50,000,000"}
{"ts":"2026-07-20T13:46:42.046Z","commit":"c01544c","issue":23,"route":"rgb->hcg","tier":"cpu","input_size":50000000,"metric":"throughput_mpx_s","value":80.33,"ms":622.468,"iters":3,"warmup":1,"host":"vipavani","gpu_present":false,"decision":"kept","baseline_ref":"c01544c","notes":"wide::f32x8 SIMD batch (mask-blend hue + chroma-guard grayscale), N=50,000,000, speedup=4.09x, tol=1e-3"}
{"ts":"2026-07-20T13:46:46.137Z","commit":"c01544c","issue":23,"route":"rgb->apple","tier":"cpu","input_size":50000000,"metric":"throughput_mpx_s","value":50.73,"ms":985.523,"iters":3,"warmup":1,"host":"vipavani","gpu_present":false,"decision":"baseline","notes":"Rust scalar batch baseline (pre-SIMD), N=50,000,000"}
{"ts":"2026-07-20T13:46:48.386Z","commit":"c01544c","issue":23,"route":"rgb->apple","tier":"cpu","input_size":50000000,"metric":"throughput_mpx_s","value":93.47,"ms":534.908,"iters":3,"warmup":1,"host":"vipavani","gpu_present":false,"decision":"kept","baseline_ref":"c01544c","notes":"wide::f32x8 SIMD batch (linear scale x257.0), N=50,000,000, speedup=1.84x, tol=1e-6"}
{"ts":"2026-07-20T13:46:59.607Z","commit":"c01544c","issue":23,"route":"xyz->rgb","tier":"cpu","input_size":50000000,"metric":"throughput_mpx_s","value":20.96,"ms":2385.342,"iters":3,"warmup":1,"host":"vipavani","gpu_present":false,"decision":"baseline","notes":"Rust scalar batch baseline (pre-SIMD, f64 xyz::rgb), N=50,000,000"}
{"ts":"2026-07-20T13:47:01.319Z","commit":"c01544c","issue":23,"route":"xyz->rgb","tier":"cpu","input_size":50000000,"metric":"throughput_mpx_s","value":123.51,"ms":404.839,"iters":3,"warmup":1,"host":"vipavani","gpu_present":false,"decision":"kept","baseline_ref":"c01544c","notes":"wide::f32x8 SIMD batch (matrix + forward sRGB gamma), N=50,000,000, speedup=5.89x, tol=0.1"}
{"ts":"2026-07-20T13:47:09.345Z","commit":"c01544c","issue":23,"route":"lab->xyz","tier":"cpu","input_size":50000000,"metric":"throughput_mpx_s","value":84.81,"ms":589.520,"iters":3,"warmup":1,"host":"vipavani","gpu_present":false,"decision":"baseline","notes":"Rust scalar batch baseline (pre-SIMD, f64 lab::xyz), N=50,000,000"}
{"ts":"2026-07-20T13:47:10.687Z","commit":"c01544c","issue":23,"route":"lab->xyz","tier":"cpu","input_size":50000000,"metric":"throughput_mpx_s","value":151.05,"ms":331.021,"iters":3,"warmup":1,"host":"vipavani","gpu_present":false,"decision":"kept","baseline_ref":"c01544c","notes":"wide::f32x8 SIMD batch (inv lab transfer mask-blend + wp scale), N=50,000,000, speedup=1.78x, tol=1e-3"}
{"ts":"2026-07-20T13:47:21.682Z","commit":"c01544c","issue":23,"route":"oklab->rgb","tier":"cpu","input_size":50000000,"metric":"throughput_mpx_s","value":19.06,"ms":2623.518,"iters":3,"warmup":1,"host":"vipavani","gpu_present":false,"decision":"baseline","notes":"Rust scalar batch baseline (pre-SIMD, f64 oklab::rgb), N=50,000,000"}
{"ts":"2026-07-20T13:47:23.271Z","commit":"c01544c","issue":23,"route":"oklab->rgb","tier":"cpu","input_size":50000000,"metric":"throughput_mpx_s","value":132.23,"ms":378.139,"iters":3,"warmup":1,"host":"vipavani","gpu_present":false,"decision":"kept","baseline_ref":"c01544c","notes":"wide::f32x8 SIMD batch (inverse Oklab + cube + inverse LMS + gamma), N=50,000,000, speedup=6.94x, tol=1e-2"}
{"ts":"2026-07-20T13:47:29.089Z","commit":"c01544c","issue":23,"route":"hsv->rgb","tier":"cpu","input_size":50000000,"metric":"throughput_mpx_s","value":36.80,"ms":1358.832,"iters":3,"warmup":1,"host":"vipavani","gpu_present":false,"decision":"baseline","notes":"Rust scalar batch baseline (pre-SIMD, f64 hsv::rgb), N=50,000,000"}
{"ts":"2026-07-20T13:47:30.524Z","commit":"c01544c","issue":23,"route":"hsv->rgb","tier":"cpu","input_size":50000000,"metric":"throughput_mpx_s","value":141.06,"ms":354.461,"iters":3,"warmup":1,"host":"vipavani","gpu_present":false,"decision":"kept","baseline_ref":"c01544c","notes":"wide::f32x8 SIMD batch (6-way hue-sector mask-blend), N=50,000,000, speedup=3.83x, tol=1e-3"}
{"ts":"2026-07-20T13:47:37.084Z","commit":"c01544c","issue":23,"route":"hcg->rgb","tier":"cpu","input_size":50000000,"metric":"throughput_mpx_s","value":32.73,"ms":1527.846,"iters":3,"warmup":1,"host":"vipavani","gpu_present":false,"decision":"baseline","notes":"Rust scalar batch baseline (pre-SIMD, f64 hcg::rgb), N=50,000,000"}
{"ts":"2026-07-20T13:47:38.588Z","commit":"c01544c","issue":23,"route":"hcg->rgb","tier":"cpu","input_size":50000000,"metric":"throughput_mpx_s","value":138.81,"ms":360.192,"iters":3,"warmup":1,"host":"vipavani","gpu_present":false,"decision":"kept","baseline_ref":"c01544c","notes":"wide::f32x8 SIMD batch (6-way mask-blend + chroma-guard grayscale), N=50,000,000, speedup=4.24x, tol=1e-3"}
