{"ts":"2026-07-14T00:17:47.000Z","commit":"5d4b85c","issue":23,"route":"rgb->lab","tier":"js","input_size":100000000,"metric":"throughput_mpx_s","value":0,"ms":0,"iters":0,"warmup":1,"host":"vipavani","gpu_present":false,"decision":"oom","notes":"OOM/GC wall crash at N=100,000,000. Node.js v24 heap exhausted during benchmark warmup. No data recorded."}
{"ts":"2026-07-14T00:17:47.000Z","commit":"5d4b85c","issue":23,"route":"rgb->xyz","tier":"js","input_size":100000000,"metric":"throughput_mpx_s","value":0,"ms":0,"iters":0,"warmup":1,"host":"vipavani","gpu_present":false,"decision":"oom","notes":"OOM/GC wall crash at N=100,000,000. Node.js v24 heap exhausted during benchmark warmup. No data recorded."}
{"ts":"2026-07-14T00:17:47.000Z","commit":"5d4b85c","issue":23,"route":"rgb->hsl->rgb","tier":"js","input_size":100000000,"metric":"throughput_mpx_s","value":0,"ms":0,"iters":0,"warmup":1,"host":"vipavani","gpu_present":false,"decision":"oom","notes":"OOM/GC wall crash at N=100,000,000. Node.js v24 heap exhausted during benchmark warmup. No data recorded."}
{"ts":"2026-07-14T00:19:05.587Z","commit":"5d4b85c","issue":23,"route":"rgb->xyz","tier":"cpu","input_size":50000000,"metric":"throughput_mpx_s","value":37.49,"ms":1333.696,"iters":3,"warmup":1,"host":"vipavani","gpu_present":false,"decision":"baseline","notes":"wide::f64x4 SIMD batch, N=50,000,000"}
{"ts":"2026-07-14T00:19:14.652Z","commit":"5d4b85c","issue":23,"route":"rgb->lab","tier":"cpu","input_size":50000000,"metric":"throughput_mpx_s","value":22.11,"ms":2261.532,"iters":3,"warmup":1,"host":"vipavani","gpu_present":false,"decision":"baseline","notes":"wide::f64x4 SIMD batch (xyz→lab chain), N=50,000,000"}
{"ts":"2026-07-14T00:19:28.215Z","commit":"5d4b85c","issue":23,"route":"rgb->xyz","tier":"cpu","input_size":100000000,"metric":"throughput_mpx_s","value":37.58,"ms":2661.313,"iters":2,"warmup":1,"host":"vipavani","gpu_present":false,"decision":"baseline","notes":"wide::f64x4 SIMD batch, N=100,000,000"}
{"ts":"2026-07-14T00:19:41.769Z","commit":"5d4b85c","issue":23,"route":"rgb->lab","tier":"cpu","input_size":100000000,"metric":"throughput_mpx_s","value":22.18,"ms":4507.879,"iters":2,"warmup":1,"host":"vipavani","gpu_present":false,"decision":"baseline","notes":"wide::f64x4 SIMD batch (xyz→lab chain), N=100,000,000"}
{"ts":"2026-07-14T00:20:01.000Z","commit":"5d4b85c","issue":51,"route":"rgb->xyz","tier":"cpu","input_size":50000000,"metric":"throughput_mpx_s","value":20.36,"ms":2454.736,"iters":3,"warmup":1,"host":"vipavani","gpu_present":false,"decision":"baseline","notes":"wide::f64x4 SIMD baseline for #51 f32x8 comparison (measured at commit 0aa8737)"}
{"ts":"2026-07-14T00:20:01.000Z","commit":"5d4b85c","issue":51,"route":"rgb->lab","tier":"cpu","input_size":50000000,"metric":"throughput_mpx_s","value":10.85,"ms":4608.637,"iters":3,"warmup":1,"host":"vipavani","gpu_present":false,"decision":"baseline","notes":"wide::f64x4 SIMD baseline for #51 f32x8 comparison (measured at commit 0aa8737)"}
{"ts":"2026-07-14T00:20:01.000Z","commit":"5d4b85c","issue":51,"route":"rgb->xyz","tier":"cpu","input_size":100000000,"metric":"throughput_mpx_s","value":20.34,"ms":4916.402,"iters":2,"warmup":1,"host":"vipavani","gpu_present":false,"decision":"baseline","notes":"wide::f64x4 SIMD baseline for #51 f32x8 comparison (measured at commit 0aa8737)"}
{"ts":"2026-07-14T00:20:01.000Z","commit":"5d4b85c","issue":51,"route":"rgb->lab","tier":"cpu","input_size":100000000,"metric":"throughput_mpx_s","value":10.66,"ms":9381.749,"iters":2,"warmup":1,"host":"vipavani","gpu_present":false,"decision":"baseline","notes":"wide::f64x4 SIMD baseline for #51 f32x8 comparison (measured at commit 0aa8737)"}
{"ts":"2026-07-14T00:20:01.000Z","commit":"5d4b85c","issue":51,"route":"rgb->xyz","tier":"cpu","input_size":50000000,"metric":"throughput_mpx_s","value":37.49,"ms":1333.696,"iters":3,"warmup":1,"host":"vipavani","gpu_present":false,"baseline_ref":"0aa8737","decision":"kept","notes":"wide::f32x8, 8 lanes f32 end-to-end; beats f64x4 baseline (1.84x) AND JS baseline"}
{"ts":"2026-07-14T00:20:01.000Z","commit":"5d4b85c","issue":51,"route":"rgb->lab","tier":"cpu","input_size":50000000,"metric":"throughput_mpx_s","value":22.11,"ms":2261.532,"iters":3,"warmup":1,"host":"vipavani","gpu_present":false,"baseline_ref":"0aa8737","decision":"kept","notes":"wide::f32x8, 8 lanes f32 end-to-end; beats f64x4 baseline (2.04x) AND JS baseline (3.6x)"}
{"ts":"2026-07-14T00:20:01.000Z","commit":"5d4b85c","issue":51,"route":"rgb->xyz","tier":"cpu","input_size":100000000,"metric":"throughput_mpx_s","value":37.58,"ms":2661.313,"iters":2,"warmup":1,"host":"vipavani","gpu_present":false,"baseline_ref":"0aa8737","decision":"kept","notes":"wide::f32x8, 8 lanes f32 end-to-end; beats f64x4 baseline (1.85x) AND JS baseline"}
{"ts":"2026-07-14T00:20:01.000Z","commit":"5d4b85c","issue":51,"route":"rgb->lab","tier":"cpu","input_size":100000000,"metric":"throughput_mpx_s","value":22.18,"ms":4507.879,"iters":2,"warmup":1,"host":"vipavani","gpu_present":false,"baseline_ref":"0aa8737","decision":"kept","notes":"wide::f32x8, 8 lanes f32 end-to-end; beats f64x4 baseline (2.08x) AND JS baseline"}
{"ts":"2026-07-14T03:00:00.000Z","commit":"687c2f2","issue":51,"route":"n/a","tier":"cpu","input_size":0,"metric":"errata","value":0,"ms":0,"iters":0,"warmup":0,"host":"vipavani","gpu_present":false,"decision":"reverted","notes":"ERRATA: the issue:23 tier:cpu lines at commits c1d6d44 and 5d4b85c with values ~22 MP/s (rgb->lab) and ~37 MP/s (rgb->xyz) at N=50M/100M are MISLABELED — their notes say 'wide::f64x4 SIMD batch' but the values are wide::f32x8 (f64x4 real values are ~10.8/~20 MP/s). Also, the issue:51 decision:baseline f64x4 lines carry commit:5d4b85c but were measured at commit:0aa8737 per their notes — treat 0aa8737 as the measurement commit for those baseline lines. Canonical correctly-attributed records: grep '\"issue\":51' for the decision:baseline (f64x4) and decision:kept (f32x8) lines. Disregard the f64x4 notes on those issue:23 cpu lines; query issue:51 for the true f32x8-vs-f64x4 comparison."}
{"ts":"2026-07-14T04:00:00.000Z","commit":"ce70113","issue":51,"route":"n/a","tier":"cpu","input_size":0,"metric":"errata","value":0,"ms":0,"iters":0,"warmup":0,"host":"vipavani","gpu_present":false,"decision":"reverted","notes":"ERRATA (supersedes the prior errata line): the issue:51 decision:baseline f64x4 lines (xyz@50M=20.36, lab@50M=10.85, xyz@100M=20.34, lab@100M=10.66) were measured at commit 1a4e607 (exact value matches, incl. the N=100M points), NOT 0aa8737 as the earlier errata/README stated — 0aa8737 has only xyz@50M=20.06/lab@50M=10.68 and no 100M records. Treat 1a4e607 as the f64x4 baseline measurement commit. All other statements in the prior errata (mislabeled issue:23 cpu f32x8-as-f64x4 notes; canonical records are issue:51 baseline+kept) still stand."}
{"ts":"2026-07-14T05:59:14.844Z","commit":"df0d690","issue":58,"route":"rgb->xyz","tier":"cpu","input_size":50000000,"metric":"throughput_mpx_s","value":38.22,"ms":1308.057,"iters":3,"warmup":1,"host":"vipavani","gpu_present":false,"decision":"baseline","notes":"wide::f64x4 SIMD batch, N=50,000,000"}
{"ts":"2026-07-14T05:59:23.731Z","commit":"df0d690","issue":58,"route":"rgb->lab","tier":"cpu","input_size":50000000,"metric":"throughput_mpx_s","value":22.56,"ms":2216.304,"iters":3,"warmup":1,"host":"vipavani","gpu_present":false,"decision":"baseline","notes":"wide::f64x4 SIMD batch (xyz→lab chain), N=50,000,000"}
{"ts":"2026-07-14T05:59:23.785Z","commit":"df0d690","issue":58,"route":"rgb->hsl","tier":"cpu","input_size":50000000,"metric":"throughput_mpx_s","value":3782.39,"ms":13.219,"iters":3,"warmup":1,"host":"vipavani","gpu_present":false,"decision":"baseline","notes":"Rust scalar per-pixel baseline (pre-SIMD), N=50,000,000"}
{"ts":"2026-07-14T05:59:25.208Z","commit":"df0d690","issue":58,"route":"rgb->hsl","tier":"cpu","input_size":50000000,"metric":"throughput_mpx_s","value":140.80,"ms":355.101,"iters":3,"warmup":1,"host":"vipavani","gpu_present":false,"decision":"kept","notes":"wide::f32x8 SIMD batch (mask-blend hue), N=50,000,000"}
{"ts":"2026-07-14T06:00:56.627Z","commit":"df0d690","issue":58,"route":"rgb->xyz","tier":"cpu","input_size":50000000,"metric":"throughput_mpx_s","value":38.12,"ms":1311.564,"iters":3,"warmup":1,"host":"vipavani","gpu_present":false,"decision":"baseline","notes":"wide::f64x4 SIMD batch, N=50,000,000"}
{"ts":"2026-07-14T06:01:05.483Z","commit":"df0d690","issue":58,"route":"rgb->lab","tier":"cpu","input_size":50000000,"metric":"throughput_mpx_s","value":22.63,"ms":2209.842,"iters":3,"warmup":1,"host":"vipavani","gpu_present":false,"decision":"baseline","notes":"wide::f64x4 SIMD batch (xyz→lab chain), N=50,000,000"}
{"ts":"2026-07-14T06:01:10.872Z","commit":"df0d690","issue":58,"route":"rgb->hsl","tier":"cpu","input_size":50000000,"metric":"throughput_mpx_s","value":37.13,"ms":1346.772,"iters":3,"warmup":1,"host":"vipavani","gpu_present":false,"decision":"baseline","notes":"Rust scalar batch baseline (pre-SIMD), N=50,000,000"}
{"ts":"2026-07-14T06:01:12.290Z","commit":"df0d690","issue":58,"route":"rgb->hsl","tier":"cpu","input_size":50000000,"metric":"throughput_mpx_s","value":142.10,"ms":351.867,"iters":3,"warmup":1,"host":"vipavani","gpu_present":false,"decision":"kept","notes":"wide::f32x8 SIMD batch (mask-blend hue), N=50,000,000"}
{"ts":"2026-07-14T06:17:49.930Z","commit":"b162c09","issue":61,"route":"rgb->xyz","tier":"cpu","input_size":50000000,"metric":"throughput_mpx_s","value":37.05,"ms":1349.392,"iters":3,"warmup":1,"host":"vipavani","gpu_present":false,"decision":"baseline","notes":"wide::f64x4 SIMD batch, N=50,000,000"}
{"ts":"2026-07-14T06:17:59.152Z","commit":"b162c09","issue":61,"route":"rgb->lab","tier":"cpu","input_size":50000000,"metric":"throughput_mpx_s","value":21.73,"ms":2300.783,"iters":3,"warmup":1,"host":"vipavani","gpu_present":false,"decision":"baseline","notes":"wide::f32x8 SIMD two-step chain (xyz→lab), #61 baseline, N=50,000,000"}
{"ts":"2026-07-14T06:18:07.481Z","commit":"b162c09","issue":61,"route":"rgb->lab","tier":"cpu","input_size":50000000,"metric":"throughput_mpx_s","value":24.02,"ms":2081.990,"iters":3,"warmup":1,"host":"vipavani","gpu_present":false,"decision":"kept","notes":"wide::f32x8 SIMD fused single-pass (rgb→lab), N=50,000,000"}
{"ts":"2026-07-14T06:18:13.148Z","commit":"b162c09","issue":61,"route":"rgb->hsl","tier":"cpu","input_size":50000000,"metric":"throughput_mpx_s","value":35.36,"ms":1414.214,"iters":3,"warmup":1,"host":"vipavani","gpu_present":false,"decision":"baseline","notes":"Rust scalar batch baseline (pre-SIMD), N=50,000,000"}
{"ts":"2026-07-14T06:18:14.629Z","commit":"b162c09","issue":61,"route":"rgb->hsl","tier":"cpu","input_size":50000000,"metric":"throughput_mpx_s","value":135.21,"ms":369.797,"iters":3,"warmup":1,"host":"vipavani","gpu_present":false,"decision":"kept","notes":"wide::f32x8 SIMD batch (mask-blend hue), N=50,000,000"}
{"ts":"2026-07-14T06:20:12.641Z","commit":"b162c09","issue":61,"route":"rgb->xyz","tier":"cpu","input_size":50000000,"metric":"throughput_mpx_s","value":36.96,"ms":1352.694,"iters":3,"warmup":1,"host":"vipavani","gpu_present":false,"decision":"baseline","notes":"wide::f64x4 SIMD batch, N=50,000,000"}
{"ts":"2026-07-14T06:20:21.862Z","commit":"b162c09","issue":61,"route":"rgb->lab","tier":"cpu","input_size":50000000,"metric":"throughput_mpx_s","value":21.70,"ms":2304.174,"iters":3,"warmup":1,"host":"vipavani","gpu_present":false,"decision":"baseline","notes":"wide::f32x8 SIMD two-step chain (xyz→lab), #61 baseline, N=50,000,000"}
{"ts":"2026-07-14T06:20:30.185Z","commit":"b162c09","issue":61,"route":"rgb->lab","tier":"cpu","input_size":50000000,"metric":"throughput_mpx_s","value":24.07,"ms":2077.318,"iters":3,"warmup":1,"host":"vipavani","gpu_present":false,"decision":"kept","baseline_ref":"b162c09","notes":"wide::f32x8 SIMD fused single-pass (rgb→lab), N=50,000,000"}
{"ts":"2026-07-14T06:20:35.835Z","commit":"b162c09","issue":61,"route":"rgb->hsl","tier":"cpu","input_size":50000000,"metric":"throughput_mpx_s","value":35.50,"ms":1408.255,"iters":3,"warmup":1,"host":"vipavani","gpu_present":false,"decision":"baseline","notes":"Rust scalar batch baseline (pre-SIMD), N=50,000,000"}
{"ts":"2026-07-14T06:20:37.312Z","commit":"b162c09","issue":61,"route":"rgb->hsl","tier":"cpu","input_size":50000000,"metric":"throughput_mpx_s","value":136.76,"ms":365.611,"iters":3,"warmup":1,"host":"vipavani","gpu_present":false,"decision":"kept","notes":"wide::f32x8 SIMD batch (mask-blend hue), N=50,000,000"}
{"ts":"2026-07-14T06:30:00.000Z","commit":"532e14e","issue":25,"route":"rgb->lab","tier":"cpu","input_size":50000000,"metric":"throughput_mpx_s","value":20.2,"ms":2474.564,"iters":3,"warmup":1,"host":"vipavani","gpu_present":false,"baseline_ref":"5d4b85c","decision":"reverted","notes":"NEGATIVE RESULT (recovered from closed PR #59 branch perf/simd-soa-layout). SoA f32x8 SIMD (+AoS->SoA transpose): 20.2 MP/s vs prev Rust 22.11 MP/s (f32x8 AoS). Does NOT beat prev iteration; AoS->SoA transpose overhead (2 Vec allocs + de-interleave/re-interleave) dominates contiguous-load benefit. Improvement DROPPED. See issue #25."}
{"ts":"2026-07-14T06:30:00.000Z","commit":"532e14e","issue":25,"route":"rgb->xyz","tier":"cpu","input_size":50000000,"metric":"throughput_mpx_s","value":37.6,"ms":1331.438,"iters":3,"warmup":1,"host":"vipavani","gpu_present":false,"baseline_ref":"5d4b85c","decision":"reverted","notes":"NEGATIVE RESULT (recovered from closed PR #59). SoA f32x8 rgb->xyz 37.6 MP/s vs AoS post-refactor 42.5 MP/s. Transpose overhead negates contiguous-load benefit. DROPPED."}
{"ts":"2026-07-14T06:30:00.000Z","commit":"532e14e","issue":24,"route":"rgb->lab","tier":"gpu","input_size":50000000,"metric":"throughput_mpx_s","value":33.63,"ms":1486.764,"iters":3,"warmup":1,"host":"vipavani","gpu_present":true,"gpu_name":"NVIDIA RTX 2000 Ada Generation Laptop GPU","decision":"baseline","notes":"BLOCK_SIZE=64 baseline (recovered from closed #24 sweep). CubeCL/wgpu rgb->lab; upload=750.38ms compute=0.01ms readback=206.20ms. Transfer-bound."}
{"ts":"2026-07-14T06:30:00.000Z","commit":"532e14e","issue":24,"route":"rgb->lab","tier":"gpu","input_size":50000000,"metric":"throughput_mpx_s","value":33.12,"ms":1509.684,"iters":3,"warmup":1,"host":"vipavani","gpu_present":true,"gpu_name":"NVIDIA RTX 2000 Ada Generation Laptop GPU","baseline_ref":"37dc58a","decision":"reverted","notes":"NEGATIVE (recovered from closed #24). BLOCK_SIZE=32: 33.12 MP/s, within noise of 64. compute flat 0.01ms. DROPPED."}
{"ts":"2026-07-14T06:30:00.000Z","commit":"532e14e","issue":24,"route":"rgb->lab","tier":"gpu","input_size":50000000,"metric":"throughput_mpx_s","value":33.98,"ms":1471.417,"iters":3,"warmup":1,"host":"vipavani","gpu_present":true,"gpu_name":"NVIDIA RTX 2000 Ada Generation Laptop GPU","baseline_ref":"37dc58a","decision":"reverted","notes":"NEGATIVE (recovered from closed #24). BLOCK_SIZE=128: 33.98 MP/s, +1.2% within noise of 64. DROPPED."}
{"ts":"2026-07-14T06:30:00.000Z","commit":"532e14e","issue":24,"route":"rgb->lab","tier":"gpu","input_size":50000000,"metric":"throughput_mpx_s","value":32.73,"ms":1527.499,"iters":3,"warmup":1,"host":"vipavani","gpu_present":true,"gpu_name":"NVIDIA RTX 2000 Ada Generation Laptop GPU","baseline_ref":"37dc58a","decision":"reverted","notes":"NEGATIVE (recovered from closed #24). BLOCK_SIZE=256: 32.73 MP/s, -2.7% within noise of 64. Transfer-bound kernel confirmed; workgroup tuning ineffective. DROPPED. BLOCK_SIZE=64 kept."}
{"ts":"2026-07-14T06:40:20.000Z","commit":"dd5736b","issue":65,"route":"rgb->xyz","tier":"cpu","input_size":50000000,"metric":"throughput_mpx_s","value":46.30,"ms":1079.815,"iters":3,"warmup":1,"host":"vipavani","gpu_present":false,"decision":"kept","baseline_ref":"44502ce","notes":"wide::f32x8 SIMD + vectorized srgb transfer (mask-blend powf), N=50,000,000"}
{"ts":"2026-07-14T06:40:25.000Z","commit":"dd5736b","issue":65,"route":"rgb->lab","tier":"cpu","input_size":50000000,"metric":"throughput_mpx_s","value":28.10,"ms":1779.661,"iters":3,"warmup":1,"host":"vipavani","gpu_present":false,"decision":"kept","baseline_ref":"44502ce","notes":"wide::f32x8 SIMD two-step + vectorized srgb/LAB transfer (mask-blend cbrt), N=50,000,000"}
{"ts":"2026-07-14T06:40:30.000Z","commit":"dd5736b","issue":65,"route":"rgb->lab","tier":"cpu","input_size":50000000,"metric":"throughput_mpx_s","value":31.89,"ms":1568.041,"iters":3,"warmup":1,"host":"vipavani","gpu_present":false,"decision":"kept","baseline_ref":"44502ce","notes":"wide::f32x8 SIMD fused single-pass (rgb→lab) + vectorized srgb/LAB transfer (mask-blend powf+cbrt), N=50,000,000"}
{"ts":"2026-07-14T06:39:31.000Z","commit":"44502ce","issue":65,"route":"rgb->xyz","tier":"cpu","input_size":50000000,"metric":"throughput_mpx_s","value":38.19,"ms":1309.410,"iters":3,"warmup":1,"host":"vipavani","gpu_present":false,"decision":"baseline","notes":"wide::f32x8 SIMD batch, N=50,000,000 (pre-vectorize-transfer baseline)"}
{"ts":"2026-07-14T06:39:48.000Z","commit":"44502ce","issue":65,"route":"rgb->lab","tier":"cpu","input_size":50000000,"metric":"throughput_mpx_s","value":24.43,"ms":2046.253,"iters":3,"warmup":1,"host":"vipavani","gpu_present":false,"decision":"baseline","notes":"wide::f32x8 SIMD fused single-pass (rgb→lab), pre-vectorize-transfer, N=50,000,000"}
{"ts":"2026-07-14T06:38:56.696Z","commit":"fb3da27","issue":64,"route":"rgb->xyz","tier":"cpu","input_size":50000000,"metric":"throughput_mpx_s","value":37.25,"ms":1342.288,"iters":3,"warmup":1,"host":"vipavani","gpu_present":false,"decision":"baseline","notes":"wide::f64x4 SIMD batch, N=50,000,000"}
{"ts":"2026-07-14T06:39:05.644Z","commit":"fb3da27","issue":64,"route":"rgb->lab","tier":"cpu","input_size":50000000,"metric":"throughput_mpx_s","value":22.52,"ms":2220.291,"iters":3,"warmup":1,"host":"vipavani","gpu_present":false,"decision":"baseline","notes":"wide::f32x8 SIMD two-step chain (xyz→lab), #61 baseline, N=50,000,000"}
{"ts":"2026-07-14T06:39:13.759Z","commit":"fb3da27","issue":64,"route":"rgb->lab","tier":"cpu","input_size":50000000,"metric":"throughput_mpx_s","value":24.69,"ms":2024.977,"iters":3,"warmup":1,"host":"vipavani","gpu_present":false,"decision":"kept","baseline_ref":"fb3da27","notes":"wide::f32x8 SIMD fused single-pass (rgb→lab), N=50,000,000"}
{"ts":"2026-07-14T06:39:19.185Z","commit":"fb3da27","issue":64,"route":"rgb->hsl","tier":"cpu","input_size":50000000,"metric":"throughput_mpx_s","value":37.00,"ms":1351.299,"iters":3,"warmup":1,"host":"vipavani","gpu_present":false,"decision":"baseline","notes":"Rust scalar batch baseline (pre-SIMD), N=50,000,000"}
{"ts":"2026-07-14T06:39:20.602Z","commit":"fb3da27","issue":64,"route":"rgb->hsl","tier":"cpu","input_size":50000000,"metric":"throughput_mpx_s","value":142.23,"ms":351.537,"iters":3,"warmup":1,"host":"vipavani","gpu_present":false,"decision":"kept","notes":"wide::f32x8 SIMD batch (mask-blend hue), N=50,000,000"}
{"ts":"2026-07-14T06:39:30.136Z","commit":"fb3da27","issue":64,"route":"rgb->hsl->rgb","tier":"cpu","input_size":50000000,"metric":"throughput_mpx_s","value":21.05,"ms":2375.847,"iters":3,"warmup":1,"host":"vipavani","gpu_present":false,"decision":"baseline","notes":"Rust scalar batch baseline (pre-SIMD roundtrip), N=50,000,000"}
{"ts":"2026-07-14T06:39:33.243Z","commit":"fb3da27","issue":64,"route":"rgb->hsl->rgb","tier":"cpu","input_size":50000000,"metric":"throughput_mpx_s","value":64.97,"ms":769.549,"iters":3,"warmup":1,"host":"vipavani","gpu_present":false,"decision":"kept","baseline_ref":"fb3da27","notes":"wide::f32x8 SIMD batch round-trip (rgb→hsl→rgb), N=50,000,000"}
{"ts":"2026-07-14T07:09:42.788Z","commit":"df61a3c","issue":72,"route":"rgb->xyz","tier":"cpu","input_size":50000000,"metric":"throughput_mpx_s","value":46.24,"ms":1081.278,"iters":3,"warmup":1,"host":"vipavani","gpu_present":false,"decision":"baseline","notes":"wide::f64x4 SIMD batch, N=50,000,000"}
{"ts":"2026-07-14T07:09:49.925Z","commit":"df61a3c","issue":72,"route":"rgb->lab","tier":"cpu","input_size":50000000,"metric":"throughput_mpx_s","value":28.09,"ms":1780.300,"iters":3,"warmup":1,"host":"vipavani","gpu_present":false,"decision":"baseline","notes":"wide::f32x8 SIMD two-step chain (xyz→lab), #61 baseline, N=50,000,000"}
{"ts":"2026-07-14T07:09:56.193Z","commit":"df61a3c","issue":72,"route":"rgb->lab","tier":"cpu","input_size":50000000,"metric":"throughput_mpx_s","value":31.95,"ms":1564.909,"iters":3,"warmup":1,"host":"vipavani","gpu_present":false,"decision":"kept","baseline_ref":"df61a3c","notes":"wide::f32x8 SIMD fused single-pass (rgb→lab), N=50,000,000"}
{"ts":"2026-07-14T07:10:01.638Z","commit":"df61a3c","issue":72,"route":"rgb->hsl","tier":"cpu","input_size":50000000,"metric":"throughput_mpx_s","value":36.81,"ms":1358.154,"iters":3,"warmup":1,"host":"vipavani","gpu_present":false,"decision":"baseline","notes":"Rust scalar batch baseline (pre-SIMD), N=50,000,000"}
{"ts":"2026-07-14T07:10:03.059Z","commit":"df61a3c","issue":72,"route":"rgb->hsl","tier":"cpu","input_size":50000000,"metric":"throughput_mpx_s","value":141.19,"ms":354.141,"iters":3,"warmup":1,"host":"vipavani","gpu_present":false,"decision":"kept","notes":"wide::f32x8 SIMD batch (mask-blend hue), N=50,000,000"}
{"ts":"2026-07-14T07:10:12.603Z","commit":"df61a3c","issue":72,"route":"rgb->hsl->rgb","tier":"cpu","input_size":50000000,"metric":"throughput_mpx_s","value":20.97,"ms":2384.718,"iters":3,"warmup":1,"host":"vipavani","gpu_present":false,"decision":"baseline","notes":"Rust scalar batch baseline (pre-SIMD roundtrip), N=50,000,000"}
{"ts":"2026-07-14T07:10:15.734Z","commit":"df61a3c","issue":72,"route":"rgb->hsl->rgb","tier":"cpu","input_size":50000000,"metric":"throughput_mpx_s","value":64.05,"ms":780.682,"iters":3,"warmup":1,"host":"vipavani","gpu_present":false,"decision":"kept","baseline_ref":"df61a3c","notes":"wide::f32x8 SIMD batch round-trip (rgb→hsl→rgb), N=50,000,000"}
