{"ts":"2026-07-20T12:24:58.383Z","commit":"f8b54e2","issue":122,"route":"lab->xyz","tier":"cpu","input_size":10000000,"metric":"throughput_mpx_s","value":151.89,"ms":65.837,"iters":3,"warmup":1,"host":"vipavani","gpu_present":false,"decision":"reverted","notes":"parallel SIMD (rayon 28 cores), N=10,000,000, chunk=1048576, speedup=0.88x"}
{"ts":"2026-07-20T12:32:59.038Z","commit":"5fa8a4b","issue":23,"route":"rgb->lab","tier":"gpu","input_size":1000,"metric":"throughput_mpx_s","value":0.09,"ms":10.798,"iters":1,"warmup":1,"host":"vipavani","gpu_present":true,"decision":"baseline","notes":"CubeCL/wgpu GPU kernel rgb->lab batch on NVIDIA RTX 2000 Ada; N=1,000; upload=0.00ms compute=0.00ms readback=0.52ms"}
{"ts":"2026-07-20T12:34:51.342Z","commit":"5fa8a4b","issue":23,"route":"rgb->lab","tier":"gpu","input_size":10000000,"metric":"throughput_mpx_s","value":34.10,"ms":293.212,"iters":5,"warmup":3,"host":"vipavani","gpu_present":true,"decision":"baseline","notes":"CubeCL/wgpu GPU kernel rgb->lab batch on NVIDIA RTX 2000 Ada; N=10,000,000; upload=147.61ms compute=0.01ms readback=39.70ms"}
{"ts":"2026-07-20T12:36:22.173Z","commit":"5fa8a4b","issue":23,"route":"rgb->lab","tier":"gpu","input_size":10000000,"metric":"throughput_mpx_s","value":33.80,"ms":295.886,"iters":5,"warmup":3,"host":"vipavani","gpu_present":true,"decision":"baseline","notes":"CubeCL/wgpu GPU kernel rgb->lab batch on NVIDIA RTX 2000 Ada; N=10,000,000; upload=146.36ms compute=0.01ms readback=43.55ms"}
{"ts":"2026-07-20T12:36:24.849Z","commit":"5fa8a4b","issue":123,"route":"rgb->hsl","tier":"gpu","input_size":10000000,"metric":"throughput_mpx_s","value":32.83,"ms":304.605,"iters":5,"warmup":3,"host":"vipavani","gpu_present":true,"decision":"reverted","notes":"GPU kernel (rgb->hsl) — transfer-bound, expected to lose vs parallel CPU"}
{"ts":"2026-07-20T12:36:28.076Z","commit":"5fa8a4b","issue":123,"route":"rgb->hsv","tier":"gpu","input_size":10000000,"metric":"throughput_mpx_s","value":25.96,"ms":385.155,"iters":5,"warmup":3,"host":"vipavani","gpu_present":true,"decision":"reverted","notes":"GPU kernel (rgb->hsv) — transfer-bound, expected to lose vs parallel CPU"}
{"ts":"2026-07-20T12:36:31.173Z","commit":"5fa8a4b","issue":123,"route":"rgb->cmyk","tier":"gpu","input_size":10000000,"metric":"throughput_mpx_s","value":30.88,"ms":323.857,"iters":5,"warmup":3,"host":"vipavani","gpu_present":true,"decision":"reverted","notes":"GPU kernel rgb->cmyk — transfer-bound, expected to lose vs parallel CPU"}
{"ts":"2026-07-20T12:37:08.048Z","commit":"5fa8a4b","issue":110,"route":"rgb->xyz","tier":"cpu","input_size":10000000,"metric":"throughput_mpx_s","value":159.90,"ms":62.539,"iters":5,"warmup":3,"host":"vipavani","gpu_present":false,"decision":"baseline","notes":"serial SIMD (1 core), N=10,000,000"}
{"ts":"2026-07-20T12:37:08.592Z","commit":"5fa8a4b","issue":110,"route":"rgb->xyz","tier":"cpu","input_size":10000000,"metric":"throughput_mpx_s","value":155.47,"ms":64.321,"iters":5,"warmup":3,"host":"vipavani","gpu_present":false,"decision":"reverted","baseline_ref":"5fa8a4b","notes":"parallel SIMD (rayon 28 cores), N=10,000,000, speedup=0.97x"}
{"ts":"2026-07-20T12:37:09.286Z","commit":"5fa8a4b","issue":110,"route":"rgb->lab","tier":"cpu","input_size":10000000,"metric":"throughput_mpx_s","value":116.23,"ms":86.036,"iters":5,"warmup":3,"host":"vipavani","gpu_present":false,"decision":"baseline","notes":"serial SIMD (1 core), N=10,000,000"}
{"ts":"2026-07-20T12:37:09.803Z","commit":"5fa8a4b","issue":110,"route":"rgb->lab","tier":"cpu","input_size":10000000,"metric":"throughput_mpx_s","value":160.05,"ms":62.479,"iters":5,"warmup":3,"host":"vipavani","gpu_present":false,"decision":"kept","baseline_ref":"5fa8a4b","notes":"parallel SIMD (rayon 28 cores), N=10,000,000, speedup=1.38x"}
{"ts":"2026-07-20T12:37:10.323Z","commit":"5fa8a4b","issue":110,"route":"rgb->hsl","tier":"cpu","input_size":10000000,"metric":"throughput_mpx_s","value":154.46,"ms":64.742,"iters":5,"warmup":3,"host":"vipavani","gpu_present":false,"decision":"baseline","notes":"serial SIMD (1 core), N=10,000,000"}
{"ts":"2026-07-20T12:37:10.854Z","commit":"5fa8a4b","issue":110,"route":"rgb->hsl","tier":"cpu","input_size":10000000,"metric":"throughput_mpx_s","value":158.86,"ms":62.949,"iters":5,"warmup":3,"host":"vipavani","gpu_present":false,"decision":"kept","baseline_ref":"5fa8a4b","notes":"parallel SIMD (rayon 28 cores), N=10,000,000, speedup=1.03x"}
{"ts":"2026-07-20T12:37:11.364Z","commit":"5fa8a4b","issue":110,"route":"rgb->hsv","tier":"cpu","input_size":10000000,"metric":"throughput_mpx_s","value":157.41,"ms":63.530,"iters":5,"warmup":3,"host":"vipavani","gpu_present":false,"decision":"baseline","notes":"serial SIMD (1 core), N=10,000,000"}
{"ts":"2026-07-20T12:37:11.866Z","commit":"5fa8a4b","issue":110,"route":"rgb->hsv","tier":"cpu","input_size":10000000,"metric":"throughput_mpx_s","value":165.82,"ms":60.306,"iters":5,"warmup":3,"host":"vipavani","gpu_present":false,"decision":"kept","baseline_ref":"5fa8a4b","notes":"parallel SIMD (rayon 28 cores), N=10,000,000, speedup=1.05x"}
{"ts":"2026-07-20T12:37:12.436Z","commit":"5fa8a4b","issue":110,"route":"rgb->cmyk","tier":"cpu","input_size":10000000,"metric":"throughput_mpx_s","value":141.60,"ms":70.624,"iters":5,"warmup":3,"host":"vipavani","gpu_present":false,"decision":"baseline","notes":"serial SIMD (1 core), N=10,000,000"}
{"ts":"2026-07-20T12:37:13.103Z","commit":"5fa8a4b","issue":110,"route":"rgb->cmyk","tier":"cpu","input_size":10000000,"metric":"throughput_mpx_s","value":123.65,"ms":80.871,"iters":5,"warmup":3,"host":"vipavani","gpu_present":false,"decision":"reverted","baseline_ref":"5fa8a4b","notes":"parallel SIMD (rayon 28 cores), N=10,000,000, speedup=0.87x"}
{"ts":"2026-07-20T12:37:13.603Z","commit":"5fa8a4b","issue":110,"route":"rgb->hwb","tier":"cpu","input_size":10000000,"metric":"throughput_mpx_s","value":160.86,"ms":62.166,"iters":5,"warmup":3,"host":"vipavani","gpu_present":false,"decision":"baseline","notes":"serial SIMD (1 core), N=10,000,000"}
{"ts":"2026-07-20T12:37:14.102Z","commit":"5fa8a4b","issue":110,"route":"rgb->hwb","tier":"cpu","input_size":10000000,"metric":"throughput_mpx_s","value":167.88,"ms":59.567,"iters":5,"warmup":3,"host":"vipavani","gpu_present":false,"decision":"kept","baseline_ref":"5fa8a4b","notes":"parallel SIMD (rayon 28 cores), N=10,000,000, speedup=1.04x"}
{"ts":"2026-07-20T12:37:15.314Z","commit":"5fa8a4b","issue":110,"route":"rgb->oklab","tier":"cpu","input_size":10000000,"metric":"throughput_mpx_s","value":66.45,"ms":150.481,"iters":5,"warmup":3,"host":"vipavani","gpu_present":false,"decision":"baseline","notes":"serial SIMD (1 core), N=10,000,000"}
{"ts":"2026-07-20T12:37:15.841Z","commit":"5fa8a4b","issue":110,"route":"rgb->oklab","tier":"cpu","input_size":10000000,"metric":"throughput_mpx_s","value":157.74,"ms":63.394,"iters":5,"warmup":3,"host":"vipavani","gpu_present":false,"decision":"kept","baseline_ref":"5fa8a4b","notes":"parallel SIMD (rayon 28 cores), N=10,000,000, speedup=2.37x"}
{"ts":"2026-07-20T12:37:16.420Z","commit":"5fa8a4b","issue":110,"route":"rgb->hcg","tier":"cpu","input_size":10000000,"metric":"throughput_mpx_s","value":139.43,"ms":71.720,"iters":5,"warmup":3,"host":"vipavani","gpu_present":false,"decision":"baseline","notes":"serial SIMD (1 core), N=10,000,000"}
{"ts":"2026-07-20T12:37:16.924Z","commit":"5fa8a4b","issue":110,"route":"rgb->hcg","tier":"cpu","input_size":10000000,"metric":"throughput_mpx_s","value":166.83,"ms":59.940,"iters":5,"warmup":3,"host":"vipavani","gpu_present":false,"decision":"kept","baseline_ref":"5fa8a4b","notes":"parallel SIMD (rayon 28 cores), N=10,000,000, speedup=1.20x"}
{"ts":"2026-07-20T12:37:17.354Z","commit":"5fa8a4b","issue":110,"route":"rgb->apple","tier":"cpu","input_size":10000000,"metric":"throughput_mpx_s","value":189.01,"ms":52.907,"iters":5,"warmup":3,"host":"vipavani","gpu_present":false,"decision":"baseline","notes":"serial SIMD (1 core), N=10,000,000"}
{"ts":"2026-07-20T12:37:17.851Z","commit":"5fa8a4b","issue":110,"route":"rgb->apple","tier":"cpu","input_size":10000000,"metric":"throughput_mpx_s","value":167.41,"ms":59.732,"iters":5,"warmup":3,"host":"vipavani","gpu_present":false,"decision":"reverted","baseline_ref":"5fa8a4b","notes":"parallel SIMD (rayon 28 cores), N=10,000,000, speedup=0.89x"}
{"ts":"2026-07-20T12:37:18.501Z","commit":"5fa8a4b","issue":110,"route":"xyz->lab","tier":"cpu","input_size":10000000,"metric":"throughput_mpx_s","value":135.83,"ms":73.622,"iters":5,"warmup":3,"host":"vipavani","gpu_present":false,"decision":"baseline","notes":"serial SIMD (1 core), N=10,000,000"}
{"ts":"2026-07-20T12:37:19.011Z","commit":"5fa8a4b","issue":110,"route":"xyz->lab","tier":"cpu","input_size":10000000,"metric":"throughput_mpx_s","value":163.97,"ms":60.986,"iters":5,"warmup":3,"host":"vipavani","gpu_present":false,"decision":"kept","baseline_ref":"5fa8a4b","notes":"parallel SIMD (rayon 28 cores), N=10,000,000, speedup=1.21x"}
{"ts":"2026-07-20T12:37:19.703Z","commit":"5fa8a4b","issue":110,"route":"hsl->rgb","tier":"cpu","input_size":10000000,"metric":"throughput_mpx_s","value":127.42,"ms":78.480,"iters":5,"warmup":3,"host":"vipavani","gpu_present":false,"decision":"baseline","notes":"serial SIMD (1 core), N=10,000,000"}
{"ts":"2026-07-20T12:37:20.205Z","commit":"5fa8a4b","issue":110,"route":"hsl->rgb","tier":"cpu","input_size":10000000,"metric":"throughput_mpx_s","value":166.09,"ms":60.208,"iters":5,"warmup":3,"host":"vipavani","gpu_present":false,"decision":"kept","baseline_ref":"5fa8a4b","notes":"parallel SIMD (rayon 28 cores), N=10,000,000, speedup=1.30x"}
{"ts":"2026-07-20T12:37:21.244Z","commit":"5fa8a4b","issue":110,"route":"hsv->rgb","tier":"cpu","input_size":10000000,"metric":"throughput_mpx_s","value":83.13,"ms":120.288,"iters":5,"warmup":3,"host":"vipavani","gpu_present":false,"decision":"baseline","notes":"serial SIMD (1 core), N=10,000,000"}
{"ts":"2026-07-20T12:37:21.755Z","commit":"5fa8a4b","issue":110,"route":"hsv->rgb","tier":"cpu","input_size":10000000,"metric":"throughput_mpx_s","value":161.04,"ms":62.098,"iters":5,"warmup":3,"host":"vipavani","gpu_present":false,"decision":"kept","baseline_ref":"5fa8a4b","notes":"parallel SIMD (rayon 28 cores), N=10,000,000, speedup=1.94x"}
{"ts":"2026-07-20T12:37:23.561Z","commit":"5fa8a4b","issue":110,"route":"oklab->rgb","tier":"cpu","input_size":10000000,"metric":"throughput_mpx_s","value":48.68,"ms":205.405,"iters":5,"warmup":3,"host":"vipavani","gpu_present":false,"decision":"baseline","notes":"serial SIMD (1 core), N=10,000,000"}
{"ts":"2026-07-20T12:37:24.113Z","commit":"5fa8a4b","issue":110,"route":"oklab->rgb","tier":"cpu","input_size":10000000,"metric":"throughput_mpx_s","value":156.85,"ms":63.756,"iters":5,"warmup":3,"host":"vipavani","gpu_present":false,"decision":"kept","baseline_ref":"5fa8a4b","notes":"parallel SIMD (rayon 28 cores), N=10,000,000, speedup=3.22x"}
{"ts":"2026-07-20T12:37:24.751Z","commit":"5fa8a4b","issue":110,"route":"hcg->rgb","tier":"cpu","input_size":10000000,"metric":"throughput_mpx_s","value":141.83,"ms":70.505,"iters":5,"warmup":3,"host":"vipavani","gpu_present":false,"decision":"baseline","notes":"serial SIMD (1 core), N=10,000,000"}
{"ts":"2026-07-20T12:37:25.256Z","commit":"5fa8a4b","issue":110,"route":"hcg->rgb","tier":"cpu","input_size":10000000,"metric":"throughput_mpx_s","value":161.59,"ms":61.886,"iters":5,"warmup":3,"host":"vipavani","gpu_present":false,"decision":"kept","baseline_ref":"5fa8a4b","notes":"parallel SIMD (rayon 28 cores), N=10,000,000, speedup=1.14x"}
{"ts":"2026-07-20T12:37:26.802Z","commit":"5fa8a4b","issue":110,"route":"xyz->rgb","tier":"cpu","input_size":10000000,"metric":"throughput_mpx_s","value":51.87,"ms":192.800,"iters":5,"warmup":3,"host":"vipavani","gpu_present":false,"decision":"baseline","notes":"serial SIMD (1 core), N=10,000,000"}
{"ts":"2026-07-20T12:37:27.333Z","commit":"5fa8a4b","issue":110,"route":"xyz->rgb","tier":"cpu","input_size":10000000,"metric":"throughput_mpx_s","value":160.04,"ms":62.486,"iters":5,"warmup":3,"host":"vipavani","gpu_present":false,"decision":"kept","baseline_ref":"5fa8a4b","notes":"parallel SIMD (rayon 28 cores), N=10,000,000, speedup=3.09x"}
{"ts":"2026-07-20T12:37:27.943Z","commit":"5fa8a4b","issue":110,"route":"lab->xyz","tier":"cpu","input_size":10000000,"metric":"throughput_mpx_s","value":174.82,"ms":57.202,"iters":5,"warmup":3,"host":"vipavani","gpu_present":false,"decision":"baseline","notes":"serial SIMD (1 core), N=10,000,000"}
{"ts":"2026-07-20T12:37:28.443Z","commit":"5fa8a4b","issue":110,"route":"lab->xyz","tier":"cpu","input_size":10000000,"metric":"throughput_mpx_s","value":164.10,"ms":60.939,"iters":5,"warmup":3,"host":"vipavani","gpu_present":false,"decision":"reverted","baseline_ref":"5fa8a4b","notes":"parallel SIMD (rayon 28 cores), N=10,000,000, speedup=0.94x"}
{"ts":"2026-07-20T14:00:00.000Z","commit":"b5c94ea","issue":113,"route":"rgb->xyz","tier":"cpu","input_size":50000000,"metric":"throughput_mpx_s","value":152.2,"ms":328.622,"iters":3,"warmup":1,"host":"vipavani","gpu_present":false,"baseline_ref":"5c8ef5c","decision":"kept","notes":"sRGB inverse-gamma LUT (exact 256-entry, LazyLock). Final combined result with all optimizations stacked. Baseline (pre-LUT): 46.3 MP/s. Speedup: 3.28x. N=50,000,000."}
{"ts":"2026-07-20T14:00:00.000Z","commit":"b5c94ea","issue":113,"route":"rgb->lab","tier":"cpu","input_size":50000000,"metric":"throughput_mpx_s","value":111.3,"ms":449.257,"iters":3,"warmup":1,"host":"vipavani","gpu_present":false,"baseline_ref":"5c8ef5c","decision":"kept","notes":"sRGB LUT + fast cbrt + vectorized transfer + fused pipeline (all stacked). Baseline (f64x4 scalar): 10.8 MP/s. Cumulative speedup: 10.3x. N=50,000,000."}
{"ts":"2026-07-20T14:00:00.000Z","commit":"b5c94ea","issue":113,"route":"rgb->oklab","tier":"cpu","input_size":50000000,"metric":"throughput_mpx_s","value":65.5,"ms":763.289,"iters":3,"warmup":1,"host":"vipavani","gpu_present":false,"baseline_ref":"5c8ef5c","decision":"kept","notes":"sRGB LUT applied to oklab route. Baseline (pre-LUT): 31.9 MP/s. Speedup: 2.05x. N=50,000,000."}
{"ts":"2026-07-20T14:00:00.000Z","commit":"b5c94ea","issue":114,"route":"rgb->lab","tier":"gpu","input_size":50000000,"metric":"throughput_mpx_s","value":33.6,"ms":1486.764,"iters":3,"warmup":1,"host":"vipavani","gpu_present":true,"gpu_name":"NVIDIA RTX 2000 Ada","baseline_ref":"5c8ef5c","decision":"reverted","notes":"NEGATIVE RESULT: GPU double-buffering does not help because the kernel is transfer-bound (compute=0.01ms, upload=78% of wall time). There is no compute to overlap upload with. The PCIe bus is the bottleneck, not the kernel pipeline. After Wave 9 multi-core, parallel CPU (164 MP/s) is 4.9x faster than GPU (33.6 MP/s). DROPPED."}
{"ts":"2026-07-20T14:00:00.000Z","commit":"b5c94ea","issue":117,"route":"rgb->lab","tier":"cpu","input_size":50000000,"metric":"throughput_mpx_s","value":111.3,"ms":449.257,"iters":3,"warmup":1,"host":"vipavani","gpu_present":false,"baseline_ref":"d9cc517","decision":"kept","notes":"Fast cbrt (bit-hack initial guess + 2 Newton-Raphson iterations). Measured on staging HEAD with LUT + cbrt stacked. Pre-cbrt baseline (post-LUT, N=10M): 68.6 MP/s. Post-cbrt (N=10M): 112.3 MP/s = +63.7%. At N=50M: 111.3 MP/s. Accuracy <1e-6 vs builtin cbrt. N=50,000,000."}
{"ts":"2026-07-20T14:00:00.000Z","commit":"b5c94ea","issue":117,"route":"rgb->lab","tier":"cpu","input_size":50000000,"metric":"throughput_mpx_s","value":164.0,"ms":304.872,"iters":3,"warmup":1,"host":"vipavani","gpu_present":false,"baseline_ref":"b5c94ea","decision":"kept","notes":"Multi-core parallel (rayon, 28 cores) on top of LUT + fast cbrt. Serial: 115.5 MP/s. Parallel: 164.0 MP/s. Speedup: 1.42x — MODEST because the LUT+cbrt optimizations made rgb->lab memory-bandwidth-bound, not compute-bound. Multi-core can't help when the memory bus is saturated. N=50,000,000."}
{"ts":"2026-07-20T13:42:41.866Z","commit":"c01544c","issue":110,"route":"rgb->xyz","tier":"cpu","input_size":50000000,"metric":"throughput_mpx_s","value":89.25,"ms":560.252,"iters":3,"warmup":1,"host":"vipavani","gpu_present":false,"decision":"baseline","notes":"serial SIMD (1 core), N=50,000,000"}
{"ts":"2026-07-20T13:42:44.322Z","commit":"c01544c","issue":110,"route":"rgb->xyz","tier":"cpu","input_size":50000000,"metric":"throughput_mpx_s","value":82.96,"ms":602.725,"iters":3,"warmup":1,"host":"vipavani","gpu_present":false,"decision":"reverted","baseline_ref":"c01544c","notes":"parallel SIMD (rayon 28 cores), N=50,000,000, speedup=0.93x"}
{"ts":"2026-07-20T13:42:46.813Z","commit":"c01544c","issue":110,"route":"rgb->lab","tier":"cpu","input_size":50000000,"metric":"throughput_mpx_s","value":86.78,"ms":576.195,"iters":3,"warmup":1,"host":"vipavani","gpu_present":false,"decision":"baseline","notes":"serial SIMD (1 core), N=50,000,000"}
{"ts":"2026-07-20T13:42:49.457Z","commit":"c01544c","issue":110,"route":"rgb->lab","tier":"cpu","input_size":50000000,"metric":"throughput_mpx_s","value":77.20,"ms":647.701,"iters":3,"warmup":1,"host":"vipavani","gpu_present":false,"decision":"reverted","baseline_ref":"c01544c","notes":"parallel SIMD (rayon 28 cores), N=50,000,000, speedup=0.89x"}
{"ts":"2026-07-20T13:42:51.859Z","commit":"c01544c","issue":110,"route":"rgb->hsl","tier":"cpu","input_size":50000000,"metric":"throughput_mpx_s","value":85.29,"ms":586.229,"iters":3,"warmup":1,"host":"vipavani","gpu_present":false,"decision":"baseline","notes":"serial SIMD (1 core), N=50,000,000"}
{"ts":"2026-07-20T13:42:54.034Z","commit":"c01544c","issue":110,"route":"rgb->hsl","tier":"cpu","input_size":50000000,"metric":"throughput_mpx_s","value":141.74,"ms":352.756,"iters":3,"warmup":1,"host":"vipavani","gpu_present":false,"decision":"kept","baseline_ref":"c01544c","notes":"parallel SIMD (rayon 28 cores), N=50,000,000, speedup=1.66x"}
{"ts":"2026-07-20T13:42:55.441Z","commit":"c01544c","issue":110,"route":"rgb->hsv","tier":"cpu","input_size":50000000,"metric":"throughput_mpx_s","value":144.59,"ms":345.806,"iters":3,"warmup":1,"host":"vipavani","gpu_present":false,"decision":"baseline","notes":"serial SIMD (1 core), N=50,000,000"}
{"ts":"2026-07-20T13:42:56.957Z","commit":"c01544c","issue":110,"route":"rgb->hsv","tier":"cpu","input_size":50000000,"metric":"throughput_mpx_s","value":135.92,"ms":367.861,"iters":3,"warmup":1,"host":"vipavani","gpu_present":false,"decision":"reverted","baseline_ref":"c01544c","notes":"parallel SIMD (rayon 28 cores), N=50,000,000, speedup=0.94x"}
{"ts":"2026-07-20T13:42:58.710Z","commit":"c01544c","issue":110,"route":"rgb->cmyk","tier":"cpu","input_size":50000000,"metric":"throughput_mpx_s","value":114.57,"ms":436.423,"iters":3,"warmup":1,"host":"vipavani","gpu_present":false,"decision":"baseline","notes":"serial SIMD (1 core), N=50,000,000"}
{"ts":"2026-07-20T13:43:00.568Z","commit":"c01544c","issue":110,"route":"rgb->cmyk","tier":"cpu","input_size":50000000,"metric":"throughput_mpx_s","value":108.94,"ms":458.959,"iters":3,"warmup":1,"host":"vipavani","gpu_present":false,"decision":"reverted","baseline_ref":"c01544c","notes":"parallel SIMD (rayon 28 cores), N=50,000,000, speedup=0.95x"}
{"ts":"2026-07-20T13:43:01.949Z","commit":"c01544c","issue":110,"route":"rgb->hwb","tier":"cpu","input_size":50000000,"metric":"throughput_mpx_s","value":148.49,"ms":336.726,"iters":3,"warmup":1,"host":"vipavani","gpu_present":false,"decision":"baseline","notes":"serial SIMD (1 core), N=50,000,000"}
{"ts":"2026-07-20T13:43:03.462Z","commit":"c01544c","issue":110,"route":"rgb->hwb","tier":"cpu","input_size":50000000,"metric":"throughput_mpx_s","value":137.90,"ms":362.585,"iters":3,"warmup":1,"host":"vipavani","gpu_present":false,"decision":"reverted","baseline_ref":"c01544c","notes":"parallel SIMD (rayon 28 cores), N=50,000,000, speedup=0.93x"}
{"ts":"2026-07-20T13:43:04.928Z","commit":"c01544c","issue":110,"route":"rgb->oklab","tier":"cpu","input_size":50000000,"metric":"throughput_mpx_s","value":137.68,"ms":363.154,"iters":3,"warmup":1,"host":"vipavani","gpu_present":false,"decision":"baseline","notes":"serial SIMD (1 core), N=50,000,000"}
{"ts":"2026-07-20T13:43:06.516Z","commit":"c01544c","issue":110,"route":"rgb->oklab","tier":"cpu","input_size":50000000,"metric":"throughput_mpx_s","value":130.68,"ms":382.601,"iters":3,"warmup":1,"host":"vipavani","gpu_present":false,"decision":"reverted","baseline_ref":"c01544c","notes":"parallel SIMD (rayon 28 cores), N=50,000,000, speedup=0.95x"}
{"ts":"2026-07-20T13:43:07.934Z","commit":"c01544c","issue":110,"route":"rgb->hcg","tier":"cpu","input_size":50000000,"metric":"throughput_mpx_s","value":148.89,"ms":335.810,"iters":3,"warmup":1,"host":"vipavani","gpu_present":false,"decision":"baseline","notes":"serial SIMD (1 core), N=50,000,000"}
{"ts":"2026-07-20T13:43:09.395Z","commit":"c01544c","issue":110,"route":"rgb->hcg","tier":"cpu","input_size":50000000,"metric":"throughput_mpx_s","value":141.60,"ms":353.117,"iters":3,"warmup":1,"host":"vipavani","gpu_present":false,"decision":"reverted","baseline_ref":"c01544c","notes":"parallel SIMD (rayon 28 cores), N=50,000,000, speedup=0.95x"}
{"ts":"2026-07-20T13:43:10.655Z","commit":"c01544c","issue":110,"route":"rgb->apple","tier":"cpu","input_size":50000000,"metric":"throughput_mpx_s","value":159.76,"ms":312.971,"iters":3,"warmup":1,"host":"vipavani","gpu_present":false,"decision":"baseline","notes":"serial SIMD (1 core), N=50,000,000"}
{"ts":"2026-07-20T13:43:12.076Z","commit":"c01544c","issue":110,"route":"rgb->apple","tier":"cpu","input_size":50000000,"metric":"throughput_mpx_s","value":142.57,"ms":350.701,"iters":3,"warmup":1,"host":"vipavani","gpu_present":false,"decision":"reverted","baseline_ref":"c01544c","notes":"parallel SIMD (rayon 28 cores), N=50,000,000, speedup=0.89x"}
