{"ts":"2026-07-20T09:15:54.479Z","commit":"67ecbf8","issue":105,"route":"lab->xyz","tier":"cpu","input_size":50000000,"metric":"throughput_mpx_s","value":95.11,"ms":525.696,"iters":3,"warmup":1,"host":"vipavani","gpu_present":false,"decision":"baseline","notes":"Rust scalar batch baseline (pre-SIMD, f64 lab::xyz), N=50,000,000"}
{"ts":"2026-07-20T09:15:55.667Z","commit":"67ecbf8","issue":105,"route":"lab->xyz","tier":"cpu","input_size":50000000,"metric":"throughput_mpx_s","value":169.34,"ms":295.262,"iters":3,"warmup":1,"host":"vipavani","gpu_present":false,"decision":"kept","baseline_ref":"67ecbf8","notes":"wide::f32x8 SIMD batch (inv lab transfer mask-blend + wp scale), N=50,000,000, speedup=1.78x, tol=1e-3"}
{"ts":"2026-07-20T09:16:07.242Z","commit":"67ecbf8","issue":105,"route":"oklab->rgb","tier":"cpu","input_size":50000000,"metric":"throughput_mpx_s","value":19.93,"ms":2509.217,"iters":3,"warmup":1,"host":"vipavani","gpu_present":false,"decision":"baseline","notes":"Rust scalar batch baseline (pre-SIMD, f64 oklab::rgb), N=50,000,000"}
{"ts":"2026-07-20T09:16:11.372Z","commit":"67ecbf8","issue":105,"route":"oklab->rgb","tier":"cpu","input_size":50000000,"metric":"throughput_mpx_s","value":48.66,"ms":1027.537,"iters":3,"warmup":1,"host":"vipavani","gpu_present":false,"decision":"kept","baseline_ref":"67ecbf8","notes":"wide::f32x8 SIMD batch (inverse Oklab + cube + inverse LMS + gamma), N=50,000,000, speedup=2.44x, tol=1e-2"}
{"ts":"2026-07-20T09:16:17.737Z","commit":"67ecbf8","issue":105,"route":"hcg->rgb","tier":"cpu","input_size":50000000,"metric":"throughput_mpx_s","value":33.27,"ms":1502.669,"iters":3,"warmup":1,"host":"vipavani","gpu_present":false,"decision":"baseline","notes":"Rust scalar batch baseline (pre-SIMD, f64 hcg::rgb), N=50,000,000"}
{"ts":"2026-07-20T09:16:19.265Z","commit":"67ecbf8","issue":105,"route":"hcg->rgb","tier":"cpu","input_size":50000000,"metric":"throughput_mpx_s","value":131.03,"ms":381.605,"iters":3,"warmup":1,"host":"vipavani","gpu_present":false,"decision":"kept","baseline_ref":"67ecbf8","notes":"wide::f32x8 SIMD batch (6-way mask-blend + chroma-guard grayscale), N=50,000,000, speedup=3.94x, tol=1e-3"}
{"ts":"2026-07-20T09:20:00.000Z","commit":"67ecbf8","issue":105,"route":"hcg->rgb","tier":"js","input_size":10000000,"metric":"throughput_mpx_s","value":14.19,"ms":705.047,"iters":5,"warmup":1,"host":"vipavani","gpu_present":false,"decision":"baseline","notes":"JS color-convert@3.1.3 baseline (convert.hcg.rgb), N=10,000,000"}
{"ts":"2026-07-20T11:09:54.181Z","commit":"4cc3680","issue":110,"route":"rgb->xyz","tier":"cpu","input_size":50000000,"metric":"throughput_mpx_s","value":46.74,"ms":1069.859,"iters":3,"warmup":1,"host":"vipavani","gpu_present":false,"decision":"baseline","notes":"serial SIMD (1 core), N=50,000,000"}
{"ts":"2026-07-20T11:09:55.534Z","commit":"4cc3680","issue":110,"route":"rgb->xyz","tier":"cpu","input_size":50000000,"metric":"throughput_mpx_s","value":153.07,"ms":326.656,"iters":3,"warmup":1,"host":"vipavani","gpu_present":false,"decision":"kept","baseline_ref":"4cc3680","notes":"parallel SIMD (rayon 28 cores), N=50,000,000, speedup=3.28x"}
{"ts":"2026-07-20T11:10:01.774Z","commit":"4cc3680","issue":110,"route":"rgb->lab","tier":"cpu","input_size":50000000,"metric":"throughput_mpx_s","value":32.15,"ms":1555.349,"iters":3,"warmup":1,"host":"vipavani","gpu_present":false,"decision":"baseline","notes":"serial SIMD (1 core), N=50,000,000"}
{"ts":"2026-07-20T11:10:03.195Z","commit":"4cc3680","issue":110,"route":"rgb->lab","tier":"cpu","input_size":50000000,"metric":"throughput_mpx_s","value":144.33,"ms":346.434,"iters":3,"warmup":1,"host":"vipavani","gpu_present":false,"decision":"kept","baseline_ref":"4cc3680","notes":"parallel SIMD (rayon 28 cores), N=50,000,000, speedup=4.49x"}
{"ts":"2026-07-20T11:10:04.569Z","commit":"4cc3680","issue":110,"route":"rgb->hsl","tier":"cpu","input_size":50000000,"metric":"throughput_mpx_s","value":146.49,"ms":341.322,"iters":3,"warmup":1,"host":"vipavani","gpu_present":false,"decision":"baseline","notes":"serial SIMD (1 core), N=50,000,000"}
{"ts":"2026-07-20T11:10:05.780Z","commit":"4cc3680","issue":110,"route":"rgb->hsl","tier":"cpu","input_size":50000000,"metric":"throughput_mpx_s","value":165.73,"ms":301.703,"iters":3,"warmup":1,"host":"vipavani","gpu_present":false,"decision":"kept","baseline_ref":"4cc3680","notes":"parallel SIMD (rayon 28 cores), N=50,000,000, speedup=1.13x"}
{"ts":"2026-07-20T11:10:07.133Z","commit":"4cc3680","issue":110,"route":"rgb->hsv","tier":"cpu","input_size":50000000,"metric":"throughput_mpx_s","value":150.46,"ms":332.305,"iters":3,"warmup":1,"host":"vipavani","gpu_present":false,"decision":"baseline","notes":"serial SIMD (1 core), N=50,000,000"}
{"ts":"2026-07-20T11:10:08.339Z","commit":"4cc3680","issue":110,"route":"rgb->hsv","tier":"cpu","input_size":50000000,"metric":"throughput_mpx_s","value":169.28,"ms":295.364,"iters":3,"warmup":1,"host":"vipavani","gpu_present":false,"decision":"kept","baseline_ref":"4cc3680","notes":"parallel SIMD (rayon 28 cores), N=50,000,000, speedup=1.13x"}
{"ts":"2026-07-20T11:10:09.825Z","commit":"4cc3680","issue":110,"route":"rgb->cmyk","tier":"cpu","input_size":50000000,"metric":"throughput_mpx_s","value":135.92,"ms":367.862,"iters":3,"warmup":1,"host":"vipavani","gpu_present":false,"decision":"baseline","notes":"serial SIMD (1 core), N=50,000,000"}
{"ts":"2026-07-20T11:10:11.460Z","commit":"4cc3680","issue":110,"route":"rgb->cmyk","tier":"cpu","input_size":50000000,"metric":"throughput_mpx_s","value":124.56,"ms":401.406,"iters":3,"warmup":1,"host":"vipavani","gpu_present":false,"decision":"reverted","baseline_ref":"4cc3680","notes":"parallel SIMD (rayon 28 cores), N=50,000,000, speedup=0.92x"}
{"ts":"2026-07-20T11:10:12.764Z","commit":"4cc3680","issue":110,"route":"rgb->hwb","tier":"cpu","input_size":50000000,"metric":"throughput_mpx_s","value":154.72,"ms":323.169,"iters":3,"warmup":1,"host":"vipavani","gpu_present":false,"decision":"baseline","notes":"serial SIMD (1 core), N=50,000,000"}
{"ts":"2026-07-20T11:10:13.977Z","commit":"4cc3680","issue":110,"route":"rgb->hwb","tier":"cpu","input_size":50000000,"metric":"throughput_mpx_s","value":169.38,"ms":295.189,"iters":3,"warmup":1,"host":"vipavani","gpu_present":false,"decision":"kept","baseline_ref":"4cc3680","notes":"parallel SIMD (rayon 28 cores), N=50,000,000, speedup=1.09x"}
{"ts":"2026-07-20T11:10:20.217Z","commit":"4cc3680","issue":110,"route":"rgb->oklab","tier":"cpu","input_size":50000000,"metric":"throughput_mpx_s","value":32.06,"ms":1559.551,"iters":3,"warmup":1,"host":"vipavani","gpu_present":false,"decision":"baseline","notes":"serial SIMD (1 core), N=50,000,000"}
{"ts":"2026-07-20T11:10:21.698Z","commit":"4cc3680","issue":110,"route":"rgb->oklab","tier":"cpu","input_size":50000000,"metric":"throughput_mpx_s","value":137.81,"ms":362.819,"iters":3,"warmup":1,"host":"vipavani","gpu_present":false,"decision":"kept","baseline_ref":"4cc3680","notes":"parallel SIMD (rayon 28 cores), N=50,000,000, speedup=4.30x"}
{"ts":"2026-07-20T11:10:23.198Z","commit":"4cc3680","issue":110,"route":"rgb->hcg","tier":"cpu","input_size":50000000,"metric":"throughput_mpx_s","value":134.34,"ms":372.200,"iters":3,"warmup":1,"host":"vipavani","gpu_present":false,"decision":"baseline","notes":"serial SIMD (1 core), N=50,000,000"}
{"ts":"2026-07-20T11:10:24.422Z","commit":"4cc3680","issue":110,"route":"rgb->hcg","tier":"cpu","input_size":50000000,"metric":"throughput_mpx_s","value":164.46,"ms":304.018,"iters":3,"warmup":1,"host":"vipavani","gpu_present":false,"decision":"kept","baseline_ref":"4cc3680","notes":"parallel SIMD (rayon 28 cores), N=50,000,000, speedup=1.22x"}
{"ts":"2026-07-20T11:10:25.542Z","commit":"4cc3680","issue":110,"route":"rgb->apple","tier":"cpu","input_size":50000000,"metric":"throughput_mpx_s","value":180.56,"ms":276.911,"iters":3,"warmup":1,"host":"vipavani","gpu_present":false,"decision":"baseline","notes":"serial SIMD (1 core), N=50,000,000"}
{"ts":"2026-07-20T11:10:26.730Z","commit":"4cc3680","issue":110,"route":"rgb->apple","tier":"cpu","input_size":50000000,"metric":"throughput_mpx_s","value":170.77,"ms":292.783,"iters":3,"warmup":1,"host":"vipavani","gpu_present":false,"decision":"reverted","baseline_ref":"4cc3680","notes":"parallel SIMD (rayon 28 cores), N=50,000,000, speedup=0.95x"}
{"ts":"2026-07-20T11:10:30.506Z","commit":"4cc3680","issue":110,"route":"xyz->lab","tier":"cpu","input_size":50000000,"metric":"throughput_mpx_s","value":73.41,"ms":681.144,"iters":3,"warmup":1,"host":"vipavani","gpu_present":false,"decision":"baseline","notes":"serial SIMD (1 core), N=50,000,000"}
{"ts":"2026-07-20T11:10:31.724Z","commit":"4cc3680","issue":110,"route":"xyz->lab","tier":"cpu","input_size":50000000,"metric":"throughput_mpx_s","value":167.42,"ms":298.652,"iters":3,"warmup":1,"host":"vipavani","gpu_present":false,"decision":"kept","baseline_ref":"4cc3680","notes":"parallel SIMD (rayon 28 cores), N=50,000,000, speedup=2.28x"}
{"ts":"2026-07-20T11:10:33.622Z","commit":"4cc3680","issue":110,"route":"hsl->rgb","tier":"cpu","input_size":50000000,"metric":"throughput_mpx_s","value":127.05,"ms":393.545,"iters":3,"warmup":1,"host":"vipavani","gpu_present":false,"decision":"baseline","notes":"serial SIMD (1 core), N=50,000,000"}
{"ts":"2026-07-20T11:10:34.826Z","commit":"4cc3680","issue":110,"route":"hsl->rgb","tier":"cpu","input_size":50000000,"metric":"throughput_mpx_s","value":177.14,"ms":282.270,"iters":3,"warmup":1,"host":"vipavani","gpu_present":false,"decision":"kept","baseline_ref":"4cc3680","notes":"parallel SIMD (rayon 28 cores), N=50,000,000, speedup=1.39x"}
{"ts":"2026-07-20T11:10:37.557Z","commit":"4cc3680","issue":110,"route":"hsv->rgb","tier":"cpu","input_size":50000000,"metric":"throughput_mpx_s","value":82.32,"ms":607.361,"iters":3,"warmup":1,"host":"vipavani","gpu_present":false,"decision":"baseline","notes":"serial SIMD (1 core), N=50,000,000"}
{"ts":"2026-07-20T11:10:38.716Z","commit":"4cc3680","issue":110,"route":"hsv->rgb","tier":"cpu","input_size":50000000,"metric":"throughput_mpx_s","value":177.51,"ms":281.677,"iters":3,"warmup":1,"host":"vipavani","gpu_present":false,"decision":"kept","baseline_ref":"4cc3680","notes":"parallel SIMD (rayon 28 cores), N=50,000,000, speedup=2.16x"}
{"ts":"2026-07-20T11:10:44.285Z","commit":"4cc3680","issue":110,"route":"oklab->rgb","tier":"cpu","input_size":50000000,"metric":"throughput_mpx_s","value":49.74,"ms":1005.173,"iters":3,"warmup":1,"host":"vipavani","gpu_present":false,"decision":"baseline","notes":"serial SIMD (1 core), N=50,000,000"}
{"ts":"2026-07-20T11:10:45.489Z","commit":"4cc3680","issue":110,"route":"oklab->rgb","tier":"cpu","input_size":50000000,"metric":"throughput_mpx_s","value":170.35,"ms":293.511,"iters":3,"warmup":1,"host":"vipavani","gpu_present":false,"decision":"kept","baseline_ref":"4cc3680","notes":"parallel SIMD (rayon 28 cores), N=50,000,000, speedup=3.42x"}
{"ts":"2026-07-20T11:10:47.219Z","commit":"4cc3680","issue":110,"route":"hcg->rgb","tier":"cpu","input_size":50000000,"metric":"throughput_mpx_s","value":143.39,"ms":348.707,"iters":3,"warmup":1,"host":"vipavani","gpu_present":false,"decision":"baseline","notes":"serial SIMD (1 core), N=50,000,000"}
{"ts":"2026-07-20T11:10:48.331Z","commit":"4cc3680","issue":110,"route":"hcg->rgb","tier":"cpu","input_size":50000000,"metric":"throughput_mpx_s","value":182.19,"ms":274.445,"iters":3,"warmup":1,"host":"vipavani","gpu_present":false,"decision":"kept","baseline_ref":"4cc3680","notes":"parallel SIMD (rayon 28 cores), N=50,000,000, speedup=1.27x"}
{"ts":"2026-07-20T11:10:52.164Z","commit":"4cc3680","issue":110,"route":"xyz->rgb","tier":"cpu","input_size":50000000,"metric":"throughput_mpx_s","value":52.24,"ms":957.156,"iters":3,"warmup":1,"host":"vipavani","gpu_present":false,"decision":"baseline","notes":"serial SIMD (1 core), N=50,000,000"}
{"ts":"2026-07-20T11:10:53.343Z","commit":"4cc3680","issue":110,"route":"xyz->rgb","tier":"cpu","input_size":50000000,"metric":"throughput_mpx_s","value":172.84,"ms":289.292,"iters":3,"warmup":1,"host":"vipavani","gpu_present":false,"decision":"kept","baseline_ref":"4cc3680","notes":"parallel SIMD (rayon 28 cores), N=50,000,000, speedup=3.31x"}
{"ts":"2026-07-20T11:10:56.182Z","commit":"4cc3680","issue":110,"route":"lab->xyz","tier":"cpu","input_size":50000000,"metric":"throughput_mpx_s","value":176.36,"ms":283.514,"iters":3,"warmup":1,"host":"vipavani","gpu_present":false,"decision":"baseline","notes":"serial SIMD (1 core), N=50,000,000"}
{"ts":"2026-07-20T11:10:57.346Z","commit":"4cc3680","issue":110,"route":"lab->xyz","tier":"cpu","input_size":50000000,"metric":"throughput_mpx_s","value":176.11,"ms":283.921,"iters":3,"warmup":1,"host":"vipavani","gpu_present":false,"decision":"reverted","baseline_ref":"4cc3680","notes":"parallel SIMD (rayon 28 cores), N=50,000,000, speedup=1.00x"}
{"ts":"2026-07-20T12:11:30Z","commit":"94e8273","issue":118,"route":"lab->cmyk","tier":"cpu","input_size":100000,"metric":"throughput_mpx_s","value":6.70,"ms":14.875,"iters":10,"warmup":3,"host":"vipavani","gpu_present":false,"decision":"baseline","notes":"Rust scalar per-pixel convert(lab→cmyk) baseline, N=100,000"}
{"ts":"2026-07-20T12:11:30Z","commit":"94e8273","issue":118,"route":"lab->cmyk","tier":"cpu","input_size":100000,"metric":"throughput_mpx_s","value":19.70,"ms":5.085,"iters":10,"warmup":3,"host":"vipavani","gpu_present":false,"decision":"kept","notes":"Rust SIMD fused batch convert_batch(lab→cmyk), chains lab_to_xyz_batch→xyz_to_rgb_batch→rgb_to_cmyk_batch, 2.93× vs scalar, N=100,000"}
{"ts":"2026-07-20T12:11:30Z","commit":"94e8273","issue":118,"route":"lab->cmyk","tier":"cpu","input_size":1000000,"metric":"throughput_mpx_s","value":6.70,"ms":149.862,"iters":5,"warmup":2,"host":"vipavani","gpu_present":false,"decision":"baseline","notes":"Rust scalar per-pixel convert(lab→cmyk) baseline, N=1,000,000"}
{"ts":"2026-07-20T12:11:30Z","commit":"94e8273","issue":118,"route":"lab->cmyk","tier":"cpu","input_size":1000000,"metric":"throughput_mpx_s","value":17.50,"ms":57.124,"iters":5,"warmup":2,"host":"vipavani","gpu_present":false,"decision":"kept","notes":"Rust SIMD fused batch convert_batch(lab→cmyk), chains lab_to_xyz_batch→xyz_to_rgb_batch→rgb_to_cmyk_batch, 2.62× vs scalar, N=1,000,000"}
{"ts":"2026-07-20T12:24:52.116Z","commit":"f8b54e2","issue":122,"route":"rgb->cmyk","tier":"cpu","input_size":10000000,"metric":"throughput_mpx_s","value":138.21,"ms":72.352,"iters":3,"warmup":1,"host":"vipavani","gpu_present":false,"decision":"baseline","notes":"serial SIMD (1 core), N=10,000,000, chunk=65536"}
{"ts":"2026-07-20T12:24:52.494Z","commit":"f8b54e2","issue":122,"route":"rgb->cmyk","tier":"cpu","input_size":10000000,"metric":"throughput_mpx_s","value":118.03,"ms":84.723,"iters":3,"warmup":1,"host":"vipavani","gpu_present":false,"decision":"reverted","notes":"parallel SIMD (rayon 28 cores), N=10,000,000, chunk=65536, speedup=0.85x"}
{"ts":"2026-07-20T12:24:52.711Z","commit":"f8b54e2","issue":122,"route":"rgb->apple","tier":"cpu","input_size":10000000,"metric":"throughput_mpx_s","value":188.89,"ms":52.942,"iters":3,"warmup":1,"host":"vipavani","gpu_present":false,"decision":"baseline","notes":"serial SIMD (1 core), N=10,000,000, chunk=65536"}
{"ts":"2026-07-20T12:24:52.973Z","commit":"f8b54e2","issue":122,"route":"rgb->apple","tier":"cpu","input_size":10000000,"metric":"throughput_mpx_s","value":160.05,"ms":62.481,"iters":3,"warmup":1,"host":"vipavani","gpu_present":false,"decision":"reverted","notes":"parallel SIMD (rayon 28 cores), N=10,000,000, chunk=65536, speedup=0.85x"}
{"ts":"2026-07-20T12:24:53.230Z","commit":"f8b54e2","issue":122,"route":"lab->xyz","tier":"cpu","input_size":10000000,"metric":"throughput_mpx_s","value":165.91,"ms":60.273,"iters":3,"warmup":1,"host":"vipavani","gpu_present":false,"decision":"baseline","notes":"serial SIMD (1 core), N=10,000,000, chunk=65536"}
{"ts":"2026-07-20T12:24:53.493Z","commit":"f8b54e2","issue":122,"route":"lab->xyz","tier":"cpu","input_size":10000000,"metric":"throughput_mpx_s","value":155.27,"ms":64.405,"iters":3,"warmup":1,"host":"vipavani","gpu_present":false,"decision":"reverted","notes":"parallel SIMD (rayon 28 cores), N=10,000,000, chunk=65536, speedup=0.94x"}
{"ts":"2026-07-20T12:24:53.782Z","commit":"f8b54e2","issue":122,"route":"rgb->cmyk","tier":"cpu","input_size":10000000,"metric":"throughput_mpx_s","value":141.79,"ms":70.527,"iters":3,"warmup":1,"host":"vipavani","gpu_present":false,"decision":"baseline","notes":"serial SIMD (1 core), N=10,000,000, chunk=262144"}
{"ts":"2026-07-20T12:24:54.139Z","commit":"f8b54e2","issue":122,"route":"rgb->cmyk","tier":"cpu","input_size":10000000,"metric":"throughput_mpx_s","value":116.00,"ms":86.203,"iters":3,"warmup":1,"host":"vipavani","gpu_present":false,"decision":"reverted","notes":"parallel SIMD (rayon 28 cores), N=10,000,000, chunk=262144, speedup=0.82x"}
{"ts":"2026-07-20T12:24:54.362Z","commit":"f8b54e2","issue":122,"route":"rgb->apple","tier":"cpu","input_size":10000000,"metric":"throughput_mpx_s","value":184.32,"ms":54.253,"iters":3,"warmup":1,"host":"vipavani","gpu_present":false,"decision":"baseline","notes":"serial SIMD (1 core), N=10,000,000, chunk=262144"}
{"ts":"2026-07-20T12:24:54.623Z","commit":"f8b54e2","issue":122,"route":"rgb->apple","tier":"cpu","input_size":10000000,"metric":"throughput_mpx_s","value":154.97,"ms":64.528,"iters":3,"warmup":1,"host":"vipavani","gpu_present":false,"decision":"reverted","notes":"parallel SIMD (rayon 28 cores), N=10,000,000, chunk=262144, speedup=0.84x"}
{"ts":"2026-07-20T12:24:54.865Z","commit":"f8b54e2","issue":122,"route":"lab->xyz","tier":"cpu","input_size":10000000,"metric":"throughput_mpx_s","value":169.60,"ms":58.963,"iters":3,"warmup":1,"host":"vipavani","gpu_present":false,"decision":"baseline","notes":"serial SIMD (1 core), N=10,000,000, chunk=262144"}
{"ts":"2026-07-20T12:24:55.136Z","commit":"f8b54e2","issue":122,"route":"lab->xyz","tier":"cpu","input_size":10000000,"metric":"throughput_mpx_s","value":153.87,"ms":64.988,"iters":3,"warmup":1,"host":"vipavani","gpu_present":false,"decision":"reverted","notes":"parallel SIMD (rayon 28 cores), N=10,000,000, chunk=262144, speedup=0.91x"}
{"ts":"2026-07-20T12:24:55.423Z","commit":"f8b54e2","issue":122,"route":"rgb->cmyk","tier":"cpu","input_size":10000000,"metric":"throughput_mpx_s","value":140.85,"ms":70.998,"iters":3,"warmup":1,"host":"vipavani","gpu_present":false,"decision":"baseline","notes":"serial SIMD (1 core), N=10,000,000, chunk=524288"}
{"ts":"2026-07-20T12:24:55.768Z","commit":"f8b54e2","issue":122,"route":"rgb->cmyk","tier":"cpu","input_size":10000000,"metric":"throughput_mpx_s","value":123.07,"ms":81.258,"iters":3,"warmup":1,"host":"vipavani","gpu_present":false,"decision":"reverted","notes":"parallel SIMD (rayon 28 cores), N=10,000,000, chunk=524288, speedup=0.87x"}
{"ts":"2026-07-20T12:24:55.983Z","commit":"f8b54e2","issue":122,"route":"rgb->apple","tier":"cpu","input_size":10000000,"metric":"throughput_mpx_s","value":187.28,"ms":53.397,"iters":3,"warmup":1,"host":"vipavani","gpu_present":false,"decision":"baseline","notes":"serial SIMD (1 core), N=10,000,000, chunk=524288"}
{"ts":"2026-07-20T12:24:56.241Z","commit":"f8b54e2","issue":122,"route":"rgb->apple","tier":"cpu","input_size":10000000,"metric":"throughput_mpx_s","value":162.97,"ms":61.361,"iters":3,"warmup":1,"host":"vipavani","gpu_present":false,"decision":"reverted","notes":"parallel SIMD (rayon 28 cores), N=10,000,000, chunk=524288, speedup=0.87x"}
{"ts":"2026-07-20T12:24:56.474Z","commit":"f8b54e2","issue":122,"route":"lab->xyz","tier":"cpu","input_size":10000000,"metric":"throughput_mpx_s","value":172.11,"ms":58.101,"iters":3,"warmup":1,"host":"vipavani","gpu_present":false,"decision":"baseline","notes":"serial SIMD (1 core), N=10,000,000, chunk=524288"}
{"ts":"2026-07-20T12:24:56.746Z","commit":"f8b54e2","issue":122,"route":"lab->xyz","tier":"cpu","input_size":10000000,"metric":"throughput_mpx_s","value":154.93,"ms":64.547,"iters":3,"warmup":1,"host":"vipavani","gpu_present":false,"decision":"reverted","notes":"parallel SIMD (rayon 28 cores), N=10,000,000, chunk=524288, speedup=0.90x"}
{"ts":"2026-07-20T12:24:57.030Z","commit":"f8b54e2","issue":122,"route":"rgb->cmyk","tier":"cpu","input_size":10000000,"metric":"throughput_mpx_s","value":141.94,"ms":70.453,"iters":3,"warmup":1,"host":"vipavani","gpu_present":false,"decision":"baseline","notes":"serial SIMD (1 core), N=10,000,000, chunk=1048576"}
{"ts":"2026-07-20T12:24:57.391Z","commit":"f8b54e2","issue":122,"route":"rgb->cmyk","tier":"cpu","input_size":10000000,"metric":"throughput_mpx_s","value":116.51,"ms":85.830,"iters":3,"warmup":1,"host":"vipavani","gpu_present":false,"decision":"reverted","notes":"parallel SIMD (rayon 28 cores), N=10,000,000, chunk=1048576, speedup=0.82x"}
{"ts":"2026-07-20T12:24:57.606Z","commit":"f8b54e2","issue":122,"route":"rgb->apple","tier":"cpu","input_size":10000000,"metric":"throughput_mpx_s","value":187.23,"ms":53.411,"iters":3,"warmup":1,"host":"vipavani","gpu_present":false,"decision":"baseline","notes":"serial SIMD (1 core), N=10,000,000, chunk=1048576"}
{"ts":"2026-07-20T12:24:57.875Z","commit":"f8b54e2","issue":122,"route":"rgb->apple","tier":"cpu","input_size":10000000,"metric":"throughput_mpx_s","value":151.80,"ms":65.874,"iters":3,"warmup":1,"host":"vipavani","gpu_present":false,"decision":"reverted","notes":"parallel SIMD (rayon 28 cores), N=10,000,000, chunk=1048576, speedup=0.81x"}
{"ts":"2026-07-20T12:24:58.108Z","commit":"f8b54e2","issue":122,"route":"lab->xyz","tier":"cpu","input_size":10000000,"metric":"throughput_mpx_s","value":172.91,"ms":57.834,"iters":3,"warmup":1,"host":"vipavani","gpu_present":false,"decision":"baseline","notes":"serial SIMD (1 core), N=10,000,000, chunk=1048576"}
