{"ts":"2026-07-14T07:10:18.928Z","commit":"df61a3c","issue":72,"route":"rgb->cmyk","tier":"cpu","input_size":50000000,"metric":"throughput_mpx_s","value":63.78,"ms":783.940,"iters":3,"warmup":1,"host":"vipavani","gpu_present":false,"decision":"baseline","notes":"Rust scalar batch baseline (pre-SIMD), N=50,000,000"}
{"ts":"2026-07-14T07:10:20.471Z","commit":"df61a3c","issue":72,"route":"rgb->cmyk","tier":"cpu","input_size":50000000,"metric":"throughput_mpx_s","value":130.05,"ms":384.462,"iters":3,"warmup":1,"host":"vipavani","gpu_present":false,"decision":"kept","baseline_ref":"df61a3c","notes":"wide::f32x8 SIMD batch (mask-blend black guard), N=50,000,000"}
{"ts":"2026-07-14T07:11:28.269Z","commit":"874b4fe","issue":71,"route":"rgb->xyz","tier":"cpu","input_size":50000000,"metric":"throughput_mpx_s","value":45.18,"ms":1106.786,"iters":3,"warmup":1,"host":"vipavani","gpu_present":false,"decision":"baseline","notes":"wide::f64x4 SIMD batch, N=50,000,000"}
{"ts":"2026-07-14T07:11:35.610Z","commit":"874b4fe","issue":71,"route":"rgb->lab","tier":"cpu","input_size":50000000,"metric":"throughput_mpx_s","value":27.30,"ms":1831.336,"iters":3,"warmup":1,"host":"vipavani","gpu_present":false,"decision":"baseline","notes":"wide::f32x8 SIMD two-step chain (xyz→lab), #61 baseline, N=50,000,000"}
{"ts":"2026-07-14T07:11:42.047Z","commit":"874b4fe","issue":71,"route":"rgb->lab","tier":"cpu","input_size":50000000,"metric":"throughput_mpx_s","value":31.20,"ms":1602.526,"iters":3,"warmup":1,"host":"vipavani","gpu_present":false,"decision":"kept","baseline_ref":"874b4fe","notes":"wide::f32x8 SIMD fused single-pass (rgb→lab), N=50,000,000"}
{"ts":"2026-07-14T07:11:47.562Z","commit":"874b4fe","issue":71,"route":"rgb->hsl","tier":"cpu","input_size":50000000,"metric":"throughput_mpx_s","value":36.50,"ms":1369.831,"iters":3,"warmup":1,"host":"vipavani","gpu_present":false,"decision":"baseline","notes":"Rust scalar batch baseline (pre-SIMD), N=50,000,000"}
{"ts":"2026-07-14T07:11:49.001Z","commit":"874b4fe","issue":71,"route":"rgb->hsl","tier":"cpu","input_size":50000000,"metric":"throughput_mpx_s","value":139.53,"ms":358.346,"iters":3,"warmup":1,"host":"vipavani","gpu_present":false,"decision":"kept","notes":"wide::f32x8 SIMD batch (mask-blend hue), N=50,000,000"}
{"ts":"2026-07-14T07:11:58.579Z","commit":"874b4fe","issue":71,"route":"rgb->hsl->rgb","tier":"cpu","input_size":50000000,"metric":"throughput_mpx_s","value":20.97,"ms":2384.103,"iters":3,"warmup":1,"host":"vipavani","gpu_present":false,"decision":"baseline","notes":"Rust scalar batch baseline (pre-SIMD roundtrip), N=50,000,000"}
{"ts":"2026-07-14T07:12:01.710Z","commit":"874b4fe","issue":71,"route":"rgb->hsl->rgb","tier":"cpu","input_size":50000000,"metric":"throughput_mpx_s","value":64.09,"ms":780.150,"iters":3,"warmup":1,"host":"vipavani","gpu_present":false,"decision":"kept","baseline_ref":"874b4fe","notes":"wide::f32x8 SIMD batch round-trip (rgb→hsl→rgb), N=50,000,000"}
{"ts":"2026-07-14T07:12:06.938Z","commit":"874b4fe","issue":71,"route":"rgb->hsv","tier":"cpu","input_size":50000000,"metric":"throughput_mpx_s","value":38.86,"ms":1286.794,"iters":3,"warmup":1,"host":"vipavani","gpu_present":false,"decision":"baseline","notes":"Rust scalar batch baseline (pre-SIMD), N=50,000,000"}
{"ts":"2026-07-14T07:12:08.325Z","commit":"874b4fe","issue":71,"route":"rgb->hsv","tier":"cpu","input_size":50000000,"metric":"throughput_mpx_s","value":144.72,"ms":345.493,"iters":3,"warmup":1,"host":"vipavani","gpu_present":false,"decision":"kept","notes":"wide::f32x8 SIMD batch (mask-blend hue), N=50,000,000"}
{"ts":"2026-07-14T07:12:59.979Z","commit":"874b4fe","issue":71,"route":"rgb->hsl","tier":"js","input_size":50000000,"metric":"throughput_mpx_s","value":14.2,"ms":3520.982,"iters":3,"warmup":1,"host":"vipavani","gpu_present":false,"decision":"baseline","notes":"JS color-convert@3.1.3 baseline, N=50,000,000"}
{"ts":"2026-07-14T07:13:32.602Z","commit":"874b4fe","issue":71,"route":"rgb->lab","tier":"js","input_size":50000000,"metric":"throughput_mpx_s","value":6.19,"ms":8081.196,"iters":3,"warmup":1,"host":"vipavani","gpu_present":false,"decision":"baseline","notes":"JS color-convert@3.1.3 baseline, N=50,000,000"}
{"ts":"2026-07-14T07:13:54.894Z","commit":"874b4fe","issue":71,"route":"rgb->xyz","tier":"js","input_size":50000000,"metric":"throughput_mpx_s","value":9.02,"ms":5542.82,"iters":3,"warmup":1,"host":"vipavani","gpu_present":false,"decision":"baseline","notes":"JS color-convert@3.1.3 baseline, N=50,000,000"}
{"ts":"2026-07-14T07:14:11.387Z","commit":"874b4fe","issue":71,"route":"rgb->hsv","tier":"js","input_size":50000000,"metric":"throughput_mpx_s","value":12.3,"ms":4066.132,"iters":3,"warmup":1,"host":"vipavani","gpu_present":false,"decision":"baseline","notes":"JS color-convert@3.1.3 baseline, N=50,000,000"}
{"ts":"2026-07-14T07:14:39.462Z","commit":"874b4fe","issue":71,"route":"rgb->hsl->rgb","tier":"js","input_size":50000000,"metric":"throughput_mpx_s","value":7.12,"ms":7019.59,"iters":3,"warmup":1,"host":"vipavani","gpu_present":false,"decision":"baseline","notes":"JS color-convert@3.1.3 baseline, N=50,000,000"}
{"ts":"2026-07-14T07:41:43.705Z","commit":"0dabf17","issue":79,"route":"rgb->xyz","tier":"cpu","input_size":50000000,"metric":"throughput_mpx_s","value":46.28,"ms":1080.482,"iters":3,"warmup":1,"host":"vipavani","gpu_present":false,"decision":"baseline","notes":"wide::f64x4 SIMD batch, N=50,000,000"}
{"ts":"2026-07-14T07:41:50.832Z","commit":"0dabf17","issue":79,"route":"rgb->lab","tier":"cpu","input_size":50000000,"metric":"throughput_mpx_s","value":28.11,"ms":1778.760,"iters":3,"warmup":1,"host":"vipavani","gpu_present":false,"decision":"baseline","notes":"wide::f32x8 SIMD two-step chain (xyz→lab), #61 baseline, N=50,000,000"}
{"ts":"2026-07-14T07:41:57.096Z","commit":"0dabf17","issue":79,"route":"rgb->lab","tier":"cpu","input_size":50000000,"metric":"throughput_mpx_s","value":31.94,"ms":1565.309,"iters":3,"warmup":1,"host":"vipavani","gpu_present":false,"decision":"kept","baseline_ref":"0dabf17","notes":"wide::f32x8 SIMD fused single-pass (rgb→lab), N=50,000,000"}
{"ts":"2026-07-14T07:42:02.635Z","commit":"0dabf17","issue":79,"route":"rgb->hsl","tier":"cpu","input_size":50000000,"metric":"throughput_mpx_s","value":36.26,"ms":1378.796,"iters":3,"warmup":1,"host":"vipavani","gpu_present":false,"decision":"baseline","notes":"Rust scalar batch baseline (pre-SIMD), N=50,000,000"}
{"ts":"2026-07-14T07:42:04.070Z","commit":"0dabf17","issue":79,"route":"rgb->hsl","tier":"cpu","input_size":50000000,"metric":"throughput_mpx_s","value":140.69,"ms":355.382,"iters":3,"warmup":1,"host":"vipavani","gpu_present":false,"decision":"kept","notes":"wide::f32x8 SIMD batch (mask-blend hue), N=50,000,000"}
{"ts":"2026-07-14T07:42:13.651Z","commit":"0dabf17","issue":79,"route":"rgb->hsl->rgb","tier":"cpu","input_size":50000000,"metric":"throughput_mpx_s","value":20.91,"ms":2391.299,"iters":3,"warmup":1,"host":"vipavani","gpu_present":false,"decision":"baseline","notes":"Rust scalar batch baseline (pre-SIMD roundtrip), N=50,000,000"}
{"ts":"2026-07-14T07:42:16.774Z","commit":"0dabf17","issue":79,"route":"rgb->hsl->rgb","tier":"cpu","input_size":50000000,"metric":"throughput_mpx_s","value":64.20,"ms":778.866,"iters":3,"warmup":1,"host":"vipavani","gpu_present":false,"decision":"kept","baseline_ref":"0dabf17","notes":"wide::f32x8 SIMD batch round-trip (rgb→hsl→rgb), N=50,000,000"}
{"ts":"2026-07-14T07:42:19.981Z","commit":"0dabf17","issue":79,"route":"rgb->cmyk","tier":"cpu","input_size":50000000,"metric":"throughput_mpx_s","value":64.17,"ms":779.234,"iters":3,"warmup":1,"host":"vipavani","gpu_present":false,"decision":"baseline","notes":"Rust scalar batch baseline (pre-SIMD), N=50,000,000"}
{"ts":"2026-07-14T07:42:21.521Z","commit":"0dabf17","issue":79,"route":"rgb->cmyk","tier":"cpu","input_size":50000000,"metric":"throughput_mpx_s","value":130.76,"ms":382.382,"iters":3,"warmup":1,"host":"vipavani","gpu_present":false,"decision":"kept","baseline_ref":"0dabf17","notes":"wide::f32x8 SIMD batch (mask-blend black guard), N=50,000,000"}
{"ts":"2026-07-14T07:42:26.637Z","commit":"0dabf17","issue":79,"route":"rgb->hsv","tier":"cpu","input_size":50000000,"metric":"throughput_mpx_s","value":39.12,"ms":1278.208,"iters":3,"warmup":1,"host":"vipavani","gpu_present":false,"decision":"baseline","notes":"Rust scalar batch baseline (pre-SIMD), N=50,000,000"}
{"ts":"2026-07-14T07:42:28.052Z","commit":"0dabf17","issue":79,"route":"rgb->hsv","tier":"cpu","input_size":50000000,"metric":"throughput_mpx_s","value":143.82,"ms":347.658,"iters":3,"warmup":1,"host":"vipavani","gpu_present":false,"decision":"kept","baseline_ref":"0dabf17","notes":"wide::f32x8 SIMD batch (mask-blend hue), N=50,000,000"}
{"ts":"2026-07-14T07:42:50.092Z","commit":"0dabf17","issue":79,"route":"rgb->oklab","tier":"cpu","input_size":50000000,"metric":"throughput_mpx_s","value":9.08,"ms":5506.700,"iters":3,"warmup":1,"host":"vipavani","gpu_present":false,"decision":"baseline","notes":"Rust scalar batch baseline (pre-SIMD), N=50,000,000"}
{"ts":"2026-07-14T07:42:56.372Z","commit":"0dabf17","issue":79,"route":"rgb->oklab","tier":"cpu","input_size":50000000,"metric":"throughput_mpx_s","value":31.89,"ms":1567.821,"iters":3,"warmup":1,"host":"vipavani","gpu_present":false,"decision":"kept","baseline_ref":"0dabf17","notes":"wide::f32x8 SIMD batch (powf/cbrt + dual matrix), N=50,000,000, speedup=3.51x, tol=1e-3"}
{"ts":"2026-07-14T07:40:07.849Z","commit":"322787b","issue":78,"route":"rgb->xyz","tier":"cpu","input_size":50000000,"metric":"throughput_mpx_s","value":46.29,"ms":1080.106,"iters":3,"warmup":1,"host":"vipavani","gpu_present":false,"decision":"baseline","notes":"wide::f64x4 SIMD batch, N=50,000,000"}
{"ts":"2026-07-14T07:40:14.987Z","commit":"322787b","issue":78,"route":"rgb->lab","tier":"cpu","input_size":50000000,"metric":"throughput_mpx_s","value":28.11,"ms":1779.017,"iters":3,"warmup":1,"host":"vipavani","gpu_present":false,"decision":"baseline","notes":"wide::f32x8 SIMD two-step chain (xyz→lab), #61 baseline, N=50,000,000"}
{"ts":"2026-07-14T07:40:21.248Z","commit":"322787b","issue":78,"route":"rgb->lab","tier":"cpu","input_size":50000000,"metric":"throughput_mpx_s","value":31.96,"ms":1564.371,"iters":3,"warmup":1,"host":"vipavani","gpu_present":false,"decision":"kept","baseline_ref":"322787b","notes":"wide::f32x8 SIMD fused single-pass (rgb→lab), N=50,000,000"}
{"ts":"2026-07-14T07:40:26.779Z","commit":"322787b","issue":78,"route":"rgb->hsl","tier":"cpu","input_size":50000000,"metric":"throughput_mpx_s","value":36.18,"ms":1381.811,"iters":3,"warmup":1,"host":"vipavani","gpu_present":false,"decision":"baseline","notes":"Rust scalar batch baseline (pre-SIMD), N=50,000,000"}
{"ts":"2026-07-14T07:40:28.214Z","commit":"322787b","issue":78,"route":"rgb->hsl","tier":"cpu","input_size":50000000,"metric":"throughput_mpx_s","value":139.62,"ms":358.114,"iters":3,"warmup":1,"host":"vipavani","gpu_present":false,"decision":"kept","notes":"wide::f32x8 SIMD batch (mask-blend hue), N=50,000,000"}
{"ts":"2026-07-14T07:40:37.804Z","commit":"322787b","issue":78,"route":"rgb->hsl->rgb","tier":"cpu","input_size":50000000,"metric":"throughput_mpx_s","value":20.86,"ms":2397.028,"iters":3,"warmup":1,"host":"vipavani","gpu_present":false,"decision":"baseline","notes":"Rust scalar batch baseline (pre-SIMD roundtrip), N=50,000,000"}
{"ts":"2026-07-14T07:40:40.940Z","commit":"322787b","issue":78,"route":"rgb->hsl->rgb","tier":"cpu","input_size":50000000,"metric":"throughput_mpx_s","value":63.93,"ms":782.149,"iters":3,"warmup":1,"host":"vipavani","gpu_present":false,"decision":"kept","baseline_ref":"322787b","notes":"wide::f32x8 SIMD batch round-trip (rgb→hsl→rgb), N=50,000,000"}
{"ts":"2026-07-14T07:40:44.275Z","commit":"322787b","issue":78,"route":"rgb->cmyk","tier":"cpu","input_size":50000000,"metric":"throughput_mpx_s","value":61.62,"ms":811.479,"iters":3,"warmup":1,"host":"vipavani","gpu_present":false,"decision":"baseline","notes":"Rust scalar batch baseline (pre-SIMD), N=50,000,000"}
{"ts":"2026-07-14T07:40:45.893Z","commit":"322787b","issue":78,"route":"rgb->cmyk","tier":"cpu","input_size":50000000,"metric":"throughput_mpx_s","value":130.41,"ms":383.412,"iters":3,"warmup":1,"host":"vipavani","gpu_present":false,"decision":"kept","baseline_ref":"322787b","notes":"wide::f32x8 SIMD batch (mask-blend black guard), N=50,000,000"}
{"ts":"2026-07-14T07:40:51.659Z","commit":"322787b","issue":78,"route":"rgb->hsv","tier":"cpu","input_size":50000000,"metric":"throughput_mpx_s","value":39.12,"ms":1278.174,"iters":3,"warmup":1,"host":"vipavani","gpu_present":false,"decision":"baseline","notes":"Rust scalar batch baseline (pre-SIMD), N=50,000,000"}
{"ts":"2026-07-14T07:40:53.277Z","commit":"322787b","issue":78,"route":"rgb->hsv","tier":"cpu","input_size":50000000,"metric":"throughput_mpx_s","value":133.12,"ms":375.603,"iters":3,"warmup":1,"host":"vipavani","gpu_present":false,"decision":"kept","baseline_ref":"322787b","notes":"wide::f32x8 SIMD batch (mask-blend hue), N=50,000,000"}
{"ts":"2026-07-14T07:40:57.880Z","commit":"322787b","issue":78,"route":"rgb->hwb","tier":"cpu","input_size":50000000,"metric":"throughput_mpx_s","value":43.97,"ms":1137.011,"iters":3,"warmup":1,"host":"vipavani","gpu_present":false,"decision":"baseline","notes":"Rust scalar batch baseline (pre-SIMD), N=50,000,000"}
{"ts":"2026-07-14T07:40:59.271Z","commit":"322787b","issue":78,"route":"rgb->hwb","tier":"cpu","input_size":50000000,"metric":"throughput_mpx_s","value":146.44,"ms":341.427,"iters":3,"warmup":1,"host":"vipavani","gpu_present":false,"decision":"kept","baseline_ref":"322787b","notes":"wide::f32x8 SIMD batch (mask-blend hue, from hsl hue), N=50,000,000"}
{"ts":"2026-07-14T08:15:00.000Z","commit":"4732762","issue":72,"route":"rgb->cmyk","tier":"js","input_size":10000000,"metric":"throughput_mpx_s","value":19.47,"ms":513.591,"iters":3,"warmup":1,"host":"vipavani","gpu_present":false,"decision":"baseline","notes":"JS color-convert@3.1.3 baseline (backfill: route was missing from bench.mjs); Rust f32x8 SIMD 130.1 MP/s beats this 6.7x AND the prev Rust scalar iteration -> #72 keep confirmed against BOTH baselines. N=10M (throughput is N-stable)."}
{"ts":"2026-07-14T08:15:00.000Z","commit":"4732762","issue":78,"route":"rgb->hwb","tier":"js","input_size":10000000,"metric":"throughput_mpx_s","value":17.30,"ms":577.997,"iters":3,"warmup":1,"host":"vipavani","gpu_present":false,"decision":"baseline","notes":"JS color-convert@3.1.3 baseline (backfill: route was missing from bench.mjs); Rust f32x8 SIMD 146.4 MP/s beats this 8.5x AND the prev Rust scalar iteration -> #78 keep confirmed against BOTH baselines. N=10M (throughput is N-stable)."}
{"ts":"2026-07-14T08:15:00.000Z","commit":"4732762","issue":79,"route":"rgb->oklab","tier":"js","input_size":10000000,"metric":"throughput_mpx_s","value":7.78,"ms":1284.671,"iters":3,"warmup":1,"host":"vipavani","gpu_present":false,"decision":"baseline","notes":"JS color-convert@3.1.3 baseline (backfill: route was missing from bench.mjs); Rust f32x8 SIMD 31.9 MP/s beats this 4.1x AND the prev Rust scalar iteration -> #79 keep confirmed against BOTH baselines. N=10M (throughput is N-stable)."}
{"ts":"2026-07-14T08:35:05.426Z","commit":"12dfe29","issue":87,"route":"rgb->hsl","tier":"js","input_size":10000000,"metric":"throughput_mpx_s","value":14.05,"ms":711.843,"iters":3,"warmup":1,"host":"vipavani","gpu_present":false,"decision":"baseline","notes":"JS color-convert@3.1.3 baseline, N=10,000,000"}
{"ts":"2026-07-14T08:35:11.737Z","commit":"12dfe29","issue":87,"route":"rgb->lab","tier":"js","input_size":10000000,"metric":"throughput_mpx_s","value":7.2,"ms":1388.351,"iters":3,"warmup":1,"host":"vipavani","gpu_present":false,"decision":"baseline","notes":"JS color-convert@3.1.3 baseline, N=10,000,000"}
{"ts":"2026-07-14T08:35:15.681Z","commit":"12dfe29","issue":87,"route":"rgb->xyz","tier":"js","input_size":10000000,"metric":"throughput_mpx_s","value":10.99,"ms":909.921,"iters":3,"warmup":1,"host":"vipavani","gpu_present":false,"decision":"baseline","notes":"JS color-convert@3.1.3 baseline, N=10,000,000"}
{"ts":"2026-07-14T08:35:18.096Z","commit":"12dfe29","issue":87,"route":"rgb->hsv","tier":"js","input_size":10000000,"metric":"throughput_mpx_s","value":17.29,"ms":578.529,"iters":3,"warmup":1,"host":"vipavani","gpu_present":false,"decision":"baseline","notes":"JS color-convert@3.1.3 baseline, N=10,000,000"}
{"ts":"2026-07-14T08:35:20.160Z","commit":"12dfe29","issue":87,"route":"rgb->cmyk","tier":"js","input_size":10000000,"metric":"throughput_mpx_s","value":19.93,"ms":501.745,"iters":3,"warmup":1,"host":"vipavani","gpu_present":false,"decision":"baseline","notes":"JS color-convert@3.1.3 baseline, N=10,000,000"}
{"ts":"2026-07-14T08:35:22.997Z","commit":"12dfe29","issue":87,"route":"rgb->hwb","tier":"js","input_size":10000000,"metric":"throughput_mpx_s","value":17.43,"ms":573.644,"iters":3,"warmup":1,"host":"vipavani","gpu_present":false,"decision":"baseline","notes":"JS color-convert@3.1.3 baseline, N=10,000,000"}
{"ts":"2026-07-14T08:35:25.840Z","commit":"12dfe29","issue":87,"route":"rgb->hcg","tier":"js","input_size":10000000,"metric":"throughput_mpx_s","value":14.36,"ms":696.197,"iters":3,"warmup":1,"host":"vipavani","gpu_present":false,"decision":"baseline","notes":"JS color-convert@3.1.3 baseline, N=10,000,000"}
{"ts":"2026-07-14T08:35:30.932Z","commit":"12dfe29","issue":87,"route":"rgb->oklab","tier":"js","input_size":10000000,"metric":"throughput_mpx_s","value":7.9,"ms":1266.241,"iters":3,"warmup":1,"host":"vipavani","gpu_present":false,"decision":"baseline","notes":"JS color-convert@3.1.3 baseline, N=10,000,000"}
{"ts":"2026-07-14T08:35:34.705Z","commit":"12dfe29","issue":87,"route":"rgb->hsl->rgb","tier":"js","input_size":10000000,"metric":"throughput_mpx_s","value":10.71,"ms":933.362,"iters":3,"warmup":1,"host":"vipavani","gpu_present":false,"decision":"baseline","notes":"JS color-convert@3.1.3 baseline, N=10,000,000"}
{"ts":"2026-07-14T08:35:59.252Z","commit":"12dfe29","issue":87,"route":"rgb->xyz","tier":"cpu","input_size":50000000,"metric":"throughput_mpx_s","value":45.63,"ms":1095.772,"iters":3,"warmup":1,"host":"vipavani","gpu_present":false,"decision":"baseline","notes":"wide::f64x4 SIMD batch, N=50,000,000"}
{"ts":"2026-07-14T08:36:06.509Z","commit":"12dfe29","issue":87,"route":"rgb->lab","tier":"cpu","input_size":50000000,"metric":"throughput_mpx_s","value":27.70,"ms":1805.186,"iters":3,"warmup":1,"host":"vipavani","gpu_present":false,"decision":"baseline","notes":"wide::f32x8 SIMD two-step chain (xyz→lab), #61 baseline, N=50,000,000"}
{"ts":"2026-07-14T08:36:12.868Z","commit":"12dfe29","issue":87,"route":"rgb->lab","tier":"cpu","input_size":50000000,"metric":"throughput_mpx_s","value":31.46,"ms":1589.387,"iters":3,"warmup":1,"host":"vipavani","gpu_present":false,"decision":"kept","baseline_ref":"12dfe29","notes":"wide::f32x8 SIMD fused single-pass (rgb→lab), N=50,000,000"}
{"ts":"2026-07-14T08:36:18.496Z","commit":"12dfe29","issue":87,"route":"rgb->hsl","tier":"cpu","input_size":50000000,"metric":"throughput_mpx_s","value":35.60,"ms":1404.535,"iters":3,"warmup":1,"host":"vipavani","gpu_present":false,"decision":"baseline","notes":"Rust scalar batch baseline (pre-SIMD), N=50,000,000"}
{"ts":"2026-07-14T08:36:19.955Z","commit":"12dfe29","issue":87,"route":"rgb->hsl","tier":"cpu","input_size":50000000,"metric":"throughput_mpx_s","value":137.81,"ms":362.812,"iters":3,"warmup":1,"host":"vipavani","gpu_present":false,"decision":"kept","notes":"wide::f32x8 SIMD batch (mask-blend hue), N=50,000,000"}
{"ts":"2026-07-14T08:36:29.642Z","commit":"12dfe29","issue":87,"route":"rgb->hsl->rgb","tier":"cpu","input_size":50000000,"metric":"throughput_mpx_s","value":20.67,"ms":2419.467,"iters":3,"warmup":1,"host":"vipavani","gpu_present":false,"decision":"baseline","notes":"Rust scalar batch baseline (pre-SIMD roundtrip), N=50,000,000"}
{"ts":"2026-07-14T08:36:32.833Z","commit":"12dfe29","issue":87,"route":"rgb->hsl->rgb","tier":"cpu","input_size":50000000,"metric":"throughput_mpx_s","value":62.99,"ms":793.730,"iters":3,"warmup":1,"host":"vipavani","gpu_present":false,"decision":"kept","baseline_ref":"12dfe29","notes":"wide::f32x8 SIMD batch round-trip (rgb→hsl→rgb), N=50,000,000"}
{"ts":"2026-07-14T08:36:36.153Z","commit":"12dfe29","issue":87,"route":"rgb->cmyk","tier":"cpu","input_size":50000000,"metric":"throughput_mpx_s","value":62.11,"ms":805.027,"iters":3,"warmup":1,"host":"vipavani","gpu_present":false,"decision":"baseline","notes":"Rust scalar batch baseline (pre-SIMD), N=50,000,000"}
{"ts":"2026-07-14T08:36:37.783Z","commit":"12dfe29","issue":87,"route":"rgb->cmyk","tier":"cpu","input_size":50000000,"metric":"throughput_mpx_s","value":124.22,"ms":402.510,"iters":3,"warmup":1,"host":"vipavani","gpu_present":false,"decision":"kept","baseline_ref":"12dfe29","notes":"wide::f32x8 SIMD batch (mask-blend black guard), N=50,000,000"}
{"ts":"2026-07-14T08:36:42.997Z","commit":"12dfe29","issue":87,"route":"rgb->hsv","tier":"cpu","input_size":50000000,"metric":"throughput_mpx_s","value":38.65,"ms":1293.752,"iters":3,"warmup":1,"host":"vipavani","gpu_present":false,"decision":"baseline","notes":"Rust scalar batch baseline (pre-SIMD), N=50,000,000"}
{"ts":"2026-07-14T08:36:44.416Z","commit":"12dfe29","issue":87,"route":"rgb->hsv","tier":"cpu","input_size":50000000,"metric":"throughput_mpx_s","value":141.79,"ms":352.628,"iters":3,"warmup":1,"host":"vipavani","gpu_present":false,"decision":"kept","baseline_ref":"12dfe29","notes":"wide::f32x8 SIMD batch (mask-blend hue), N=50,000,000"}
{"ts":"2026-07-14T08:37:06.672Z","commit":"12dfe29","issue":87,"route":"rgb->oklab","tier":"cpu","input_size":50000000,"metric":"throughput_mpx_s","value":9.01,"ms":5550.445,"iters":3,"warmup":1,"host":"vipavani","gpu_present":false,"decision":"baseline","notes":"Rust scalar batch baseline (pre-SIMD), N=50,000,000"}
