{"ts":"2026-07-13T21:40:06.622Z","commit":"93db54c","issue":18,"route":"rgb->hsl","tier":"js","input_size":100000,"metric":"throughput_mpx_s","value":18.77,"ms":5.327,"iters":20,"warmup":3,"host":"vipavani","gpu_present":false,"decision":"baseline","notes":"JS color-convert@3.1.3 baseline, N=100,000"}
{"ts":"2026-07-13T21:40:06.970Z","commit":"93db54c","issue":18,"route":"rgb->lab","tier":"js","input_size":100000,"metric":"throughput_mpx_s","value":7.24,"ms":13.808,"iters":20,"warmup":3,"host":"vipavani","gpu_present":false,"decision":"baseline","notes":"JS color-convert@3.1.3 baseline, N=100,000"}
{"ts":"2026-07-13T21:40:07.203Z","commit":"93db54c","issue":18,"route":"rgb->hsl->rgb","tier":"js","input_size":100000,"metric":"throughput_mpx_s","value":10.99,"ms":9.097,"iters":20,"warmup":3,"host":"vipavani","gpu_present":false,"decision":"baseline","notes":"JS color-convert@3.1.3 baseline, N=100,000"}
{"ts":"2026-07-13T22:36:47.838Z","commit":"aaa33b6","issue":19,"route":"rgb->hsl","tier":"cpu","input_size":100000,"metric":"throughput_mpx_s","value":19.46,"ms":5.140,"iters":20,"warmup":3,"host":"vipavani","gpu_present":false,"decision":"baseline","notes":"Rust CPU (std::time best-of-N) baseline, N=100,000"}
{"ts":"2026-07-13T22:36:48.145Z","commit":"aaa33b6","issue":19,"route":"rgb->lab","tier":"cpu","input_size":100000,"metric":"throughput_mpx_s","value":8.33,"ms":12.009,"iters":20,"warmup":3,"host":"vipavani","gpu_present":false,"decision":"baseline","notes":"Rust CPU (std::time best-of-N) baseline, N=100,000"}
{"ts":"2026-07-13T22:36:48.410Z","commit":"aaa33b6","issue":19,"route":"rgb->hsl->rgb","tier":"cpu","input_size":100000,"metric":"throughput_mpx_s","value":8.92,"ms":11.215,"iters":20,"warmup":3,"host":"vipavani","gpu_present":false,"decision":"baseline","notes":"Rust CPU (std::time best-of-N) baseline, N=100,000"}
{"ts":"2026-07-13T22:40:32.147Z","commit":"34ff0db","issue":20,"route":"rgb->xyz","tier":"cpu","input_size":100000,"metric":"throughput_mpx_s","value":22.24,"ms":4.496,"iters":20,"warmup":3,"host":"vipavani","gpu_present":false,"decision":"baseline","notes":"scalar rgb::xyz per-pixel baseline"}
{"ts":"2026-07-13T22:40:32.147Z","commit":"34ff0db","issue":20,"route":"rgb->xyz","tier":"cpu","input_size":100000,"metric":"throughput_mpx_s","value":24.65,"ms":4.057,"iters":20,"warmup":3,"host":"vipavani","gpu_present":false,"baseline_ref":"scalar 34ff0db","decision":"kept","notes":"wide::f64x4 SIMD batch, 1.1x vs scalar"}
{"ts":"2026-07-13T23:24:54.226Z","commit":"cab50ea","issue":48,"route":"rgb->lab","tier":"gpu","input_size":100000,"metric":"throughput_mpx_s","value":14.01,"ms":7.138,"iters":20,"warmup":3,"host":"vipavani","gpu_present":true,"decision":"kept","notes":"CubeCL/wgpu GPU kernel rgb->lab batch on NVIDIA RTX 2000 Ada; beats CPU-SIMD and JS baseline, N=100,000"}
{"ts":"2026-07-13T23:42:50.437Z","commit":"1a4e607","issue":23,"route":"rgb->lab","tier":"gpu","input_size":100000,"metric":"throughput_mpx_s","value":13.95,"ms":7.170,"iters":20,"warmup":3,"host":"vipavani","gpu_present":true,"decision":"baseline","notes":"CubeCL/wgpu GPU kernel rgb->lab batch on NVIDIA RTX 2000 Ada; N=100,000; upload=0.16ms compute=0.00ms readback=0.58ms"}
{"ts":"2026-07-13T23:43:41.937Z","commit":"1a4e607","issue":18,"route":"rgb->hsl","tier":"js","input_size":100000,"metric":"throughput_mpx_s","value":17.98,"ms":5.563,"iters":20,"warmup":3,"host":"vipavani","gpu_present":false,"decision":"baseline","notes":"JS color-convert@3.1.3 baseline, N=100,000"}
{"ts":"2026-07-13T23:43:42.322Z","commit":"1a4e607","issue":18,"route":"rgb->lab","tier":"js","input_size":100000,"metric":"throughput_mpx_s","value":7.3,"ms":13.696,"iters":20,"warmup":3,"host":"vipavani","gpu_present":false,"decision":"baseline","notes":"JS color-convert@3.1.3 baseline, N=100,000"}
{"ts":"2026-07-13T23:43:42.551Z","commit":"1a4e607","issue":18,"route":"rgb->xyz","tier":"js","input_size":100000,"metric":"throughput_mpx_s","value":11.12,"ms":8.994,"iters":20,"warmup":3,"host":"vipavani","gpu_present":false,"decision":"baseline","notes":"JS color-convert@3.1.3 baseline, N=100,000"}
{"ts":"2026-07-13T23:43:42.776Z","commit":"1a4e607","issue":18,"route":"rgb->hsl->rgb","tier":"js","input_size":100000,"metric":"throughput_mpx_s","value":10.99,"ms":9.1,"iters":20,"warmup":3,"host":"vipavani","gpu_present":false,"decision":"baseline","notes":"JS color-convert@3.1.3 baseline, N=100,000"}
{"ts":"2026-07-13T23:43:46.424Z","commit":"1a4e607","issue":19,"route":"rgb->hsl","tier":"cpu","input_size":100000,"metric":"throughput_mpx_s","value":922.99,"ms":0.108,"iters":20,"warmup":3,"host":"vipavani","gpu_present":false,"decision":"baseline","notes":"Rust CPU (std::time best-of-N) baseline, N=100,000"}
{"ts":"2026-07-13T23:43:46.431Z","commit":"1a4e607","issue":19,"route":"rgb->lab","tier":"cpu","input_size":100000,"metric":"throughput_mpx_s","value":923.03,"ms":0.108,"iters":20,"warmup":3,"host":"vipavani","gpu_present":false,"decision":"baseline","notes":"Rust CPU (std::time best-of-N) baseline, N=100,000"}
{"ts":"2026-07-13T23:43:46.438Z","commit":"1a4e607","issue":19,"route":"rgb->hsl->rgb","tier":"cpu","input_size":100000,"metric":"throughput_mpx_s","value":621.20,"ms":0.161,"iters":20,"warmup":3,"host":"vipavani","gpu_present":false,"decision":"baseline","notes":"Rust CPU (std::time best-of-N) baseline, N=100,000"}
{"ts":"2026-07-13T23:43:47.597Z","commit":"1a4e607","issue":23,"route":"rgb->xyz","tier":"cpu","input_size":100000,"metric":"throughput_mpx_s","value":24.68,"ms":4.052,"iters":20,"warmup":3,"host":"vipavani","gpu_present":false,"decision":"baseline","notes":"wide::f64x4 SIMD batch, N=100,000"}
{"ts":"2026-07-13T23:43:47.803Z","commit":"1a4e607","issue":23,"route":"rgb->lab","tier":"cpu","input_size":100000,"metric":"throughput_mpx_s","value":11.54,"ms":8.665,"iters":20,"warmup":3,"host":"vipavani","gpu_present":false,"decision":"baseline","notes":"wide::f64x4 SIMD batch (xyz→lab chain), N=100,000"}
{"ts":"2026-07-13T23:44:11.897Z","commit":"1a4e607","issue":18,"route":"rgb->hsl","tier":"js","input_size":1000000,"metric":"throughput_mpx_s","value":18.2,"ms":54.944,"iters":10,"warmup":3,"host":"vipavani","gpu_present":false,"decision":"baseline","notes":"JS color-convert@3.1.3 baseline, N=1,000,000"}
{"ts":"2026-07-13T23:44:12.402Z","commit":"1a4e607","issue":19,"route":"rgb->hsl","tier":"cpu","input_size":1000000,"metric":"throughput_mpx_s","value":943.77,"ms":1.060,"iters":10,"warmup":3,"host":"vipavani","gpu_present":false,"decision":"baseline","notes":"Rust CPU (std::time best-of-N) baseline, N=1,000,000"}
{"ts":"2026-07-13T23:44:12.423Z","commit":"1a4e607","issue":19,"route":"rgb->lab","tier":"cpu","input_size":1000000,"metric":"throughput_mpx_s","value":945.85,"ms":1.057,"iters":10,"warmup":3,"host":"vipavani","gpu_present":false,"decision":"baseline","notes":"Rust CPU (std::time best-of-N) baseline, N=1,000,000"}
{"ts":"2026-07-13T23:44:12.443Z","commit":"1a4e607","issue":19,"route":"rgb->hsl->rgb","tier":"cpu","input_size":1000000,"metric":"throughput_mpx_s","value":946.36,"ms":1.057,"iters":10,"warmup":3,"host":"vipavani","gpu_present":false,"decision":"baseline","notes":"Rust CPU (std::time best-of-N) baseline, N=1,000,000"}
{"ts":"2026-07-13T23:44:13.755Z","commit":"1a4e607","issue":18,"route":"rgb->lab","tier":"js","input_size":1000000,"metric":"throughput_mpx_s","value":7.14,"ms":140.152,"iters":10,"warmup":3,"host":"vipavani","gpu_present":false,"decision":"baseline","notes":"JS color-convert@3.1.3 baseline, N=1,000,000"}
{"ts":"2026-07-13T23:44:14.063Z","commit":"1a4e607","issue":23,"route":"rgb->xyz","tier":"cpu","input_size":1000000,"metric":"throughput_mpx_s","value":24.47,"ms":40.872,"iters":10,"warmup":3,"host":"vipavani","gpu_present":false,"decision":"baseline","notes":"wide::f64x4 SIMD batch, N=1,000,000"}
{"ts":"2026-07-13T23:44:15.012Z","commit":"1a4e607","issue":18,"route":"rgb->xyz","tier":"js","input_size":1000000,"metric":"throughput_mpx_s","value":10.79,"ms":92.669,"iters":10,"warmup":3,"host":"vipavani","gpu_present":false,"decision":"baseline","notes":"JS color-convert@3.1.3 baseline, N=1,000,000"}
{"ts":"2026-07-13T23:44:15.296Z","commit":"1a4e607","issue":23,"route":"rgb->lab","tier":"cpu","input_size":1000000,"metric":"throughput_mpx_s","value":10.78,"ms":92.748,"iters":10,"warmup":3,"host":"vipavani","gpu_present":false,"decision":"baseline","notes":"wide::f64x4 SIMD batch (xyz→lab chain), N=1,000,000"}
{"ts":"2026-07-13T23:44:16.241Z","commit":"1a4e607","issue":18,"route":"rgb->hsl->rgb","tier":"js","input_size":1000000,"metric":"throughput_mpx_s","value":10.76,"ms":92.901,"iters":10,"warmup":3,"host":"vipavani","gpu_present":false,"decision":"baseline","notes":"JS color-convert@3.1.3 baseline, N=1,000,000"}
{"ts":"2026-07-13T23:44:33.109Z","commit":"1a4e607","issue":23,"route":"rgb->lab","tier":"gpu","input_size":1000000,"metric":"throughput_mpx_s","value":26.93,"ms":37.131,"iters":10,"warmup":3,"host":"vipavani","gpu_present":true,"decision":"baseline","notes":"CubeCL/wgpu GPU kernel rgb->lab batch on NVIDIA RTX 2000 Ada; N=1,000,000; upload=13.86ms compute=0.01ms readback=6.59ms"}
{"ts":"2026-07-13T23:44:53.145Z","commit":"1a4e607","issue":18,"route":"rgb->hsl","tier":"js","input_size":10000000,"metric":"throughput_mpx_s","value":18.25,"ms":547.808,"iters":5,"warmup":2,"host":"vipavani","gpu_present":false,"decision":"baseline","notes":"JS color-convert@3.1.3 baseline, N=10,000,000"}
{"ts":"2026-07-13T23:44:53.671Z","commit":"1a4e607","issue":23,"route":"rgb->xyz","tier":"cpu","input_size":10000000,"metric":"throughput_mpx_s","value":19.61,"ms":509.910,"iters":5,"warmup":2,"host":"vipavani","gpu_present":false,"decision":"baseline","notes":"wide::f64x4 SIMD batch, N=10,000,000"}
{"ts":"2026-07-13T23:45:00.493Z","commit":"1a4e607","issue":23,"route":"rgb->lab","tier":"cpu","input_size":10000000,"metric":"throughput_mpx_s","value":10.49,"ms":953.185,"iters":5,"warmup":2,"host":"vipavani","gpu_present":false,"decision":"baseline","notes":"wide::f64x4 SIMD batch (xyz→lab chain), N=10,000,000"}
{"ts":"2026-07-13T23:45:03.162Z","commit":"1a4e607","issue":18,"route":"rgb->lab","tier":"js","input_size":10000000,"metric":"throughput_mpx_s","value":7.02,"ms":1424.893,"iters":5,"warmup":2,"host":"vipavani","gpu_present":false,"decision":"baseline","notes":"JS color-convert@3.1.3 baseline, N=10,000,000"}
{"ts":"2026-07-13T23:45:09.713Z","commit":"1a4e607","issue":18,"route":"rgb->xyz","tier":"js","input_size":10000000,"metric":"throughput_mpx_s","value":10.73,"ms":932.245,"iters":5,"warmup":2,"host":"vipavani","gpu_present":false,"decision":"baseline","notes":"JS color-convert@3.1.3 baseline, N=10,000,000"}
{"ts":"2026-07-13T23:45:16.428Z","commit":"1a4e607","issue":18,"route":"rgb->hsl->rgb","tier":"js","input_size":10000000,"metric":"throughput_mpx_s","value":10.5,"ms":952.385,"iters":5,"warmup":2,"host":"vipavani","gpu_present":false,"decision":"baseline","notes":"JS color-convert@3.1.3 baseline, N=10,000,000"}
{"ts":"2026-07-13T23:47:32.157Z","commit":"1a4e607","issue":23,"route":"rgb->lab","tier":"gpu","input_size":10000000,"metric":"throughput_mpx_s","value":32.79,"ms":304.972,"iters":5,"warmup":2,"host":"vipavani","gpu_present":true,"decision":"baseline","notes":"CubeCL/wgpu GPU kernel rgb->lab batch on NVIDIA RTX 2000 Ada; N=10,000,000; upload=156.28ms compute=0.01ms readback=42.11ms"}
{"ts":"2026-07-13T23:48:02.530Z","commit":"1a4e607","issue":18,"route":"rgb->hsl","tier":"js","input_size":50000000,"metric":"throughput_mpx_s","value":14.28,"ms":3502.058,"iters":3,"warmup":1,"host":"vipavani","gpu_present":false,"decision":"baseline","notes":"JS color-convert@3.1.3 baseline, N=50,000,000"}
{"ts":"2026-07-13T23:48:13.358Z","commit":"1a4e607","issue":23,"route":"rgb->xyz","tier":"cpu","input_size":50000000,"metric":"throughput_mpx_s","value":20.37,"ms":2454.736,"iters":3,"warmup":1,"host":"vipavani","gpu_present":false,"decision":"baseline","notes":"wide::f64x4 SIMD batch, N=50,000,000"}
{"ts":"2026-07-13T23:48:31.823Z","commit":"1a4e607","issue":23,"route":"rgb->lab","tier":"cpu","input_size":50000000,"metric":"throughput_mpx_s","value":10.85,"ms":4608.637,"iters":3,"warmup":1,"host":"vipavani","gpu_present":false,"decision":"baseline","notes":"wide::f64x4 SIMD batch (xyz→lab chain), N=50,000,000"}
{"ts":"2026-07-13T23:48:35.705Z","commit":"1a4e607","issue":18,"route":"rgb->lab","tier":"js","input_size":50000000,"metric":"throughput_mpx_s","value":6.12,"ms":8175.099,"iters":3,"warmup":1,"host":"vipavani","gpu_present":false,"decision":"baseline","notes":"JS color-convert@3.1.3 baseline, N=50,000,000"}
{"ts":"2026-07-13T23:48:58.847Z","commit":"1a4e607","issue":18,"route":"rgb->xyz","tier":"js","input_size":50000000,"metric":"throughput_mpx_s","value":8.72,"ms":5731.138,"iters":3,"warmup":1,"host":"vipavani","gpu_present":false,"decision":"baseline","notes":"JS color-convert@3.1.3 baseline, N=50,000,000"}
{"ts":"2026-07-13T23:49:27.333Z","commit":"1a4e607","issue":18,"route":"rgb->hsl->rgb","tier":"js","input_size":50000000,"metric":"throughput_mpx_s","value":7.08,"ms":7060.453,"iters":3,"warmup":1,"host":"vipavani","gpu_present":false,"decision":"baseline","notes":"JS color-convert@3.1.3 baseline, N=50,000,000"}
{"ts":"2026-07-13T23:49:38.693Z","commit":"1a4e607","issue":23,"route":"rgb->lab","tier":"gpu","input_size":50000000,"metric":"throughput_mpx_s","value":34.85,"ms":1434.882,"iters":3,"warmup":1,"host":"vipavani","gpu_present":true,"decision":"baseline","notes":"CubeCL/wgpu GPU kernel rgb->lab batch on NVIDIA RTX 2000 Ada; N=50,000,000; upload=707.24ms compute=0.01ms readback=204.78ms"}
{"ts":"2026-07-13T23:50:10.391Z","commit":"1a4e607","issue":23,"route":"rgb->xyz","tier":"cpu","input_size":100000000,"metric":"throughput_mpx_s","value":20.34,"ms":4916.402,"iters":2,"warmup":1,"host":"vipavani","gpu_present":false,"decision":"baseline","notes":"wide::f64x4 SIMD batch, N=100,000,000"}
{"ts":"2026-07-13T23:50:38.606Z","commit":"1a4e607","issue":23,"route":"rgb->lab","tier":"cpu","input_size":100000000,"metric":"throughput_mpx_s","value":10.66,"ms":9381.749,"iters":2,"warmup":1,"host":"vipavani","gpu_present":false,"decision":"baseline","notes":"wide::f64x4 SIMD batch (xyz→lab chain), N=100,000,000"}
{"ts":"2026-07-14T00:00:10.098Z","commit":"1a4e607","issue":23,"route":"rgb->lab","tier":"gpu","input_size":100000000,"metric":"throughput_mpx_s","value":33.49,"ms":2986.315,"iters":2,"warmup":1,"host":"vipavani","gpu_present":true,"decision":"baseline","notes":"CubeCL/wgpu GPU kernel rgb->lab batch on NVIDIA RTX 2000 Ada; N=100,000,000; upload=1395.98ms compute=0.01ms readback=563.31ms"}
{"ts":"2026-07-14T00:04:03.173Z","commit":"0aa8737","issue":23,"route":"rgb->xyz","tier":"cpu","input_size":50000000,"metric":"throughput_mpx_s","value":20.06,"ms":2493.125,"iters":3,"warmup":1,"host":"vipavani","gpu_present":false,"decision":"baseline","notes":"wide::f64x4 SIMD batch, N=50,000,000"}
{"ts":"2026-07-14T00:04:21.947Z","commit":"0aa8737","issue":23,"route":"rgb->lab","tier":"cpu","input_size":50000000,"metric":"throughput_mpx_s","value":10.68,"ms":4680.379,"iters":3,"warmup":1,"host":"vipavani","gpu_present":false,"decision":"baseline","notes":"wide::f64x4 SIMD batch (xyz→lab chain), N=50,000,000"}
{"ts":"2026-07-14T00:09:28.873Z","commit":"c1d6d44","issue":23,"route":"rgb->xyz","tier":"cpu","input_size":50000000,"metric":"throughput_mpx_s","value":37.20,"ms":1344.006,"iters":3,"warmup":1,"host":"vipavani","gpu_present":false,"decision":"baseline","notes":"wide::f64x4 SIMD batch, N=50,000,000"}
{"ts":"2026-07-14T00:09:37.988Z","commit":"c1d6d44","issue":23,"route":"rgb->lab","tier":"cpu","input_size":50000000,"metric":"throughput_mpx_s","value":21.98,"ms":2274.401,"iters":3,"warmup":1,"host":"vipavani","gpu_present":false,"decision":"baseline","notes":"wide::f64x4 SIMD batch (xyz→lab chain), N=50,000,000"}
{"ts":"2026-07-14T00:09:54.684Z","commit":"c1d6d44","issue":23,"route":"rgb->xyz","tier":"cpu","input_size":100000000,"metric":"throughput_mpx_s","value":37.36,"ms":2676.713,"iters":2,"warmup":1,"host":"vipavani","gpu_present":false,"decision":"baseline","notes":"wide::f64x4 SIMD batch, N=100,000,000"}
{"ts":"2026-07-14T00:10:08.280Z","commit":"c1d6d44","issue":23,"route":"rgb->lab","tier":"cpu","input_size":100000000,"metric":"throughput_mpx_s","value":22.06,"ms":4532.595,"iters":2,"warmup":1,"host":"vipavani","gpu_present":false,"decision":"baseline","notes":"wide::f64x4 SIMD batch (xyz→lab chain), N=100,000,000"}
{"ts":"2026-07-14T00:14:52.814Z","commit":"5d4b85c","issue":23,"route":"rgb->hsl","tier":"js","input_size":100000,"metric":"throughput_mpx_s","value":18.74,"ms":5.335,"iters":20,"warmup":3,"host":"vipavani","gpu_present":false,"decision":"baseline","notes":"JS color-convert@3.1.3 baseline, N=100,000"}
{"ts":"2026-07-14T00:14:53.162Z","commit":"5d4b85c","issue":23,"route":"rgb->lab","tier":"js","input_size":100000,"metric":"throughput_mpx_s","value":7.19,"ms":13.916,"iters":20,"warmup":3,"host":"vipavani","gpu_present":false,"decision":"baseline","notes":"JS color-convert@3.1.3 baseline, N=100,000"}
{"ts":"2026-07-14T00:14:53.388Z","commit":"5d4b85c","issue":23,"route":"rgb->xyz","tier":"js","input_size":100000,"metric":"throughput_mpx_s","value":11.22,"ms":8.909,"iters":20,"warmup":3,"host":"vipavani","gpu_present":false,"decision":"baseline","notes":"JS color-convert@3.1.3 baseline, N=100,000"}
{"ts":"2026-07-14T00:14:53.614Z","commit":"5d4b85c","issue":23,"route":"rgb->hsl->rgb","tier":"js","input_size":100000,"metric":"throughput_mpx_s","value":10.92,"ms":9.155,"iters":20,"warmup":3,"host":"vipavani","gpu_present":false,"decision":"baseline","notes":"JS color-convert@3.1.3 baseline, N=100,000"}
{"ts":"2026-07-14T00:14:54.330Z","commit":"5d4b85c","issue":23,"route":"rgb->hsl","tier":"js","input_size":1000000,"metric":"throughput_mpx_s","value":18.36,"ms":54.461,"iters":10,"warmup":3,"host":"vipavani","gpu_present":false,"decision":"baseline","notes":"JS color-convert@3.1.3 baseline, N=1,000,000"}
{"ts":"2026-07-14T00:14:56.172Z","commit":"5d4b85c","issue":23,"route":"rgb->lab","tier":"js","input_size":1000000,"metric":"throughput_mpx_s","value":7.18,"ms":139.25,"iters":10,"warmup":3,"host":"vipavani","gpu_present":false,"decision":"baseline","notes":"JS color-convert@3.1.3 baseline, N=1,000,000"}
{"ts":"2026-07-14T00:14:57.394Z","commit":"5d4b85c","issue":23,"route":"rgb->xyz","tier":"js","input_size":1000000,"metric":"throughput_mpx_s","value":10.94,"ms":91.372,"iters":10,"warmup":3,"host":"vipavani","gpu_present":false,"decision":"baseline","notes":"JS color-convert@3.1.3 baseline, N=1,000,000"}
{"ts":"2026-07-14T00:14:58.618Z","commit":"5d4b85c","issue":23,"route":"rgb->hsl->rgb","tier":"js","input_size":1000000,"metric":"throughput_mpx_s","value":10.91,"ms":91.621,"iters":10,"warmup":3,"host":"vipavani","gpu_present":false,"decision":"baseline","notes":"JS color-convert@3.1.3 baseline, N=1,000,000"}
{"ts":"2026-07-14T00:14:58.859Z","commit":"5d4b85c","issue":23,"route":"rgb->hsl","tier":"js","input_size":10000000,"metric":"throughput_mpx_s","value":18.46,"ms":541.573,"iters":5,"warmup":2,"host":"vipavani","gpu_present":false,"decision":"baseline","notes":"JS color-convert@3.1.3 baseline, N=10,000,000"}
{"ts":"2026-07-14T00:15:08.819Z","commit":"5d4b85c","issue":23,"route":"rgb->lab","tier":"js","input_size":10000000,"metric":"throughput_mpx_s","value":7.07,"ms":1414.015,"iters":5,"warmup":2,"host":"vipavani","gpu_present":false,"decision":"baseline","notes":"JS color-convert@3.1.3 baseline, N=10,000,000"}
{"ts":"2026-07-14T00:15:15.308Z","commit":"5d4b85c","issue":23,"route":"rgb->xyz","tier":"js","input_size":10000000,"metric":"throughput_mpx_s","value":10.83,"ms":923.311,"iters":5,"warmup":2,"host":"vipavani","gpu_present":false,"decision":"baseline","notes":"JS color-convert@3.1.3 baseline, N=10,000,000"}
{"ts":"2026-07-14T00:15:21.941Z","commit":"5d4b85c","issue":23,"route":"rgb->hsl->rgb","tier":"js","input_size":10000000,"metric":"throughput_mpx_s","value":10.61,"ms":942.534,"iters":5,"warmup":2,"host":"vipavani","gpu_present":false,"decision":"baseline","notes":"JS color-convert@3.1.3 baseline, N=10,000,000"}
{"ts":"2026-07-14T00:15:48.487Z","commit":"5d4b85c","issue":23,"route":"rgb->hsl","tier":"js","input_size":50000000,"metric":"throughput_mpx_s","value":14.14,"ms":3535.736,"iters":3,"warmup":1,"host":"vipavani","gpu_present":false,"decision":"baseline","notes":"JS color-convert@3.1.3 baseline, N=50,000,000"}
{"ts":"2026-07-14T00:16:21.453Z","commit":"5d4b85c","issue":23,"route":"rgb->lab","tier":"js","input_size":50000000,"metric":"throughput_mpx_s","value":6.1,"ms":8196.885,"iters":3,"warmup":1,"host":"vipavani","gpu_present":false,"decision":"baseline","notes":"JS color-convert@3.1.3 baseline, N=50,000,000"}
{"ts":"2026-07-14T00:16:44.392Z","commit":"5d4b85c","issue":23,"route":"rgb->xyz","tier":"js","input_size":50000000,"metric":"throughput_mpx_s","value":8.77,"ms":5703.812,"iters":3,"warmup":1,"host":"vipavani","gpu_present":false,"decision":"baseline","notes":"JS color-convert@3.1.3 baseline, N=50,000,000"}
{"ts":"2026-07-14T00:17:12.783Z","commit":"5d4b85c","issue":23,"route":"rgb->hsl->rgb","tier":"js","input_size":50000000,"metric":"throughput_mpx_s","value":7.09,"ms":7053.16,"iters":3,"warmup":1,"host":"vipavani","gpu_present":false,"decision":"baseline","notes":"JS color-convert@3.1.3 baseline, N=50,000,000"}
{"ts":"2026-07-14T00:17:47.000Z","commit":"5d4b85c","issue":23,"route":"rgb->hsl","tier":"js","input_size":100000000,"metric":"throughput_mpx_s","value":0,"ms":0,"iters":0,"warmup":1,"host":"vipavani","gpu_present":false,"decision":"oom","notes":"OOM/GC wall crash at N=100,000,000. Node.js v24 heap exhausted during benchmark warmup. No data recorded."}
