{"ts":"2026-07-14T08:37:13.027Z","commit":"12dfe29","issue":87,"route":"rgb->oklab","tier":"cpu","input_size":50000000,"metric":"throughput_mpx_s","value":31.49,"ms":1587.807,"iters":3,"warmup":1,"host":"vipavani","gpu_present":false,"decision":"kept","baseline_ref":"12dfe29","notes":"wide::f32x8 SIMD batch (powf/cbrt + dual matrix), N=50,000,000, speedup=3.50x, tol=1e-3"}
{"ts":"2026-07-14T08:37:17.511Z","commit":"12dfe29","issue":87,"route":"rgb->hwb","tier":"cpu","input_size":50000000,"metric":"throughput_mpx_s","value":44.83,"ms":1115.277,"iters":3,"warmup":1,"host":"vipavani","gpu_present":false,"decision":"baseline","notes":"Rust scalar batch baseline (pre-SIMD), N=50,000,000"}
{"ts":"2026-07-14T08:37:18.900Z","commit":"12dfe29","issue":87,"route":"rgb->hwb","tier":"cpu","input_size":50000000,"metric":"throughput_mpx_s","value":144.88,"ms":345.104,"iters":3,"warmup":1,"host":"vipavani","gpu_present":false,"decision":"kept","baseline_ref":"12dfe29","notes":"wide::f32x8 SIMD batch (mask-blend hue, from hsl hue), N=50,000,000"}
{"ts":"2026-07-14T08:37:24.113Z","commit":"12dfe29","issue":87,"route":"rgb->hcg","tier":"cpu","input_size":50000000,"metric":"throughput_mpx_s","value":38.46,"ms":1300.134,"iters":3,"warmup":1,"host":"vipavani","gpu_present":false,"decision":"baseline","notes":"Rust scalar batch baseline (pre-SIMD), N=50,000,000"}
{"ts":"2026-07-14T08:37:25.704Z","commit":"12dfe29","issue":87,"route":"rgb->hcg","tier":"cpu","input_size":50000000,"metric":"throughput_mpx_s","value":126.51,"ms":395.236,"iters":3,"warmup":1,"host":"vipavani","gpu_present":false,"decision":"kept","baseline_ref":"12dfe29","notes":"wide::f32x8 SIMD batch (mask-blend hue + chroma-guard grayscale), N=50,000,000, speedup=3.29x, tol=1e-3"}
{"ts":"2026-07-14T08:33:58.754Z","commit":"30ad9a9","issue":86,"route":"rgb->hsl","tier":"js","input_size":10000000,"metric":"throughput_mpx_s","value":18.48,"ms":541.224,"iters":3,"warmup":1,"host":"vipavani","gpu_present":false,"decision":"baseline","notes":"JS color-convert@3.1.3 baseline, N=10,000,000"}
{"ts":"2026-07-14T08:34:04.353Z","commit":"30ad9a9","issue":86,"route":"rgb->lab","tier":"js","input_size":10000000,"metric":"throughput_mpx_s","value":7.18,"ms":1392.919,"iters":3,"warmup":1,"host":"vipavani","gpu_present":false,"decision":"baseline","notes":"JS color-convert@3.1.3 baseline, N=10,000,000"}
{"ts":"2026-07-14T08:34:08.039Z","commit":"30ad9a9","issue":86,"route":"rgb->xyz","tier":"js","input_size":10000000,"metric":"throughput_mpx_s","value":11.03,"ms":906.224,"iters":3,"warmup":1,"host":"vipavani","gpu_present":false,"decision":"baseline","notes":"JS color-convert@3.1.3 baseline, N=10,000,000"}
{"ts":"2026-07-14T08:34:10.402Z","commit":"30ad9a9","issue":86,"route":"rgb->hsv","tier":"js","input_size":10000000,"metric":"throughput_mpx_s","value":17.28,"ms":578.663,"iters":3,"warmup":1,"host":"vipavani","gpu_present":false,"decision":"baseline","notes":"JS color-convert@3.1.3 baseline, N=10,000,000"}
{"ts":"2026-07-14T08:34:12.408Z","commit":"30ad9a9","issue":86,"route":"rgb->cmyk","tier":"js","input_size":10000000,"metric":"throughput_mpx_s","value":20.29,"ms":492.858,"iters":3,"warmup":1,"host":"vipavani","gpu_present":false,"decision":"baseline","notes":"JS color-convert@3.1.3 baseline, N=10,000,000"}
{"ts":"2026-07-14T08:34:14.715Z","commit":"30ad9a9","issue":86,"route":"rgb->hwb","tier":"js","input_size":10000000,"metric":"throughput_mpx_s","value":17.61,"ms":567.965,"iters":3,"warmup":1,"host":"vipavani","gpu_present":false,"decision":"baseline","notes":"JS color-convert@3.1.3 baseline, N=10,000,000"}
{"ts":"2026-07-14T08:34:19.725Z","commit":"30ad9a9","issue":86,"route":"rgb->oklab","tier":"js","input_size":10000000,"metric":"throughput_mpx_s","value":8.02,"ms":1247.612,"iters":3,"warmup":1,"host":"vipavani","gpu_present":false,"decision":"baseline","notes":"JS color-convert@3.1.3 baseline, N=10,000,000"}
{"ts":"2026-07-14T08:34:20.252Z","commit":"30ad9a9","issue":86,"route":"rgb->apple","tier":"js","input_size":10000000,"metric":"throughput_mpx_s","value":89.04,"ms":112.314,"iters":3,"warmup":1,"host":"vipavani","gpu_present":false,"decision":"baseline","notes":"JS color-convert@3.1.3 baseline, N=10,000,000"}
{"ts":"2026-07-14T08:34:24.013Z","commit":"30ad9a9","issue":86,"route":"rgb->hsl->rgb","tier":"js","input_size":10000000,"metric":"throughput_mpx_s","value":10.86,"ms":920.587,"iters":3,"warmup":1,"host":"vipavani","gpu_present":false,"decision":"baseline","notes":"JS color-convert@3.1.3 baseline, N=10,000,000"}
{"ts":"2026-07-14T08:34:35.545Z","commit":"30ad9a9","issue":86,"route":"rgb->xyz","tier":"cpu","input_size":50000000,"metric":"throughput_mpx_s","value":46.25,"ms":1080.979,"iters":3,"warmup":1,"host":"vipavani","gpu_present":false,"decision":"baseline","notes":"wide::f64x4 SIMD batch, N=50,000,000"}
{"ts":"2026-07-14T08:34:42.868Z","commit":"30ad9a9","issue":86,"route":"rgb->lab","tier":"cpu","input_size":50000000,"metric":"throughput_mpx_s","value":27.75,"ms":1801.687,"iters":3,"warmup":1,"host":"vipavani","gpu_present":false,"decision":"baseline","notes":"wide::f32x8 SIMD two-step chain (xyz→lab), #61 baseline, N=50,000,000"}
{"ts":"2026-07-14T08:34:49.253Z","commit":"30ad9a9","issue":86,"route":"rgb->lab","tier":"cpu","input_size":50000000,"metric":"throughput_mpx_s","value":31.72,"ms":1576.305,"iters":3,"warmup":1,"host":"vipavani","gpu_present":false,"decision":"kept","baseline_ref":"30ad9a9","notes":"wide::f32x8 SIMD fused single-pass (rgb→lab), N=50,000,000"}
{"ts":"2026-07-14T08:34:54.690Z","commit":"30ad9a9","issue":86,"route":"rgb->hsl","tier":"cpu","input_size":50000000,"metric":"throughput_mpx_s","value":36.91,"ms":1354.824,"iters":3,"warmup":1,"host":"vipavani","gpu_present":false,"decision":"baseline","notes":"Rust scalar batch baseline (pre-SIMD), N=50,000,000"}
{"ts":"2026-07-14T08:34:56.116Z","commit":"30ad9a9","issue":86,"route":"rgb->hsl","tier":"cpu","input_size":50000000,"metric":"throughput_mpx_s","value":140.61,"ms":355.582,"iters":3,"warmup":1,"host":"vipavani","gpu_present":false,"decision":"kept","notes":"wide::f32x8 SIMD batch (mask-blend hue), N=50,000,000"}
{"ts":"2026-07-14T08:35:06.964Z","commit":"30ad9a9","issue":86,"route":"rgb->hsl->rgb","tier":"cpu","input_size":50000000,"metric":"throughput_mpx_s","value":20.29,"ms":2463.799,"iters":3,"warmup":1,"host":"vipavani","gpu_present":false,"decision":"baseline","notes":"Rust scalar batch baseline (pre-SIMD roundtrip), N=50,000,000"}
{"ts":"2026-07-14T08:35:10.215Z","commit":"30ad9a9","issue":86,"route":"rgb->hsl->rgb","tier":"cpu","input_size":50000000,"metric":"throughput_mpx_s","value":62.87,"ms":795.327,"iters":3,"warmup":1,"host":"vipavani","gpu_present":false,"decision":"kept","baseline_ref":"30ad9a9","notes":"wide::f32x8 SIMD batch round-trip (rgb→hsl→rgb), N=50,000,000"}
{"ts":"2026-07-14T08:35:13.567Z","commit":"30ad9a9","issue":86,"route":"rgb->cmyk","tier":"cpu","input_size":50000000,"metric":"throughput_mpx_s","value":60.54,"ms":825.962,"iters":3,"warmup":1,"host":"vipavani","gpu_present":false,"decision":"baseline","notes":"Rust scalar batch baseline (pre-SIMD), N=50,000,000"}
{"ts":"2026-07-14T08:35:15.575Z","commit":"30ad9a9","issue":86,"route":"rgb->cmyk","tier":"cpu","input_size":50000000,"metric":"throughput_mpx_s","value":126.30,"ms":395.875,"iters":3,"warmup":1,"host":"vipavani","gpu_present":false,"decision":"kept","baseline_ref":"30ad9a9","notes":"wide::f32x8 SIMD batch (mask-blend black guard), N=50,000,000"}
{"ts":"2026-07-14T08:35:21.700Z","commit":"30ad9a9","issue":86,"route":"rgb->hsv","tier":"cpu","input_size":50000000,"metric":"throughput_mpx_s","value":37.82,"ms":1321.930,"iters":3,"warmup":1,"host":"vipavani","gpu_present":false,"decision":"baseline","notes":"Rust scalar batch baseline (pre-SIMD), N=50,000,000"}
{"ts":"2026-07-14T08:35:23.213Z","commit":"30ad9a9","issue":86,"route":"rgb->hsv","tier":"cpu","input_size":50000000,"metric":"throughput_mpx_s","value":136.64,"ms":365.935,"iters":3,"warmup":1,"host":"vipavani","gpu_present":false,"decision":"kept","baseline_ref":"30ad9a9","notes":"wide::f32x8 SIMD batch (mask-blend hue), N=50,000,000"}
{"ts":"2026-07-14T08:35:45.499Z","commit":"30ad9a9","issue":86,"route":"rgb->oklab","tier":"cpu","input_size":50000000,"metric":"throughput_mpx_s","value":8.99,"ms":5559.683,"iters":3,"warmup":1,"host":"vipavani","gpu_present":false,"decision":"baseline","notes":"Rust scalar batch baseline (pre-SIMD), N=50,000,000"}
{"ts":"2026-07-14T08:35:51.795Z","commit":"30ad9a9","issue":86,"route":"rgb->oklab","tier":"cpu","input_size":50000000,"metric":"throughput_mpx_s","value":31.95,"ms":1564.870,"iters":3,"warmup":1,"host":"vipavani","gpu_present":false,"decision":"kept","baseline_ref":"30ad9a9","notes":"wide::f32x8 SIMD batch (powf/cbrt + dual matrix), N=50,000,000, speedup=3.55x, tol=1e-3"}
{"ts":"2026-07-14T08:35:56.331Z","commit":"30ad9a9","issue":86,"route":"rgb->hwb","tier":"cpu","input_size":50000000,"metric":"throughput_mpx_s","value":45.08,"ms":1109.158,"iters":3,"warmup":1,"host":"vipavani","gpu_present":false,"decision":"baseline","notes":"Rust scalar batch baseline (pre-SIMD), N=50,000,000"}
{"ts":"2026-07-14T08:35:57.706Z","commit":"30ad9a9","issue":86,"route":"rgb->hwb","tier":"cpu","input_size":50000000,"metric":"throughput_mpx_s","value":145.44,"ms":343.794,"iters":3,"warmup":1,"host":"vipavani","gpu_present":false,"decision":"kept","baseline_ref":"30ad9a9","notes":"wide::f32x8 SIMD batch (mask-blend hue, from hsl hue), N=50,000,000"}
{"ts":"2026-07-14T08:35:59.723Z","commit":"30ad9a9","issue":86,"route":"rgb->apple","tier":"cpu","input_size":50000000,"metric":"throughput_mpx_s","value":99.88,"ms":500.604,"iters":3,"warmup":1,"host":"vipavani","gpu_present":false,"decision":"baseline","notes":"Rust scalar batch baseline (pre-SIMD), N=50,000,000"}
{"ts":"2026-07-14T08:36:00.915Z","commit":"30ad9a9","issue":86,"route":"rgb->apple","tier":"cpu","input_size":50000000,"metric":"throughput_mpx_s","value":168.50,"ms":296.743,"iters":3,"warmup":1,"host":"vipavani","gpu_present":false,"decision":"kept","baseline_ref":"30ad9a9","notes":"wide::f32x8 SIMD batch (linear scale x257.0), N=50,000,000, speedup=1.69x, tol=1e-6"}
{"ts":"2026-07-14T09:10:00.000Z","commit":"e74d6f6","issue":19,"route":"rgb->hsl","tier":"cpu","input_size":100000,"metric":"errata","value":922.99,"ms":0.108,"iters":20,"warmup":3,"host":"vipavani","gpu_present":false,"decision":"baseline","notes":"ERRATA: the prior #19 record (ts 2026-07-13T23:43:46.424Z, commit 1a4e607) reporting 922.99 MP/s in 0.108ms for N=100000 is a MEASUREMENT ARTIFACT — the scalar rgb->hsl work was optimized away by the compiler (dead-code elimination), so the timing does not reflect real per-pixel work. Excluded from all rollups/comparisons. The trustworthy rgb->hsl scalar baseline is the #58 batch measurement of 37.13 MP/s (ts 2026-07-14T05:59:...)."}
{"ts":"2026-07-14T09:10:00.000Z","commit":"e74d6f6","issue":19,"route":"rgb->hsl->rgb","tier":"cpu","input_size":100000,"metric":"errata","value":621.2,"ms":0.161,"iters":20,"warmup":3,"host":"vipavani","gpu_present":false,"decision":"baseline","notes":"ERRATA: prior #19 record (ts 2026-07-13T23:43:46.438Z, commit 1a4e607) 621.2 MP/s in 0.161ms for N=100000 is a compiler-elision artifact, not real work. Excluded from rollups/comparisons."}
{"ts":"2026-07-14T09:10:00.000Z","commit":"e74d6f6","issue":19,"route":"rgb->hsl","tier":"cpu","input_size":1000000,"metric":"errata","value":943.77,"ms":1.06,"iters":20,"warmup":3,"host":"vipavani","gpu_present":false,"decision":"baseline","notes":"ERRATA: prior #19 record (ts 2026-07-13T23:44:12.402Z, commit 1a4e607) 943.77 MP/s in 1.06ms for N=1000000 is a compiler-elision artifact, not real work. Excluded from rollups/comparisons."}
{"ts":"2026-07-14T09:10:00.000Z","commit":"e74d6f6","issue":19,"route":"rgb->hsl->rgb","tier":"cpu","input_size":1000000,"metric":"errata","value":946.36,"ms":1.057,"iters":20,"warmup":3,"host":"vipavani","gpu_present":false,"decision":"baseline","notes":"ERRATA: prior #19 record (ts 2026-07-13T23:44:12.443Z, commit 1a4e607) 946.36 MP/s in 1.057ms for N=1000000 is a compiler-elision artifact, not real work. Excluded from rollups/comparisons."}
{"ts":"2026-07-14T09:10:00.000Z","commit":"e74d6f6","issue":58,"route":"rgb->hsl","tier":"cpu","input_size":50000000,"metric":"errata","value":3782.39,"ms":13.219,"iters":3,"warmup":1,"host":"vipavani","gpu_present":false,"decision":"baseline","notes":"ERRATA: the prior #58 record (ts 2026-07-14T05:59:23.785Z, commit df0d690) reporting 3782.39 MP/s in 13.219ms for N=50,000,000 is a MEASUREMENT ARTIFACT (scalar work elided by the optimizer). The correct #58 scalar rgb->hsl baseline used for the keep decision is 37.13 MP/s (ts 2026-07-14T05:59:..., ms 1346.772); the SIMD kept result is 142.1 MP/s (3.8x). This errata does NOT change the #58 keep decision — it was already based on the trustworthy 37.13 baseline, not this artifact."}
{"ts":"2026-07-14T12:00:00.000Z","commit":"5a7fffd","issue":97,"route":"xyz->rgb","tier":"js","input_size":10000000,"metric":"throughput_mpx_s","value":12.9,"ms":776.80,"iters":3,"warmup":1,"host":"vipavani","gpu_present":false,"decision":"baseline","notes":"JS color-convert@3.1.3 xyz->rgb baseline. Measured standalone (bench.mjs harness is rgb-input-centric; xyz->rgb needs xyz inputs generated via rgb.xyz first, untimed). N=10M."}
{"ts":"2026-07-14T12:00:00.000Z","commit":"5a7fffd","issue":97,"route":"xyz->rgb","tier":"cpu","input_size":50000000,"metric":"throughput_mpx_s","value":21.7,"ms":2303.659,"iters":3,"warmup":1,"host":"vipavani","gpu_present":false,"decision":"baseline","notes":"Rust scalar batch baseline (f64 xyz::rgb, materialized Vec to prevent elision), N=50,000,000"}
{"ts":"2026-07-14T12:00:00.000Z","commit":"5a7fffd","issue":97,"route":"xyz->rgb","tier":"cpu","input_size":50000000,"metric":"throughput_mpx_s","value":49.9,"ms":1001.919,"iters":3,"warmup":1,"host":"vipavani","gpu_present":false,"baseline_ref":"5a7fffd","decision":"kept","notes":"wide::f32x8 SIMD batch (matrix + forward sRGB gamma), N=50,000,000, speedup=2.30x vs scalar, 3.87x vs JS, tol=0.1. First INVERSE (X->rgb) SIMD route."}
{"ts":"2026-07-20T08:32:32.316Z","commit":"eaefda9","issue":99,"route":"rgb->xyz","tier":"cpu","input_size":50000000,"metric":"throughput_mpx_s","value":45.51,"ms":1098.543,"iters":3,"warmup":1,"host":"vipavani","gpu_present":false,"decision":"baseline","notes":"wide::f64x4 SIMD batch, N=50,000,000"}
{"ts":"2026-07-20T08:32:39.590Z","commit":"eaefda9","issue":99,"route":"rgb->lab","tier":"cpu","input_size":50000000,"metric":"throughput_mpx_s","value":27.70,"ms":1805.180,"iters":3,"warmup":1,"host":"vipavani","gpu_present":false,"decision":"baseline","notes":"wide::f32x8 SIMD two-step chain (xyz→lab), #61 baseline, N=50,000,000"}
{"ts":"2026-07-20T08:32:45.941Z","commit":"eaefda9","issue":99,"route":"rgb->lab","tier":"cpu","input_size":50000000,"metric":"throughput_mpx_s","value":31.52,"ms":1586.438,"iters":3,"warmup":1,"host":"vipavani","gpu_present":false,"decision":"kept","baseline_ref":"eaefda9","notes":"wide::f32x8 SIMD fused single-pass (rgb→lab), N=50,000,000"}
{"ts":"2026-07-20T08:32:51.538Z","commit":"eaefda9","issue":99,"route":"rgb->hsl","tier":"cpu","input_size":50000000,"metric":"throughput_mpx_s","value":36.37,"ms":1374.778,"iters":3,"warmup":1,"host":"vipavani","gpu_present":false,"decision":"baseline","notes":"Rust scalar batch baseline (pre-SIMD), N=50,000,000"}
{"ts":"2026-07-20T08:32:53.000Z","commit":"eaefda9","issue":99,"route":"rgb->hsl","tier":"cpu","input_size":50000000,"metric":"throughput_mpx_s","value":136.97,"ms":365.055,"iters":3,"warmup":1,"host":"vipavani","gpu_present":false,"decision":"kept","notes":"wide::f32x8 SIMD batch (mask-blend hue), N=50,000,000"}
{"ts":"2026-07-20T08:33:02.666Z","commit":"eaefda9","issue":99,"route":"rgb->hsl->rgb","tier":"cpu","input_size":50000000,"metric":"throughput_mpx_s","value":20.87,"ms":2396.292,"iters":3,"warmup":1,"host":"vipavani","gpu_present":false,"decision":"baseline","notes":"Rust scalar batch baseline (pre-SIMD roundtrip), N=50,000,000"}
{"ts":"2026-07-20T08:33:05.957Z","commit":"eaefda9","issue":99,"route":"rgb->hsl->rgb","tier":"cpu","input_size":50000000,"metric":"throughput_mpx_s","value":62.18,"ms":804.144,"iters":3,"warmup":1,"host":"vipavani","gpu_present":false,"decision":"kept","baseline_ref":"eaefda9","notes":"wide::f32x8 SIMD batch round-trip (rgb→hsl→rgb), N=50,000,000"}
{"ts":"2026-07-20T08:33:09.052Z","commit":"eaefda9","issue":99,"route":"rgb->cmyk","tier":"cpu","input_size":50000000,"metric":"throughput_mpx_s","value":65.66,"ms":761.493,"iters":3,"warmup":1,"host":"vipavani","gpu_present":false,"decision":"baseline","notes":"Rust scalar batch baseline (pre-SIMD), N=50,000,000"}
{"ts":"2026-07-20T08:33:10.564Z","commit":"eaefda9","issue":99,"route":"rgb->cmyk","tier":"cpu","input_size":50000000,"metric":"throughput_mpx_s","value":135.49,"ms":369.017,"iters":3,"warmup":1,"host":"vipavani","gpu_present":false,"decision":"kept","baseline_ref":"eaefda9","notes":"wide::f32x8 SIMD batch (mask-blend black guard), N=50,000,000"}
{"ts":"2026-07-20T08:33:15.594Z","commit":"eaefda9","issue":99,"route":"rgb->hsv","tier":"cpu","input_size":50000000,"metric":"throughput_mpx_s","value":39.72,"ms":1258.803,"iters":3,"warmup":1,"host":"vipavani","gpu_present":false,"decision":"baseline","notes":"Rust scalar batch baseline (pre-SIMD), N=50,000,000"}
{"ts":"2026-07-20T08:33:16.983Z","commit":"eaefda9","issue":99,"route":"rgb->hsv","tier":"cpu","input_size":50000000,"metric":"throughput_mpx_s","value":145.37,"ms":343.955,"iters":3,"warmup":1,"host":"vipavani","gpu_present":false,"decision":"kept","baseline_ref":"eaefda9","notes":"wide::f32x8 SIMD batch (mask-blend hue), N=50,000,000"}
{"ts":"2026-07-20T08:33:38.957Z","commit":"eaefda9","issue":99,"route":"rgb->oklab","tier":"cpu","input_size":50000000,"metric":"throughput_mpx_s","value":9.19,"ms":5441.745,"iters":3,"warmup":1,"host":"vipavani","gpu_present":false,"decision":"baseline","notes":"Rust scalar batch baseline (pre-SIMD), N=50,000,000"}
{"ts":"2026-07-20T08:33:45.154Z","commit":"eaefda9","issue":99,"route":"rgb->oklab","tier":"cpu","input_size":50000000,"metric":"throughput_mpx_s","value":32.30,"ms":1548.099,"iters":3,"warmup":1,"host":"vipavani","gpu_present":false,"decision":"kept","baseline_ref":"eaefda9","notes":"wide::f32x8 SIMD batch (powf/cbrt + dual matrix), N=50,000,000, speedup=3.52x, tol=1e-3"}
{"ts":"2026-07-20T08:33:49.434Z","commit":"eaefda9","issue":99,"route":"rgb->hwb","tier":"cpu","input_size":50000000,"metric":"throughput_mpx_s","value":47.05,"ms":1062.811,"iters":3,"warmup":1,"host":"vipavani","gpu_present":false,"decision":"baseline","notes":"Rust scalar batch baseline (pre-SIMD), N=50,000,000"}
{"ts":"2026-07-20T08:33:50.947Z","commit":"eaefda9","issue":99,"route":"rgb->hwb","tier":"cpu","input_size":50000000,"metric":"throughput_mpx_s","value":152.55,"ms":327.760,"iters":3,"warmup":1,"host":"vipavani","gpu_present":false,"decision":"kept","baseline_ref":"eaefda9","notes":"wide::f32x8 SIMD batch (mask-blend hue, from hsl hue), N=50,000,000"}
{"ts":"2026-07-20T08:33:55.871Z","commit":"eaefda9","issue":99,"route":"rgb->hcg","tier":"cpu","input_size":50000000,"metric":"throughput_mpx_s","value":40.76,"ms":1226.699,"iters":3,"warmup":1,"host":"vipavani","gpu_present":false,"decision":"baseline","notes":"Rust scalar batch baseline (pre-SIMD), N=50,000,000"}
{"ts":"2026-07-20T08:33:57.380Z","commit":"eaefda9","issue":99,"route":"rgb->hcg","tier":"cpu","input_size":50000000,"metric":"throughput_mpx_s","value":134.28,"ms":372.366,"iters":3,"warmup":1,"host":"vipavani","gpu_present":false,"decision":"kept","baseline_ref":"eaefda9","notes":"wide::f32x8 SIMD batch (mask-blend hue + chroma-guard grayscale), N=50,000,000, speedup=3.29x, tol=1e-3"}
{"ts":"2026-07-20T08:33:59.147Z","commit":"eaefda9","issue":99,"route":"rgb->apple","tier":"cpu","input_size":50000000,"metric":"throughput_mpx_s","value":114.05,"ms":438.392,"iters":3,"warmup":1,"host":"vipavani","gpu_present":false,"decision":"baseline","notes":"Rust scalar batch baseline (pre-SIMD), N=50,000,000"}
{"ts":"2026-07-20T08:34:00.263Z","commit":"eaefda9","issue":99,"route":"rgb->apple","tier":"cpu","input_size":50000000,"metric":"throughput_mpx_s","value":180.16,"ms":277.532,"iters":3,"warmup":1,"host":"vipavani","gpu_present":false,"decision":"kept","baseline_ref":"eaefda9","notes":"wide::f32x8 SIMD batch (linear scale x257.0), N=50,000,000, speedup=1.58x, tol=1e-6"}
{"ts":"2026-07-20T08:34:10.215Z","commit":"eaefda9","issue":99,"route":"xyz->rgb","tier":"cpu","input_size":50000000,"metric":"throughput_mpx_s","value":22.48,"ms":2224.382,"iters":3,"warmup":1,"host":"vipavani","gpu_present":false,"decision":"baseline","notes":"Rust scalar batch baseline (pre-SIMD, f64 xyz::rgb), N=50,000,000"}
{"ts":"2026-07-20T08:34:14.115Z","commit":"eaefda9","issue":99,"route":"xyz->rgb","tier":"cpu","input_size":50000000,"metric":"throughput_mpx_s","value":51.68,"ms":967.504,"iters":3,"warmup":1,"host":"vipavani","gpu_present":false,"decision":"kept","baseline_ref":"eaefda9","notes":"wide::f32x8 SIMD batch (matrix + forward sRGB gamma), N=50,000,000, speedup=2.30x, tol=0.1"}
{"ts":"2026-07-20T08:34:21.274Z","commit":"eaefda9","issue":99,"route":"lab->xyz","tier":"cpu","input_size":50000000,"metric":"throughput_mpx_s","value":101.29,"ms":493.634,"iters":3,"warmup":1,"host":"vipavani","gpu_present":false,"decision":"baseline","notes":"Rust scalar batch baseline (pre-SIMD, f64 lab::xyz), N=50,000,000"}
